1,wanted Arya meeting Brienne happen to everyone It was the meeting 
2,unfold Brienne Clegane Tarth Sandor showdown the commentary play-by-play tense Rosenberg Post The opinion blogger Alyssa 
3,die Stark Arya to fight a death the Brienne was justification her pledged that warped exceedingly biffing bodyguard the she 'd mother Arya Stark Catelyn protect to late what daughter her matter no 
5,take Brienne Pod Perhaps can up mantle the 
5,Speaking wonderful Brienne encounter Arya which was 
7,Brienne v !? The Hound 
7,measures shocks the Nothing books the quite up pleasures three the death Stark Ned romance the romcom the western the Bay Blackwater Wedding the Martell Oberyn fourth fifth series the first doomed Jon Snow-Ygritte Jaime-Brienne travel Sandor-Arya Red fighting Mountain the 
8,offer Brienne neither could better much promise the Hound the lasting maybe winter the 
9,lying softened Jaime you 'd be yourself rapist the If scenes the had n't at least opinion your Jaime Brienne Tarth forming friendship a Jaime man a true deep moral 
9,meets Brienne Tarth Hound The finally match his 
9,has beating the Hound The pushes end the Brienne she him cliff the leaves him dead 
1,wanted Arya meeting everyone It happen to was the meeting 
2,Watch unfold showdown the commentary play-by-play tense Rosenberg Post The opinion blogger Alyssa 
3,surprise So it was n't a left that Hound The was die to Stark Arya fight a death the was justification her pledged that warped exceedingly biffing bodyguard the she 'd mother Arya Stark Catelyn protect to late what daughter her matter no 
5,take Perhaps can up mantle the 
5,Speaking which wonderful was 
7,Brienne v !? The Hound 
7,measures Nothing books the quite up shocks the fourth fifth series the pleasures three the death Stark Ned romance the romcom the western the Bay Blackwater Wedding the Martell Oberyn first doomed Jon Snow-Ygritte travel Sandor-Arya Red fighting Mountain the 
8,guess I offer Brienne Hound the could faced Ayra better much promise the was decision an lasting maybe impossible winter the 
9,lying softened Jaime you 'd be yourself rapist the If scenes the had n't at least opinion your Jaime Tarth forming friendship a Jaime man a true deep moral 
9,meets Hound The match his meets Hound The finally match his 
9,has Hound The beating the pushes end the she him cliff the leaves him dead 
