0,realistic Iran must be more talks nuclear Jul 13 said VIENNA BST Sun Britain 2014 pm 6:23 Reuters Hague British Sunday crucial it Iran realistic to Hague | Reuters VIENNA Foreign Secretary William was be more necessary what is reach to deal a powers six nuclear major end that would sanctions Tehran exchange curbs work its atomic 
0,are counterparts their they Vienna help to reach week a French German break deadlock a before deadline a to agreement an negotiations the nuclear 
1,make Iran to choices critical N-talks 
1,pressed Secretary US counterpart his Monday make to cut days six Kerry State choices critical before deadline a to deal a John historic dispel that would finally fears drive Tehran nuclear 
1,holds Zarif foreign meeting a bilateral Secretary US minister Javad Kerry State John 
1,said AP Going day a aimed Kerry gauge to official a Zarif Foreign second negotiations Vienna willingness make to senior US Minister Mohammad Javad choices the critical needs it make to 
1,were appeared Zarif there still difficult seven be to telling media days tough discussion in for haul the too Sunday long 
1,kill accord The would off fears good develop that mooted might weapons nuclear guise the decade a programme its tensions rising civilian threats war 
1,denies seeking bomb the wants lifting the atomic sanctions all crippled which UN Western have economy its 
1,negotiating members The have been non-stop almost sealing accord an five permanent Council the months interim November froze which UN Security Germany enrichment its return for $ billion 7 uranium relief sanctions 
1,met But talks the nail to have points major particularly dismantle much how down treaty a sticking to programme nuclear full 
1,have Zarif will come to up deal a satisfies that leaders hardline is while Kerry pressure Congress elections November concede not mid-term to much too 
1,had States The have not ties diplomatic United decades three making talks the face-to-face diplomats the two top remarkable more all the 
1,said is It Steinmeier Germany now up Iran decide to hope I Frank-Walter take to left that path the days the enough will cooperation be create to reflection some Tehran 
1,is ball The court 
1,said Hague Britain important it was Foreign Secretary William very realistic to be more 
1,want powers The reduce to dramatically wants while six scope the Tehran expand to programme its it enrichment 
1,opposed Israel action East the sole is enrichment any if state undeclared Middle refused which nuclear armed Washington has rule to out military 
1,warned Netanyahu Israeli Sunday catastrophic that Prime Minister Benjamin deal any would be nuclear leaving capability the pursue to activity this 
1,sticking Araqchi negotiator was publicly position Iran Abbas enrichment called which clear rational he 
2,Posted talks Iran VIENNA Shoaib-ur-Rehman unclear fate The nuclear uncertain Tuesday Kerry Siddiqui was Tuesday days two talks nuclear 15 July 2014 10:04 push talks tough very Iran powers world Secretary US counterpart his Kerry State Iranian Vienna John 
2,said are We Kerry capital the middle the negotiation reining programme Austrian talks proliferation nuclear it is a tough really tell I will you 
2,working said He we are hard very later talks the working We Zarif Foreign are Minister Mohammad Javad 
2,Sunday deadline The is expires when members the accord an five permanent Council the get to interim November UN Security Germany deal a 
2,extended This can be allowing continue sides both has agree only to talking make to if sides both insists Washington concessions major first 
2,set talks The were however continue to go may entered which officials lower-ranking down wire the sixth their July 3 point the round final July 20 cut-off 
2,kill accord The would off fears good develop that mooted might weapons nuclear guise the decade a programme its tensions rising civilian threats war 
2,denies seeking bomb the wants lifting the atomic UN crippling sanctions Western 
2,want powers The reduce to dramatically says years 10 at least six scope programme its Washington agree inspections more nuclear intrusive UN 
2,wants But expand to facilities its insisting peaceful they nuclear are purely has that it right the perfect do to so 
2,are sides Both also wary giving away too pressure intense hardliners domestic both Washington are elections midterm both much November US 
2,opposed Israel action East the sole is enrichment any if state undeclared Middle at all refused which nuclear armed Washington has rule to out military 
2,warned Netanyahu Israeli News Fox Sunday catastrophic that Prime Minister Benjamin deal any would be leaving capability the pursue to activity this 
3,is Another Russia provide to stored stockpile the fuel years several advance overcome to would be safeguards IAEA Bushehr doubt any reliability supply 
3,building Arak years 12 than more has been reactor a Arak close which heavy water is now completion 
3,refuses scrap to saying invested it project the has lot a it building plant a time money nearby heavy water production 
3,undertake would build not to facility a extracting plutonium the reprocessing exported which would be part fuel the spent 
3,said officials have working they are already direction that 
3,resolved work Past has not been weaponisation believe question The had whether programme a large-scale develop to technologies making warhead a agencies most until at least Western intelligence 2003 
3,dealt matter The is being with outside talks the series a linked issues the main meetings visits are inevitably two IAEA officials 
3,hard It would be imagine to concerns as deal a questions the it issue the comprehensive programme work the fundamental transparent whether past development settled being trusts the Iran to be activities its international community nuclear 
3,balk Iranians may this is as touchstone their treated to be state any other 
3,going chip Sanctions Sanctions governments Western are find to is the main bargaining have powers the one it relief hard it hands their table the six is issues the placed having take to negotiating thorniest sanctions them off 
3,gone years the US the EU have measures agreed UN the built up tangle a doing business interlocking restrictions overlapping punitive 
3,grant president The can waivers temporary impress but tricked being US that does not Iranians wary who are 
3,go Buying oil gas would way a rescuing economy country the held unfreezing $ an long would as abroad revenues Iranian estimated 100 billion allowing insurance shipping Iranian oil 
4,held counterpart his he talks good serious raced as Iranian Monday sides the gaps narrow week deadline a reach to two wide programme Tehran July 20 deal a nuclear a than less 
4,met Seeking push to Kerry Zarif Mohammad make to Javad day a choices critical activities its second running sides both disputed atomic complaining gatherings the made that progress scant had been 
4,said Washington House the White engaged had had yet make to powers Western necessary decisions the way a prove to serious peaceful that programme the was 
4,said Earnest Spokesman assessing he was return would Josh asked authorised whether positions States the make to Kerry was extend to United recommendations Obama President deadline the Barack proceed how to 
4,said official A had Ashton Kerry meeting a senior U.S. State Department lengthy productive required that coordinating who Zarif work more was is discussions powers six States the world United 
4,is priority get to sanctions damaged that have severely lifted economy its soon as possible oil-dependent 
4,said differences the diplomats some experts have deal a July 20 unlikely is issues pivotal need that capacity enrichment sides the will extend to large still period the negotiating 
4,said meetings Monday official a senior wanted Kerry State Department gauge to willingness make to choices the critical needs it make to 
4,echoed said Kerry view a Iranian were Sunday officials other there still differences substantial Western 
4,said Earlier official a senior sticking was U.S. positions unworkable inadequate 
4,kept history A has suspicions international programme nuclear hiding work sensitive high heightened risk the inspectors U.N. nuclear fail should war a diplomacy yield to new Middle East settlement a long-term 
4,size issue The say diplomats talks the is the programme future thorniest enrichment 
4,have Iranians would budge to on issues the quickly very key 
4,included agreement A provision a lengthening talks agreement a agree if Nov. 24 preliminary out January next permanent as far sides all 
4,said officials Western have include that hurdles major enrichment stockpiles material nuclear research its suspect that answering questions inspectors U.N. past atomic powers Western linked was analysts weapon-making 
6,are But there factors other 
6,condemns Khamenei Supreme fiercely interference U.S. Iraq outweigh which Leader Ayatollah could pressure American Maliki 
