3,said Atmospheric The located Glenda was Philippine Geophysical Administration Astronomical kilometers 480 Services west City Dagupan a.m. 8 
3,said Aurelio PAGASA interview an expected LPA the weather Aldczar ANC is enter to PAR hours 24 
3,said PAGASA Manila Metro Luzon Central CALABARZON Provinces the Palawan La Union Mindoro 
5,said bulletin a Atmospheric the Philippine located depression the Geophysical Administration Astronomical was kilometers 990 winds maximum tropical Services east Mindanao Northern sustained kilometers 45 hour 
5,said Perez weather has depression the chance a affect it forecaster Chris high tropical developing storm a will not directly country the tropical 
5,said courtesy Satellite named system the image Perez Pagasa will be locally Henry enters once new weather it sea the Philippine 
5,said cloudy rest The will be partly skies cloudy country the rainshowers isolated thunderstorms 
5,said Pagasa prevail winds strong moderate will Luzon blowing southwest the to to south 
