0,wants He lead to us Coach said Blatt want we keep to going 
1,congratulated Join 6 Cavaliers 2015 Cleveland forward James LeBron 23 is Blatt coach making shot a Conversation Nation the David quarter the game four find To third Hawks the Finals the out more Facebook commenting reaches read please Atlanta Eastern Conference Playoffs the Zillgitt fifth Sports USA May 26 Hawks Guidelines the NBA Arena Quicken consecutive NBA Finals Jeff TODAY EDT 11:16 sweep Cavaliers James LeBron Conversation FAQs Loans p.m. 
2,go It did n_t exactly Blatt David left who family his Israel take to job Cavs the 
2,cracked _re We Cleveland 
4,continued But transformation the postseason the needed as James put performance together arguably his impressive most assists coming three coach a shy averaging double a rookie NBA plenty success international games the carrying roster a triple Blatt four hobbled 
5,go It did n_t exactly Blatt David 
5,cracked Were Cleveland 
6,coaching Blatt meanwhile was still Israel ago months 12 
6,said try I pregame just involved not to get feel what I this what I am in all 
