0,Court the Supreme 
0,allowed Court The exception an mandate Obamacare offer that firms size a insurance their certain staff includes that contraception free 
0,ordered Court the July 1st courts lower Supreme revisit to four the objections set a raised Lobby Hobby broader contraceptives 
1,opens Court The floodgates the Supreme Post The dissenters the Washington take It liberal charged did n't long conservatives the show to Court the goes that Supreme decision their than farther Alito Justice case the professed wrote when Hobby Lobby he it 
1,granted Court the Yesterday injunction an College Wheaton college a Illinois have so emergency Christian that college the would n't endure to burden the filling out form a certifying objections their contraception 
1,sparked justices Court the move The dissent a three female wrote which blistering they believe Those bound who take they are decisions our usually can us word our 
1,shows Court the photo Supreme Washington 
1,says Court this go government the should n't accommodate to belief this particular religious 
1,want majority Court the as might believe to based rulings their are principles abstract apply that would anyone think if you working they 'd be hard so accommodate to claims the privilege Muslims Hindus have that members groups religious conservatives the do not affinity such for five Court the an 
1,applies reasoning Court the whether actually situation your care because Court the does n't 
1,provided religion it 's the right belief a abhorrence an contraception shares Court the conservative majority 
2,supports ruling Court the that position government the organizations religious-oriented favor claims the Supreme disputes separate nonprofit religious Lobby Hobby ongoing businesses other for-profit 
2,response filing Wednesday was administration the first legal decision the court Supreme Monday allowed that assert Inc. Oklahoma-based to claims religious avoid to Hobby Lobby businesses other covering some contraceptives all plans employee health 
2,granted hours just Monday request one Network the decision the Court the such Alabama-based Eternal Word Television Hobby Lobby 11th U.S. Circuit Appeals Atlanta 
3,gives Court Supreme corporations Monday CSMonitor.com rights not On struck Court the people more down part a ruling have that Supreme key Act the corporations privately-owned do n't offer to Affordable Care employees their coverage contraceptive conflicts that beliefs owners the religious corporate 
3,bestowed Court The freedom religious corporation their leap a logic freedom absurd giving corporations speech 
3,obliviousness problem The is Court imbalance the deeper growing power economic corporations people real 
3,ignored Court the giving companies rights the receive to right the employees services those offer not employees services contraceptive mandated otherwise law 
3,rendered decision Court the imbalance The United Citizens granting corporations same power freedom speech perverse so 
3,trumped Court the 1930s the legislation New make to early Deal freedom contract right the deals whatever presumed people want they unencumbered regulations federal 
3,expand Court the to pack it appointees his own 
4,expanded Court The has already decision Hobby Supreme Lobby wasted Court Los time no delivering message a wrong You Angeles Times The Supreme anyone thought who 're limited ruling its was objections religious coverage methods purported Hobby Lobby abortion 
4,turned Court the But has now claims belief subjective loophole an Supreme enormous 
5,hiring Early order | day Often Just a ruling Court the Hobby Lobby Supreme 
6,agree ruling Court the Lobby The Americans Decision do n't case the U.S. Supreme Hobby Hobby Lobby 
6,finds aftermath the survey the satisfied Republicans immediate zones the HuffPost/YouGov far more Democrats court the rulings Court Supreme buffer favor Lobby Hobby against clinic abortion 
6,approved performance Court the they whole a to percent just Supreme 37 Democrats percent 33 independents 
7,is aspects the Lobby Hobby Photo made that galling ruling Monday case the Get When it muddle a Supreme Court Hobby Lobby contraception Corporations Things Both Ways July SAMUELS DOROTHY pm 2014 concept the pmJuly 3:28 2 2014 J. 3:38 longstanding separateness corporate 2 
8,Need Court Forbes You Know The Supreme announced 
8,make justices five decision the male Court the win that Supreme note women zero Lobby Hobby would case their 
9,Shows Regulations Supreme Ruling Hobby Court Will Undermine Commerce News US Lobby is have While ruling yesterday not really contraception exercise the it will effects contraception Supreme Court case the free religion exercise the Hobby Lobby free religion 
9,construed protests Justice Therefore ca n't possibly be allow to Samuel Alito Court the case the raise businesses to objections religious covering employees their vaccines transfusions blood complying laws anti-discrimination 
9,Gets tut-tuts Court Lobby Hobby Day Its hard it -RSB- Alito possibility such 's see to a why 
11,2014 rulings Supreme ignites SCOTUS Obamacare fight contraception POLITICO.com much So comeback the Obamacare 
11,handed Court the seemed Just opponents Obamacare victory their Supreme when law the be to finish a background the biggest legal yet health care place a big season the better enrollment embarrassments the early fading 
11,ruled Court the that has overreached that Supreme administration the one controversies the Obama sensitive most cultural politics modern 
11,makes decision Today clear trample that Supreme Court administration the can not freedoms the Obama religious hold that Americans dear 
11,overrule Court the did administration the 2012 making expansion law the Supreme Obama Medicaid optional states the 
11,carved Court the once has out exception a Supreme religious control birth 
12,charging Court the Breitman Kendall chairwoman Committee the is turning back dial the Supreme Schultz POLITICO.com Democratic National rights women Rep. Debbie Wasserman ruling its contraception Monday 
12,handed Court the after down ruling a Supreme Lobby Burwell Hobby says that claim companies for-profit can right a opt to religious covering forms certain employees families their control birth 
13,called disturbing ruling Court the blasts Hillary deeply case the Supreme Clinton ruling Hobby Glueck Katie contraception-related Hobby Lobby Lobby Clinton POLITICO.com Hillary Monday 
13,ruled Court the after have that Supreme employers for-profit do n't provide to coverage contraception mandated Obamacare have if they objections religious 
13,weighed ruling the O'Malley Maryland Democrat another also in tweeting have woman No Supreme Court Gov. Martin expressed who should decisions her has interest clear run a health care made boss her 2016 
14,fight rebuke the to head birth court the Supreme Court requirement Obamacare control contraception coverage Monday even as round a second fights legal 
14,decided Court the Since going it Supreme was not protect to access women care health 
15,decrying ruling Court the Democrats POLITICO.com may be believe strategists party the Hobby Lobby Supreme use they campaign can it benefit their elections year this midterm 
15,followed Court the Today lead Gardner Congressman putting boss woman a Supreme Cory charge decisions her family planning 
15,arguing winner that decision Court the was a political Supreme 
16,force rules Supreme ca n't cover employers some Court provision ObamaCare to ruled Court contraception Monday cite that | Fox News The Supreme certain held closely can objections religious opt in businesses for-profit order to requirement a provide to ObamaCare coverage free contraceptive employees their 
16,brought challenge The was Oklahoma Lobby City-based Supreme Court maker a Hobby furniture Pennsylvania Corp. Conestoga Wood Specialties 
16,work methods The can conception devices issue those Court the were say plaintiffs the Supreme 
16,stop men five that deciding happens what Court the women Supreme 
16,undermine ruling a that could laws governing immunizations taxes Social Supreme Court favor businesses the wages minimum Security 
17,issued Court the Monday decision its Supreme 5-4 Hobby Lobby recognized which right corporation a offer to religious family-owned not contraception plans mandated Act the insurance Affordable Care health its employee 
18,ruled Court Supreme Court the Monday applies that rights Religious SFGate victory a businesses conservatives religious U.S. Supreme law a corporations most control trump historic federal freedom-of-religion for-profit invoke which birth can deny it to coverage birth control employees their female 
18,invoked ruling the as persons rights certain 2010 Supreme Court allowed that right the spending unlimited causes political speech free corporate 
