8,said try Prosecutors Richardson partner a will pressure to law Harris Wiltshire Melgen Mr. discussing donations the Grannis campaign flights jet vacations fancy showered he Menendez Mr. deal a exchange keep that would him system the lessen charges the prison leveled that have been him 
8,said conversation against What Richardson it -s certainly a him they have doctor the 
9,said Levchuk attorney now Massachusetts a defense Richardson firm Bulkely 
8,said try Prosecutors Richardson partner a will pressure to law Harris Wiltshire Melgen Mr. discussing donations the Grannis campaign flights jet vacations fancy showered he Menendez Mr. deal a exchange keep that would him system the lessen charges the prison leveled that have been him 
8,said conversation against What Richardson it -s certainly a him they have doctor the 
9,said Levchuk attorney now Massachusetts a defense Richardson firm Bulkely 
