0,PTI Breaking News More More bar May 27 BEIJING AM points Times HI unveiled Amid escalating tensions 2015 05.43 IST RELATED China Tuesday strategy an US the military assertive enhancing reach its Sea disputed shores its naval time the South China pose which first protection open could challenge a Navy the especially Ocean the seas Indian Indian 
2,outlined n NAVY SOUTH strategy a boost to announced plans likely developments large570BEIJING China CHINA SEA CHINESE reach its Tuesday construction the escalate to naval lighthouses two tensions region a waters disputed jittery already ambitions Beijing maritime 
5,lodged said PHOTO BEIJING it had complaint a plane a China Monday May 25 Reuters States the US spy flew that United parts Sea the disputed South China row a diplomatic fuelled that has tension economies world the two largest 
1,comes Focus A rise as tensions Continued document the posture China engaged where South China Sea The assertive increasingly waters the has reclamation land disputed Sea the archipelago the South China Spratly 
2,escalate region a to tensions jittery already ambitions Beijing maritime 
2,declined spokesman A make to comment a said urged Washington U.S. State Department specific paper the use to Chinese strategy capabilities its manner a military conducive that is maintaining peace stability region the Asia-Pacific 
4,added article The want that does have but not conflict a US the were if we accept to it come to it 
5,said Times The tabloid a owned newspaper Party the inevitable war nationalist Global Daily People the official ruling Communist was China States the stopped unless United Washington demanding halt building the islands artificial waterway the disputed 
