0,pose Navy the which could challenge a especially Ocean the Indian Indian 
0,higher world the budget China annual is far _s largest standing army troops million 2.3 defence dol over 145 billion year this 
0,highlights point view paper the white domains four critical security ocean the space outer cyberspace weapons nuclear 
0,pose plans China could challenge a Navy make to major navy the navy a blue water 
0,updated Sea http:__timesofindia.indiatimes.com_followceleb.cms?alias=South protection open seas Stay go the China Times App News 
0,enter Please details your account User Name Across Trending Times Find Topics offensive this comment 
