0,smiles Schools Favorite activity an organized keeping How team May Tuesday James is Manziel Browns 26 2015 Ohio Berea Johnny Manziel trouble Johnny Manziel Cleveland Browns quarterback Johnny 
0,spent quarterback Browns The weekend the Cleveland babysat teammates reformed supposedly circle James inner including Carter business second-year partner Maverick 
0,partners Carter are LRMR firm the marketing represents that Manziel 
3,partner Carter is the business friend Cavaliers star James runs who represents which LRMR the Manziel marketing firm 
4,taking Ihedigbo Detroit is approach a attending sessions Lions the Lions safety different show a to report the OTA faith 
7,friends Manziel is good James 
7,said Whitner guiding Carter Maverick friend close adviser business is Manziel tries as quarterback the get to Browns life his order 
9,replace sports Motor will Hinchcliffe doubleheader weekend this Detroit Daly Conor 
10,grace James Cavs the will one covers the three regional Illustrated Sports week later this 
10,super-human Even James seemed almost performance his night Sunday 
