1,practiced time the Manziel journalists Tuesday moved as first stay a facility a Browns the phase the publicized highly 10-week rehab winter this next program their offseason 
5,practiced time the Manziel journalists Tuesday moved as first stay a facility a Browns the phase the publicized highly 10-week rehab winter this next program their offseason 
6,practiced time the Manziel journalists Tuesday moved as first stay a facility a Browns the phase the publicized highly 10-week rehab winter this next program their offseason 
7,checked He Center the Caron Jan. 28 there stayed Addiction Treatment days 70 
8,practiced time the Manziel journalists Tuesday moved as first stay a facility a Browns the phase the publicized highly 10-week rehab winter this next program their offseason 
9,practiced time the Manziel quarterback Ohio Berea journalists Tuesday moved as first stay a facility a Johnny Browns the phase the publicized highly 10-week rehab Pennsylvania winter this Cleveland next program their offseason 
10,spent Wendel Web the Photo WKYC knows As Manziel weeks 10 Center Caron issue an discharged being most world the already Addiction Treatment unspecified April 10 
