0,Enter City State Code Zip 
0,apply Rules content all upload you submit otherwise site this 
1,forced Manziel enter who also throw short a returned touchdown a will camp training backup McCown intercepted that was Williams K’Waun 
1,seen has it 
1,said demanding It _s lot a think I things time emotionally understanding he your effort _s embracing that he _s that key that _s the 
2,Enter City State Code Zip 
2,factor acknowledges Mack Favorite will be a talks if Shelton Danny winning Schools Browns comments Alex he stays goes Mike Pettine pick talks Pettine Browns overall practice the OTAs Browns head coach Mike first OTAs Manziel Johnny McCown absence the No. 12 
2,finished He second College William Mary sacks 27 11 season last _s career 
2,constitutes Best Registration cleveland.com acceptance Agreement our powered cleveland.com Privacy on use site this User is Co. Dealer Policy Publishing Group Northeast Ohio Media 
2,apply Rules content all upload you submit otherwise site this 
3,worked struggling field the Manziel offense the opened when rookie a year last spending then second-team OTAs commanded while weeks 10 than more projected McCown Josh unit the offseason this first facility an inpatient rehabilitation specializing treatment alcohol drug addiction 
3,Coach said Pettine Mike gave staff the Manziel nod the begin to OTAs Shaw Connor based the Lewis Thad depth chart came how program the guys those phase two offseason conditioning 
3,said day Johnny it _s one time a 
3,Visit Journal the Akron Ohio www.ohio.com Distributed Agency Tribune Akron Beacon LLC 
4,organized activities team from around league the backup the updates OTAs other primary McCown Josh 
4,opened McCown agent workouts taking reps acquisition Josh starters the worked while Manziel second-year team the to Cabot Mary player Johnny second Kay Dealer the Cleveland Plain 
4,expected was always starter to expected Manziel be the is challenge to McCown job the point some 
4,has Cleveland also Lewis Thad Shaw position the quarterback 
4,riding lot A is Carr utilize to so surprising it make Crabtree Michael _s not cautious team the to Raiders the force a Cooper Amari is being injury his strong offensive 
4,have We Guidelines our own SBNation.com 
4,Agree I Community Guidelines Join SBNation.com member You participate to must be a SBNation.com 
4,have We Guidelines our own SBNation.com 
4,Agree I Guidelines the Authenticating Great 
5,forced Manziel enter who also throw short a returned touchdown a will camp training backup McCown intercepted that was Williams K’Waun 
5,seen has it 
6,Posted Advertisement BEREA May Tuesday AP Ohio looked for Sports Writer Houston Newspapers 26 2015 pm 8:10 sporting haircut a Manziel Johnny much pretty helmet his tighter same the orange 
6,forced Manziel enter who also throw short a returned touchdown a will camp training backup McCown intercepted that was Williams K’Waun 
6,seen has it 
6,said demanding It _s lot a think I things time emotionally understanding he your effort _s embracing that he _s that key that _s the 
7,said month Earlier Pettine dividing Manziel this was reps evenly Shaw Lewis Thad 
8,forced Manziel enter who also throw short a returned touchdown a will camp training backup McCown intercepted that was Williams K’Waun 
8,seen has it 
8,said demanding It _s lot a think I things time emotionally understanding he your effort _s embracing that he _s that key that _s the 
9,replace sports Motor will Hinchcliffe James Detroit Daly doubleheader weekend this 
9,put Contador Alberto on demonstration a pass the extended lead his skills his steep Mortirolo stage the climbing 16th d_Italia the Giro 
10,Join 1 think Conversation find To you would are eyes all out more Facebook commenting read please Cavs the eyes Guidelines the watching some Most Cavs LeBron Conversation FAQs are Wendel Manziel seal tonight Kim EDT 4:05 May 26 WKYC Wendel Web the may deal the sweep a p.m. 2015 is Wendel reporter_producer take commentary news the Hawks the Kim Manziel Johnny continue As day the Atlanta Cavaliers the march their Finals the Cleveland NBA 
10,open He _ll camp quarterback Cleveland No. 2 McCown 
10,like I need Browns the play to QB the best have they 
