0,said -LSB- taken Carter has Whitner safety Cleveland.com day the -RSB- responsibility a making sure Donte first activities organized big doing Johnny _s team Tuesday things all the right 
0,has spotted When he usually Haden teammates keeping him out compromising photos Manziel has been public since then Joe Carter conscience a trouble wingman a 
0,said have We do n_t really say to anything 
0,says grasped Manziel finally has hurting how image his was career his partier a 
0,said First all guy Johnny young very a 
1,said understands He Whitner safety Donte mistakes the made that so taken he he _s _s steps the try to proper keep to himself trouble 
1,is said arrives when car Manziel usually lot the he leaves headquarters Browns parking 
3,works Manziel offense Browns second-team noticed he OTAS Published Modified NewsOK May 26 Browns monitoring Whitner safety _s is car a 2015 pm 8:27 May 26 has been lot the headquarters team Donte usually earlier there specific • Published 2015 Ohio Advertisement main parking weeks recent later others the BEREA 
3,said taken He Tuesday practice the _s steps the takes that first activities organized it quarterback to team be a good 
3,declined Manziel address to media the spoke Trophy the practice dedication winner former Heisman renewed 
3,said Johnny _s young a very guy 
3,revealed instrumental Carter native Akron has been attempt Manziel Maverick piece to life his together career 
3,said taken Carter -LSB- has -RSB- responsibility a making sure big doing Johnny _s things all the right 
5,said understands He Whitner safety Donte mistakes the made that so taken he he _s _s steps the try to proper keep to himself trouble 
5,is said arrives when car Manziel usually lot the he leaves headquarters Browns parking 
6,said understands He Whitner safety Donte mistakes the made that so taken he he _s _s steps the try to proper keep to himself trouble 
6,is said arrives when car Manziel usually lot the he leaves headquarters Browns parking 
7,said have We Whitner Donte practice do n_t really say to anything 
7,said guiding Carter Maverick friend James is Manziel tries as close adviser business quarterback the get to Browns life his order 
7,said taken He _s responsibility a making sure big doing Johnny _s things all the right 
8,said understands He Whitner safety Donte mistakes the made that so taken he he _s _s steps the try to proper keep to himself trouble 
8,is said arrives when car Manziel usually lot the he leaves headquarters Browns parking 
9,said understands He Browns safety former Whitner Donte mistakes the made that so taken he he _s _s steps the try to proper keep to himself trouble 
