1,forced Manziel enter who also throw short a returned touchdown a will camp training backup McCown Josh intercepted that was Williams 
3,intercepted Manziel connected Smith wide Williams Manziel route an coverage the receiver Rodney out intended Hawkins Andrew Williams K’Waun session a completion a seven-on-seven long drill a one-on-one 
5,forced Manziel enter who also throw short a returned touchdown a will camp training backup McCown Josh intercepted that was Williams 
6,forced Manziel enter who also throw short a returned touchdown a will camp training backup McCown Josh intercepted that was Williams 
7,was pass Another Hawkins Andrew picked off Williams defensive back 
8,forced Manziel enter who also throw short a returned touchdown a will camp training backup McCown Josh intercepted that was Williams 
