1,oversees CONCACAF aspects all soccer international America North Caribbean America Central 
2,said Times The focused much enquiry the was region the CONCACAF governs which soccer America the America Central Caribbean North 
4,includes Concacaf stands which countries major States the Mexico ones also Confederation North United tiny Barbados Montserrat America Central Football Association 
4,resigned Warner Credit positions his FIFA Concacaf association his 2011 evidence mounting Arnulfo Franco_Associated Press Mr. national part that he had been attempt an buy to votes the FIFA the officials federation 2010 election presidential 
6,comes He from islands the as well as holds also vice-president being Cayman Fifa role the president CONCAF Confederation Central president CIFA America North Football Association Association Cayman Islands Football 
7,spoke Swiss The briefly reporters hurried being 79-year-old arriving hotel a building the meeting a Zurich delegates confederation the comprises which CONCACAF north countries central islands the American 
