0,face Let know friends network your extradition reading what social you are Officials arrested Zurich 
0,face Post officials Facebook extradition U.S. charges federal FIFA arrested charges corruption request Officials arrested Zurich 
0,arrested request Rogers U.S. Conversation Nation the charges corruption Sports USA May 27 Martin find To TODAY EDT 3:33 2015 out officials more Facebook commenting please read Guidelines the a.m. FIFA FAQs Conversation 
0,taken to FOJ the action the was request the specific authorities American legal investigation an led Office Attorney the District the Eastern York New 
0,read issued warrants FOJ The statement FOJ the claimed which were further request a authorities the arrest suspect investigators dispersal the illegal involving dating rights media dol more as far 1990s the marketing sponsorship than 100 million bribes kickbacks back early 
0,expected Lynch Attorney Comey FBI director Weber IRS were announce to to Journal the General Loretta James criminal chief Richard extent the Brooklyn Wednesday morning Wall Street case the criminal 
1,charged arrested AP Abayov Photo_Tsafrir them accepting bribes officials Six were authorities Swiss extradition face prosecutors federal kickbacks as back far 1990s the soccer Wednesday early U.S. early 
1,said FOJ The statement a carried payments suspect that agreed that prepared U.S. the out banks U.S. authorities officials the crimes the were to six received having paid bribes totaling millions dollars 
1,quoted struck We Times The official a saying _re went long just touched how law enforcement this on for how it part nearly every did what FIFA 
1,reported CONCACAF itself authorities tax 2012 
1,paid Then based in York New organization the had not taxes years several president when general Blazer Chuck Warner Jack was its was its secretary U.S. Trinidad Tobago 
2,face ZURICH U.S extradition 
2,released Office The FOJ statement a saying suspected officials the Swiss Federal Justice were investigators received having six named who paid bribes were not formally totaling millions dollars 
2,said Times The citing officials anonymous include charges the New York law enforcement decades laundering racketeering federal fraud wire span two misconduct world soccer money governing body 
2,said expected Prosecutors Journal the Wall report a announce to Street separate case the office attorney the conference a leading which Brooklyn news is investigation the Wednesday 
2,said expected Lynch U.S. WSJ the Bureau Federal were appear to Attorney General Loretta Comey Investigation Weber Internal Brooklyn announce to Director James Revenue Service criminal chief Richard case the 
3,face U.S. to charges corruption Perez Evan Prokupecz Shimon Payne Ed 
3,said agreed to prepared carried payments Office the request U.S. crimes these were U.S. the were out banks U.S. Swiss Justice 
3,accelerated investigation The distanced after prosecutor former U.S. Garcia Michael himself claims FIFA hired who finding corruption no was FIFA do to investigation an internal 
3,establishing Part Jurisdiction is jurisdiction U.S. crimes alleged issues issue the legal occurred that authorities largely States the United 
3,believe However prosecutors aid reach the ability their broad tax regulations banking bring to charges the 
3,claim addition authorities jurisdiction largest because market the billions paid networks U.S. is the Cup the American television World 
