0,gave later batters Three single a Franco Maikel Phillies the run the Torres go-ahead 
2,singled out One later Franco third off Torres Carlos baseman Makiel 
3,singled Utley Chase off Torres moving Galvis third 
3,called Howard Ryan would be out strike a picked Franco Maikel low third him up single a left off 4-3 pitcher Mets the fourth inning the Torres putting Phils the up 
7,capped Franco Maikel rally a four-run eighth the Torres gave that RBI a single Phillies the lead a two-out 4-3 
9,singled Franco Maikel off Torres drive to go-ahead the run ball a field left one-out ground 
