0,ask But Mets the could not more any deGrom tossed who gem another night Tuesday Field 
1,look deGrom Jacob reigning Rookie National did n_t pitcher a leave to League Year the ready anywhere premises the near playing Field wrapped when he up inning his night last seventh work Phillies the 
1,try They _ll avoid to sweep their Field matinee a Mets the today second season the 
2,won it tied Flores RBI a edged as game the night two-out single inning the Mets the Phillies the Field Citi fly a 10th Philadelphia 5-4 sacrifice inning the Tuesday eighth 
3,did So everyone else thrilled most them allowed that Flores Wilmer two-out walk Mets the single Araujo left off to off win with Elvis 5-4 a Phillies the Field 
4,scored Phillies The runs four top the take to inning the lead a Mets the innings 10 eighth one-run loss Tuesday Field 5-4 
7,improved Mets The 19-6 Field start the blew after best home history team deGrom Jacob bullpen the lead a eighth the three-run 
7,cruising Working start another deGrom was lead a put before dazzling Field 3-0 eighth the singles consecutive runner a base second time the night all one-out Phillies first 
9,lined Flores single a Araujo Elvis give to inning the Mets the walk-off a 10th 5-4 win Phillies the Field 
9,straight It was 26-21 the second win Mets the go who sweep their Field Wednesday second series Phillies the 19-29 
10,made That deGrom footnote an smaller even night the ended that Mets a Field 10-inning 5-4 victory 
