2,rewarded He was finally hit a field left-center 10th the trotted as laced when Lagares fielder home he pitch the Juan singled who first saw he leading off Araujo left-hander leaping Galvis shortstop inning the Elvis Freddy Gomez right-hander 0-1 Jeanmar 
3,heads Lagares Juan as 12 plate home hit after Flores RBI an inning the May 26 York New single to tenth game a 2015 baseball Tuesday the Philadelphia Phillies 
3,turned Sandberg left-hander the rookie gave after Gomez Jeanmar up leadoff a single Lagares 
3,got being inning the Duda drove later batters two deliver to grounded when Cuddyer more two field left single RBI an Lagares forceout a hit a later batters two broken-bat 
4,started 10th the pitched Gomez Jeanmar served when ninth the he up single a Lagares Juan 
7,led Lagares off 10th the single a Gomez Jeanmar 0-1 walked before Araujo Elvis Duda Lucas 
8,went gave After Sandberg Araujo rookie Gomez Jeanmar up leadoff a lefty Elvis Duda lefty-hitting single Lagares Lucas 
9,said celebrates Granderson Curtis deGrom watching drive Flores scoring run a third 10th the single Lagares feeling It inning the _s definitely a good first 
