0,ended choking up Mets the finally night a celebration a mobbed where lead a falling behind by one tying then dizzying happy field center teammates Flores hit his three-run inning the score the game-winning eighth 
1,dumped batted innings Two battered men the bullpen the Flores walkoff a persevered as around lineup the Mets first 10th-inning single leftfield team the 5-4 a win Phillies formerly home futile 
2,make bat Flores Wilmer that will than more up deficiencies any shows he shortstop 
3,runs Flores Mets New base first heads as Wilmer 4 York Lagares Juan 12 plate home hit after Flores RBI an inning the May 26 York New single to tenth game a 2015 baseball Tuesday the Philadelphia Phillies 
3,did So everyone else thrilled most them allowed that Flores two-out single walk Mets the Araujo left off to off win with Elvis 5-4 a Phillies the Field Citi 
4,hits Flores Wilmer center fly a to off Giles Ken sacrifice 
4,scored Duda run the tying fly Flores field center sacrifice 
6,Print Flores walk-off single 5_26_15 1:04 Flores Wilmer talks coming single his beat back walk-off 10th the Mets the to Phillies the A Anthony DiComo MLB.com _ taught history brief bar @AnthonyDiComo bar had Flores Wilmer Araujo Elvis COMMENTS 0 one YORK NEW 
6,said hits Flores walk-off he grinning clubhouse the walk-off single 5_26_15 the scoring lines Flores single Flores 10th postgame 10th field a give Cuddyer Michael PHI@NYM: left single off Araujo Elvis to win Mets the to the inning the feeling It 10th _s a good 
6,fly sacrifice Flores game PHI@NYM: Flores hits Flores game-tying ties fly sacrifice center fly a 5_26_15 the to off Giles Ken scoring tie Duda Lucas sacrifice 8th to game the bottom the 4 inning the 8th nice That Flores was 
6,ready win Flores walk-off Flores seems throwing what Flores PHI@NYM: discusses Flores pitchers opposing are way his hit his win hit his 10th-inning walk-off 5_26_15 Phillies the walk-off sending Mets the More more 10th-inning a 
6,said believe I Collins truly gotten past issues -LSB- his -RSB- 
6,become put Collins Mets the Flores has reliable Simply win discusses Collins Flores Mets walk-off Flores 5_26_15 PHI@NYM: manager Mets discusses Collins Terry team his _s 5-4 walk-off win Flores the playing confidence Phillies 
7,runs Flores Mets New base first hitting win RBI an Wilmer 4 York May 26 York New single to to game a Tuesday the 2015 inning the baseball Philadelphia Phillies tenth 
7,beginning > more bat Flores is make to By Press MIKE May Wednesday up glove his FITZPATRICK Associated 27 2015 YORK NEW AP 
8,lost eventually hold Alas single 5-4 bottom the they could not lead the bottom the Flores Wilmer 10th the inning the see Replay Instant two-out a 
9,knew range Flores Wilmer Mets The always shortstop 
9,lifts Flores The single them Phillies the Mets mob RBI his 
9,ties Flores game the up Mets the winning it ninth the 10th the fly a sac 
9,said believe I Collins Terry truly gotten has lapses the defensive 
