0,LEARN MORE Search Home Sections linked which scheduled REUTERS have been deaths six at least injuries 100 than more subcommittee A has hearing a problems the Energy House Committee Commerce June 2 led that recall the airbags Takata 
1,scheduled subcommittee A has hearing a problems the Energy House Committee Commerce June 2 lead that recall the 
2,scheduled subcommittee A has hearing a problems the Energy House Committee Commerce June 2 lead that recall the 
4,scheduled subcommittee A has hearing a problems the Energy House Committee Commerce June 2 lead that recall the 
6,hold Photo J. Applewhite Scott Energy House panel Commerce will hearing a bags defective potentially AP _ file June 2 recall the Takata air automakers 11 record-setting vehicles million nearly 34 
7,try hold Subcommittee The get to bottom the chairman the Upton U.S. R-St will hearing the Tuesday investigators congressional Commerce Manufacturing Trade part Energy U.S. what full committee Rep. Fred Washington Committee Commerce House 
