1,focused But for now investment Google is unit its spent while content Amazon has money shows original TV service its online video 
3,be Google owns which could hunt the installing is programming valuable pipes its markets a video own cable Internet few 
3,offers YouTube content fresh professional 
8,battling operators Pay-television are defend to themselves cutting so-called cancel that cord trend the people subscriptions their favor alternatives cheaper pay-television Netflix Amazon streaming Hulu 
9,started Amazon has creating shows original funded YouTube TV has filmmakers fill to competitor though channels new neither is a formidable Netflix Hulu 
9,announced ago years A Google spend it few would dd million US100 support to programming video 
9,said Google bolster deal a would analyst the brand the allow company the charge to more advertising film a high-quality 
10,said concluded simply Quite Bewkes Mr posted in board the create that message the also continuing execute to will value more significantly company the superior that video plan our shareholders our that 's proposal any strategic plans our is that business Fox position a offer to 
