1,right Ismail keeps policeman An watch site the early Afghanistan Afghan attack an May 27 Kabul 2015 
1,arrive Ismail policemen right site the attack an Afghan Afghanistan Kabul early May 27 2015 
1,said stormed Ismail armed insurgents right officials guesthouse a rifles assault KABUL Four Taliban quarter the overnight held out launcher a diplomatic capital the hours killed until grenade Afghan they were forces government early Wednesday 
1,heard blasts dozen than More were witnesses hour the continued while a first attack the bursts gunfire explosions launched until operation a was day break later hours five than more clearance 
1,quotes Writing Donati Jessica delayed minutes 20 at least Editing Klamann Edmund Trending NYSE AMEX Tait Paul 
5,said Learn update how officials to Close browser your -LSB- × -RSB- By Harooni Mirwais KABUL Jessica insurgents Four launcher a Donati Taliban armed rifles assault grenade stormed guesthouse a quarter the overnight held out diplomatic capital the hours killed until Afghan they were forces government early Wednesday 
5,heard blasts dozen than More were witnesses hour the continued while a first attack the bursts gunfire explosions launched until operation a was day break later hours five than more clearance 
