1,everyone Richt coach seemed a little apathetic about camps satellite have that Mark probably understood than better sometimes you embrace to change 
1,want Coaches Saban transparency more something want Slive Sankey equality numbers the both 
1,asked Saban were paying schools the possibly costs real opposed as costs the ambiguous projected school each 
1,said think disclose If I helpful it everybody would go how might be get to they business their things field a equal more playing 
3,declined Richt coach discuss to recruitment Bulldogs the Mark Golson submitted whether school the request a office the waiver SEC 
3,said think I referring apparently transfer Masoli Jeremiah know people most Oregon Miss Ole transfer a dismissed being 2010 came why grad eligibility immediate Ducks the rule that effect 
3,said think I member a committee the make it new NCAA football oversight would sense 
