0,meetings v topics the camps Satellite transfers graduate discussed to cost-of-attendance be retiring set Slive commissioner spring last Mike 
0,wants field level wants Conference The field a playing camps transfers Fla. DESTIN level Southeastern playing 
0,gathered coaches administrators hotel a lush included agenda the beachside resort meetings their discussion things evening out rules tweaking potentially annual spring camps satellite transfers graduate 
0,seem Picks Editor stranglehold SEC recent it ca n_t wrap to _s world the head its camps satellite college football 
0,announced SEC Tuesday propose that it will legislation national limit that would members institutional participating camps clinics staff campus their own 
0,passed SEC also regulation monitor to more even field the safety the football student-athletes its 
0,said requires regulation The Slive outgoing commissioner observer an be to Mike independent medical hand SEC games nonconference 
0,bristled coaches then prohibit because rules league them doing same the 
0,said Incoming Sankey commissioner Greg thought he had proposal the chance a fair passing 
0,have SEC Conference Atlantic rules league-wide coaching guest part want because Coast they do n_t coaches their treading turf other each 
0,naive It seems maybe arrogant even campaigning that SEC would be publicly anything level to field the playing 
0,requires rule The have transfers to years two eligibility remaining enroll in order to 
0,been we question then you have n_t game the years the is won championships seven whatever is question the the first going we championship last two row a win championship a national What _s first get I _re asked to years seven national state the asked get SEC 
1,seem stranglehold SEC the Aschoff 1mEdward it ca n_t wrap to recent world the head its camps satellite college football 
1,figure AP A Photo_Mark draw to lot a number issues Humphrey 13hEdward Aschoff discussion meetings week this spring camps satellite football 
1,stop SEC should fight its 2m with need We camps satellite Saban approach a global discuss Finebaum Paul issues the Saban Alabama football meetings the head coach Nick SEC 
1,seem Aschoff Edward DESTIN ESPN Staff Fla. stranglehold SEC ca n_t wrap to Writer dubbed many recent world the conference the head its camps satellite best to college football be the sport the part the better decade the last 
1,No. Infamous South the camps satellite have become enemy 1 SEC big resourceful extremely to just everyone else Deep bad and legal country the 
1,sick year the coaches administrators are tired watching coaches other spend time precious second straight slide grounds their competing recruits prospective playing coach guest fertile recruiting institutions smaller 
1,upset Franklin Penn SEC doing it State coach James year last hitting while Harbaugh Michigan is cities nine coach Jim days nine include that will trips Alabama Florida Texas 
1,proposing SEC allow which is now legislation have to ACC the does n_t coaches its participate to outlawed camps satellite camps these nationally believe coaches many present that camps these advantage an combat that unfair competitive league the ca n_t 
1,fallen SEC _s has ears deaf stop that groaning subject the did n_t league the griping it again Tuesday 
1,is Sports Rick have that it Osentoski_USA TODAY has What just does n_t destroy votes enough SEC realize to to practice this 
1,said Sankey Greg thinks he has proposal SEC the replace who chance a fair will Slive Mike July passing commissioner 
1,needs So SEC B a be plan that Plan should conform to let die issue the 
1,talking SEC is disadvantage a time more join beat if competitive road the you might well as them you ca n_t them season a longer recruiting 
1,join bothers If club the it shot SEC proposal their is down 
1,fan coach Ole is n_t a camps satellite said even Miss Freeze Hugh he reevaluate he would stance his them allowed if coaches were participate to 
1,understand I completely stance SEC 
1,coming But time the is back when SEC showed which to off join either disadvantage a championships its fun the leave fight the total competitive seven straight national 
1,catching rest The is slowly up SEC caught league the sport the ca n_t get head its revolutionary which sand the has been times 
1,discussion Cost-of-attendance still a was SEC in favor cost-of-attendance started began as is student-athletes its coaches skittish to numbers estimated trickling out get little a sort some universities advantage competitive get schools some could projections higher 
2,passes Let know friends network your regulation identify to Sent http:__usat.ly_1Hv8GkB reading what social better Check concussions CancelSend you are Post SEC out story this USATODAY.com 
2,passed Join Conversation Nation the league The regulation a Tuesday requires that find To observer an out more Facebook commenting passes read please independent medical games conference non-conference regulation identify to SEC beginning season next better concussions AP EDT 8:23 May 26 p.m. 2015 
2,said used schools two At least Sankey incoming commissioner setup the season last broadened now Greg we _ve make that to consistent it league the 
3,USATSI Florida DESTIN came coaches meetings their annual feeling disadvantaged spring 
3,want Some be SEC to page the comes when same conferences other it accepting transfers graduate student 
3,is And question then the win we state Well first going we championships seven what _s the SEC _re asked to national row a get and ask reporters 
3,made Saban argument a passionate need that ACC Big the have to Ten Big 12 Pac-12 rules the same leagues all five 
3,schools Alabama Georgia were interested Golson requires SEC the Florida process a waiver approved commissioner the accept to conference transfers grad 
3,met Golson would not have criteria one states that subject transfer the was not action any grad disciplinary school his previous 
3,said McElwain submit Florida did not request a SEC waiver 
3,declined Richt Georgia discuss to recruitment Bulldogs the coach Mark Golson submitted whether school the request a office the waiver 
3,said Slive commissioner were there inquiries but action no Mike formal waiver a Golson 
3,staging coaches Some are also up arms coaches leagues other camps summer Southeast the 
3,have interested conferences Many SEC would change to do n_t seem changing rule the rule its meaning fall to NCAA prevents that line currently coaches making appearances guest camp 
3,pushed Speaking month last commissioner Big Ten back complaints the coaches Delany Jim satellite camp 
3,said Delany include discussion any should also examination an recruits flipping national camps satellite oversigning grayshirting practices occur that generally frequently more SEC 
3,line This is the thinking Saban most 
3,said schools have like they have to level a certain control discipline works how creating imbalance drug testing penalties the for tests positive conference the over 
3,true way a same the is relation rules other wants SEC changed 
4,gathered coaches administrators hotel a lush included agenda the beachside resort meetings their discussion things evening out rules tweaking potentially annual spring camps satellite transfers graduate 
4,announced SEC Tuesday propose that it will legislation national limit that would members institutional participating camps clinics staff campus their own 
4,bristled coaches then back prohibit because rules league them doing same the 
4,said want We Sankey incoming commissioner done it was there Greg to be nationally lot a coaches our want that conversation football we do n_t be to sidelines the longer any going if there _s not change to be a rapidly more 
4,have SEC Conference Atlantic rules league-wide coaching guest part want because Coast they do n_t coaches their treading turf other each 
4,naive It seems maybe arrogant even campaigning that SEC would be publicly anything level to field the playing 
4,requires rule The have transfers to years two eligibility remaining enroll in order to 
4,been we question then you have n_t game the years the is won championships seven whatever is question the the first going we championship last two row a win championship a national What _s first get I _re asked to years seven national state the asked get SEC 
