13,are Bulls place a better were than they summer ago years four rise the one coaches the center an Thibodeau Tom best league the development the elevation the All-NBA Player NBA the Gibson Taj Noah Defensive Year the 
13,question It -s a hovers that pitch every recruiting make Bulls will summer this James players other NBA the 
13,is dynamic The responded that respectful while interesting history Bulls he he never overtures Noah coming play to has always been way the played Chicago courtship James City the has Thibodeau Windy 
13,had Bulls have games some Heat the bounced have intense years the been playoffs the Miami two seasons those past four 
13,player He is the targeted organization the player he has months is the gives who likely Bulls chance the topple to best James land wherever he may 
13,bet thing While team he might he is a much safer James comes when it -s no sure lands that even James else somewhere it playing Bulls Anthony in Chicago point this 
13,had James chance the play to turned it Bulls down 
15,abound Rumors focusing that Anthony is teams three Heat the Rockets Houston Bulls Miami 
16,expects Anthony draw to interest teams several aspirations championship mentioned Bulls Chicago having been suitors possible Rockets Houston Mavericks Dallas 
17,say consider Anthony sources would signing Bulls Chicago Rockets Houston Mavericks Dallas 
17,move Will Anthony Carmelo Bulls 
17,done Anthony has already research some city the done Bulls Chicago have reportedly homework some well as Anthony 
17,reached Thibodeau coach has out some coaches Anthony inquire to Tom former All-Star the to report a seven-time Times the Chicago Sun 
17,reported ESPN.com March talked that Anthony Noah center playing Thibodeau turned that Joakim break the conversation the pitch a Noah Anthony All-Star recruiting 
18,expected Bulls are frontrunners to be the land to leaves if Anthony he York New 
18,have Rockets the Bulls would offload to make contracts several to offer a Anthony starting making cut Boozer Carlos competitive contract an amnesty 
19,true That may be make offer if give which it will only look team a Knicks the Anthony substantially deal maximum than less would them flexibility more summer have when appealing more Bulls Chicago a next they will space ample chase to agents free 
19,clear Bulls love who could space enough offer to would combine to cap Anthony deal a Anthony returning Rose point starting dol around reigning Player Defensive guard Derrick 17 million year a Noah the Year Joakim 
19,making Bulls fact have been moves cost-conscious February space clear roster salary name a big Anthony 
20,test Instead he will market the land could free-agent Bulls Chicago Rockets Houston Mavericks Dallas Heat Miami 
20,conducted Likewise Bulls have reportedly research their recently own Anthony 
20,contacted Thibodeau coach has some coaches Anthony ask to Tom former him to Sun-Times the Chicago 
20,reported ESPN March spoke that Anthony Noah center is what Joakim weekend All it playing Thibodeau Star 
21,discouraged clip The also likely fans searching signs positive video day the opted Anthony officially contract his agent to Knicks become a free 
21,knows Nobody pushed hard how Pippen ambassador a has idea the chasing championship a Anthony Rose Derrick Noah Joakim 
21,Anthony only not bring would Bulls have theoretically closer immediately they might not part to would as title a Gibson Taj they trade a Love 
21,have draft Thursday Bulls might decide to NBA pull whether to trigger the trade a stand pat Love go all in on Anthony 
21,define Landing either star would summer Bulls 
21,sting Striking out would worse losing five but worse get convince nobody both Wizards the Bulls can round the season again first next 
22,-s That makes why Boozer a sign-and-trade Bulls Chicago sense financially Carlos involving 
