19,making Bulls fact have been moves cost-conscious February space clear roster salary name a big Anthony 
20,test Instead he will market the land could free-agent Bulls Chicago Rockets Houston Mavericks Dallas Heat Miami 
20,conducted Likewise Bulls have reportedly research their recently own Anthony 
20,contacted Thibodeau coach has some coaches Anthony ask to Tom former him to Sun-Times the Chicago 
20,reported ESPN March spoke that Anthony Noah center is what Joakim weekend All it playing Thibodeau Star 
21,discouraged clip The also likely fans searching signs positive video day the opted Anthony officially contract his agent to Knicks become a free 
21,knows Nobody pushed hard how Pippen ambassador a has idea the chasing championship a Anthony Rose Derrick Noah Joakim 
21,Anthony only not bring would Bulls have theoretically closer immediately they might not part to would as title a Gibson Taj they trade a Love 
21,have draft Thursday Bulls might decide to NBA pull whether to trigger the trade a stand pat Love go all in on Anthony 
21,define Landing either star would summer Bulls 
21,sting Striking out would worse losing five but worse get convince nobody both Wizards the Bulls can round the season again first next 
22,-s That makes why Boozer a sign-and-trade Bulls Chicago sense financially Carlos involving 
1,visited Anthony Bulls Chicago Mavericks Dallas week last addition meeting Jackson Knicks the Angeles Los Rockets Houston Lakers Los Angeles 
1,have make Bulls they -d orchestrate to to offer an sign-and-trade a Anthony approaching contract a maximum 
1,courted Gasol is also being Bulls Thunder others Lakers 
2,notified make reports Bulls still had n-t been All-Star the Anthony would return his official the intentions forward Knicks Thursday -s day the first full of allowed passed signings 
2,said source A continued Bulls work efforts find to were if Anthony team a make to have to third possibilities potential change a leave Knicks the sign-and-trade heart 
2,believe Otherwise changed not much Bulls made they impression a Anthony pitch their July 1 Chicago strong in-person 
2,Using strictly space salary-cap offer parting Gibson Taj Bulls can Anthony four-year a deal dol million 73 
2,said conveyed Bulls the But sources week last Anthony sense a make they would work finances picks if he them 
2,centered plans Bulls are Anthony engaged they free-agency remain options contingency 
2,confirmed continued Bulls Jackson a player trying he have dialogue daily camp Gasol Pau is woo to Knicks the well as 
2,surpass Bulls can far offer that nab if have confidence reached deal a they do n-t Anthony can be three-year 
2,improve maintained Forman General Bulls will significantly offseason this transpires what has consistently manager Gar agency free 
3,interested right may be more Bulls the kept if Gibson Taj is 
3,confirmed person A reports considering that knowledge situation Anthony he still is Bulls Chicago unclear though it -s are where Bulls the lead the Knicks New Lakers Los sweepstakes these York Angeles one-man 
3,feared reported As Knicks the Bulls rest the affinity Anthony Sports USA July 4 along all longstanding playing Rose Derrick TODAY Noah Joakim rest the lot the Chicago 
3,have Yet made while Knicks the Bulls landscape a Anthony offer a put Lakers the complicated more financial maximum contract dol million 129 out dol million 96 years four years five 
3,have use If they would dol about Bulls clause the Boozer forward 10 million space salary amnesty Carlos expected as cap 
3,create Bulls could room trading forward point man the Gibson Taj is a major selling Anthony decides as sixth runner-up the well as he help team which year can win him championship his first 
3,seems Thus sign-and-trade a Knicks the way to pay to Boozer be the likely most Bulls Anthony sort the salary take it will get to him town 
3,dol make If the most offer they is million 73 years four Bulls ca n-t move such could Anthony a 
3,pay sign-and-trade a Bulls likely could Anthony dol million 87 years four 
4,blocked Noah Joakim Wavering thinking Anthony Carmelo YORK 2014 NY is Garden Madison City New 13 # Bulls the longer offer Knicks Reporter JOE July 10 9:43 PM NEW DECEMBER 21 Anthony Carmelo Knicks the Square December 21 York Chicago max COWLEY Staff 7 # New York 2012 
4,strong Photo Images Bruce might be bit a using reconsidering the Bennett-Getty storyidforme tmspicid 68990151 term comes when to source a fileheaderid 15554326 7024578 Updated Article July 10 it Anthony Carmelo spurning Bulls the evening Thursday Extras 2014 PM 11:59 stance his 
4,surfaced rumors Several was that Anthony starting was reconsidering offer the lean to dol million 129 max-contract years five back Bulls re-sign to Jackson Phil Knicks the New York 
4,has member A let know Bulls camp Anthony weighing that decision the is heavily All-Star the felt especially seven-time because connection the he made he Noah All-Star meeting their center Joakim Thibodeau coach July 1 Tom 
4,is problem The need Bulls desperately sign-and-trade a Knicks the make to up dol the million 54 leaving Anthony would be table the signed if he agent a free 
4,adamant Knicks The however have been letting know Bulls interested that they are n-t sign-and-trade a 
4,continue Bulls spin to wheels their as far jumping B Plan lose if they out sweepstakes the Anthony 
4,were There reports was that been he Mirotic pick the Chicago has Angeles Los awaiting process the 2011 draft acquired Bulls start to negotiation 
4,said think I Fraschilla getting Bulls are player a solid really 
4,hoping Bulls you you -re going he -re the Chicago example -s right to be a .290 hitter bat the 
4,play searching wilt No it -s been Rose Derrick practices the If Bulls were sort some come to Rose Center the news good week the Berto team the last Summer League 
4,shown shot His has improvement continued good ability his outside is as seen as attack to Bulls have injured since rim the he first knee his 2012 left 
5,believed Anthony is choosing to be Bulls Chicago Knicks Lakers 
6,re-sign Barring change a Anthony will Knicks the barring Bulls Chicago last-minute heart able being convince to engage Jackson president the to sign-and-trade a Knicks 
6,offer Bulls Chicago can dol only get could 75 million potentially max the sign-and-trade a 
6,believed He also joining that he would be contender a have where championship Chicago Bulls core a Rose Derrick strong Noah Joakim Gibson Taj 
6,impressed Anthony was presentation Bulls felt bond a players the strong Thibodeau head coach Tom 
7,wants Anthony Carmelo Kelly R. write much so Bulls the that he -ll Melo song a Videos theme 
7,considered squad One Bulls Chicago is one Melo the such offense-deficient top potential destinations 
7,have Bulls the reigning Player Defensive Year the MVP a coach an center ready-to-go reportedly former league guard point excellent head pushing who is reportedly Chicago land to Anthony 
7,Pied prolific The performed Piper R&B Jam WGCI-FM said and Summer weekend this asked was it must be intensely problematic past chances Bulls interview a Carmelo landing backstage 
7,likes Apparently man the Trapped Closet the idea the coming hometown the beg willing Moreover willing And need Now Anthony he -d be write to he -d even be give to we just him break to song Carmelo us taste just us off preview a his own personalized theme a tune the little remix the 
8,visit Rockets the to allowed once Houston Mavericks Dallas Bulls Chicago teams are meet to to sources league agents free July 1 
8,appear are While Rockets the Mavericks challengers to there still chances opportunities other be Knicks the biggest far thus develop to 
9,run fans Bulls keep dreams free-agent Bulls a starts ends Rose a check Blog Jon healthy Derrick Greenberg matter ESPN Chicago AP Photo-Alex Brandon No end where Anthony Carmelo up James LeBron Love Kevin 
9,means That you fans 
9,James Cross list your fans 
9,Can reel the in him 
9,So does where leave that Bulls 
9,outcome The likely most Bulls summer this 
9,think Seriously I whiff Bulls names the big but still Boozer amnesty Carlos 
9,challenging key The anyone Rose is Bulls a healthy 
9,has talk Any mention to had that keep how Rose has only crack one run its Bulls coming short postseason the Miami four-year Finals the Thibodeau Tom 
9,season-ender league-changer Although it -s not a get if it would be a acquire to they do n-t them pair Anthony Love to remain whatever would core Bulls 
9,have all Bulls do n-t level that do have they continuity man an old-but-effective Duncan Tim generation his post the best 
9,guess are Even I -d draft the stash player a if there trades no foreign 
9,added Bulls Smith injured center season late rely they Greg this past ca n-t Noah playing position the himself again 
10,take cut pay Melo will win to Blog Chicago believes Boeheim Syracuse Bulls CHICAGO ESPN take pupil his coach Jim Chicago Anthony Carmelo would money less sign to prized contender a summer this 
10,opted Anthony officially out year the Knicks the considering is teams several final contract his New York Monday Bulls Chicago figures as he out wants where he play to next 
10,offer Bulls rest the suitors Anthony can All-Star the deal only contract dol maximum a four-year 96 million 
10,have clear To Bulls would Boozer amnesty gut then kind that Carlos rest the space roster their 
10,hoping Bulls everyone else sweepstakes the are take that Anthony Anthony will less little a build to foundation a him championship 
11,keep Yes signals the stronger getting front-runner that Bulls will be a sweepstakes the Carmelo 
11,expected Bulls are come to hard Anthony hits once he market the July 1 
11,offer Bulls can package a picks draft Boozer Carlos expires contract whose player a season the young cheap Butler Jimmy 2014-15 Snell Tony 
11,give Bulls provided healthy Rose Derrick him opportunity a is better chase to title a season next would than Knicks the 
12,confident Rockets The have been time some say sources move that they can not only players both pitch necessary deals create that flexibility the rival also requisite sales Bulls 
12,star Mavs Yet acknowledged Nowitzki Dirk has have that bound who Bulls Rockets odds better York New labeling chances Dallas also is agency free July 1 Anthony prying realistic really not 
12,dismissed speculation the said interview an could not be factor a him Rose Derrick rising desire Bulls the Anthony uprooting family his online aired that Noah Joakim Thibodeau hard-driving team city another Monday coach Tom 
13,alter focus Bulls decision LeBron ca n-t player James LeBron wise Bulls the Blog Chicago is the best basketball planet the would be get to Chicago Bulls CHICAGO ESPN him again make pitch their Chicago did just best recruiting like they ago summers four 
13,Enlarge + -LSB- have Bulls McIsaac-Getty pursue to lose they -RSB- James LeBron ImagesThe ca n-t focus Anthony landing Carmelo 
13,Anthony it -s figures who mutual interest the attainable to appears be more Bulls 
13,are Bulls place a better were than they summer ago years four rise the one coaches the center an Thibodeau Tom best league the development the elevation the All-NBA Player NBA the Gibson Taj Noah Defensive Year the 
13,question It -s a hovers that pitch every recruiting make Bulls will summer this James players other NBA the 
13,is dynamic The responded that respectful while interesting history Bulls he he never overtures Noah coming play to has always been way the played Chicago courtship James City the has Thibodeau Windy 
13,had Bulls have games some Heat the bounced have intense years the been playoffs the Miami two seasons those past four 
13,player He is the targeted organization the player he has months is the gives who likely Bulls chance the topple to best James land wherever he may 
13,bet thing While team he might he is a much safer James comes when it -s no sure lands that even James else somewhere it playing Bulls Anthony in Chicago point this 
13,had James chance the play to turned it Bulls down 
15,abound Rumors focusing that Anthony is teams three Heat the Rockets Houston Bulls Miami 
16,expects Anthony draw to interest teams several aspirations championship mentioned Bulls Chicago having been suitors possible Rockets Houston Mavericks Dallas 
17,say consider Anthony sources would signing Bulls Chicago Rockets Houston Mavericks Dallas 
17,move Will Anthony Carmelo Bulls 
17,done Anthony has already research some city the done Bulls Chicago have reportedly homework some well as Anthony 
17,reached Thibodeau coach has out some coaches Anthony inquire to Tom former All-Star the to report a seven-time Times the Chicago Sun 
17,reported ESPN.com March talked that Anthony Noah center playing Thibodeau turned that Joakim break the conversation the pitch a Noah Anthony All-Star recruiting 
18,expected Bulls are frontrunners to be the land to leaves if Anthony he York New 
18,have Rockets the Bulls would offload to make contracts several to offer a Anthony starting making cut Boozer Carlos competitive contract an amnesty 
19,true That may be make offer if give which it will only look team a Knicks the Anthony substantially deal maximum than less would them flexibility more summer have when appealing more Bulls Chicago a next they will space ample chase to agents free 
19,clear Bulls love who could space enough offer to would combine to cap Anthony deal a Anthony returning Rose point starting dol around reigning Player Defensive guard Derrick 17 million year a Noah the Year Joakim 
19,making Bulls fact have been moves cost-conscious February space clear roster salary name a big Anthony 
20,test Instead he will market the land could free-agent Bulls Chicago Rockets Houston Mavericks Dallas Heat Miami 
20,conducted Likewise Bulls have reportedly research their recently own Anthony 
20,contacted Thibodeau coach has some coaches Anthony ask to Tom former him to Sun-Times the Chicago 
20,reported ESPN March spoke that Anthony Noah center is what Joakim weekend All it playing Thibodeau Star 
21,discouraged clip The also likely fans searching signs positive video day the opted Anthony officially contract his agent to Knicks become a free 
21,knows Nobody pushed hard how Pippen ambassador a has idea the chasing championship a Anthony Rose Derrick Noah Joakim 
21,Anthony only not bring would Bulls have theoretically closer immediately they might not part to would as title a Gibson Taj they trade a Love 
21,have draft Thursday Bulls might decide to NBA pull whether to trigger the trade a stand pat Love go all in on Anthony 
21,define Landing either star would summer Bulls 
21,sting Striking out would worse losing five but worse get convince nobody both Wizards the Bulls can round the season again first next 
22,-s That makes why Boozer a sign-and-trade Bulls Chicago sense financially Carlos involving 
1,visited Anthony Bulls Chicago Mavericks Dallas week last addition meeting Jackson Knicks the Angeles Los Rockets Houston Lakers Los Angeles 
1,have make Bulls they -d orchestrate to to offer an sign-and-trade a Anthony approaching contract a maximum 
1,courted Gasol is also being Bulls Thunder others Lakers 
2,notified make reports Bulls still had n-t been All-Star the Anthony would return his official the intentions forward Knicks Thursday -s day the first full of allowed passed signings 
2,said source A continued Bulls work efforts find to were if Anthony team a make to have to third possibilities potential change a leave Knicks the sign-and-trade heart 
2,believe Otherwise changed not much Bulls made they impression a Anthony pitch their July 1 Chicago strong in-person 
2,Using strictly space salary-cap offer parting Gibson Taj Bulls can Anthony four-year a deal dol million 73 
2,said conveyed Bulls the But sources week last Anthony sense a make they would work finances picks if he them 
2,centered plans Bulls are Anthony engaged they free-agency remain options contingency 
2,confirmed continued Bulls Jackson a player trying he have dialogue daily camp Gasol Pau is woo to Knicks the well as 
2,surpass Bulls can far offer that nab if have confidence reached deal a they do n-t Anthony can be three-year 
2,improve maintained Forman General Bulls will significantly offseason this transpires what has consistently manager Gar agency free 
3,interested right may be more Bulls the kept if Gibson Taj is 
3,confirmed person A reports considering that knowledge situation Anthony he still is Bulls Chicago unclear though it -s are where Bulls the lead the Knicks New Lakers Los sweepstakes these York Angeles one-man 
3,feared reported As Knicks the Bulls rest the affinity Anthony Sports USA July 4 along all longstanding playing Rose Derrick TODAY Noah Joakim rest the lot the Chicago 
3,have Yet made while Knicks the Bulls landscape a Anthony offer a put Lakers the complicated more financial maximum contract dol million 129 out dol million 96 years four years five 
3,have use If they would dol about Bulls clause the Boozer forward 10 million space salary amnesty Carlos expected as cap 
3,create Bulls could room trading forward point man the Gibson Taj is a major selling Anthony decides as sixth runner-up the well as he help team which year can win him championship his first 
3,seems Thus sign-and-trade a Knicks the way to pay to Boozer be the likely most Bulls Anthony sort the salary take it will get to him town 
3,dol make If the most offer they is million 73 years four Bulls ca n-t move such could Anthony a 
3,pay sign-and-trade a Bulls likely could Anthony dol million 87 years four 
4,blocked Noah Joakim Wavering thinking Anthony Carmelo YORK 2014 NY is Garden Madison City New 13 # Bulls the longer offer Knicks Reporter JOE July 10 9:43 PM NEW DECEMBER 21 Anthony Carmelo Knicks the Square December 21 York Chicago max COWLEY Staff 7 # New York 2012 
4,strong Photo Images Bruce might be bit a using reconsidering the Bennett-Getty storyidforme tmspicid 68990151 term comes when to source a fileheaderid 15554326 7024578 Updated Article July 10 it Anthony Carmelo spurning Bulls the evening Thursday Extras 2014 PM 11:59 stance his 
4,surfaced rumors Several was that Anthony starting was reconsidering offer the lean to dol million 129 max-contract years five back Bulls re-sign to Jackson Phil Knicks the New York 
4,has member A let know Bulls camp Anthony weighing that decision the is heavily All-Star the felt especially seven-time because connection the he made he Noah All-Star meeting their center Joakim Thibodeau coach July 1 Tom 
4,is problem The need Bulls desperately sign-and-trade a Knicks the make to up dol the million 54 leaving Anthony would be table the signed if he agent a free 
4,adamant Knicks The however have been letting know Bulls interested that they are n-t sign-and-trade a 
4,continue Bulls spin to wheels their as far jumping B Plan lose if they out sweepstakes the Anthony 
4,were There reports was that been he Mirotic pick the Chicago has Angeles Los awaiting process the 2011 draft acquired Bulls start to negotiation 
4,said think I Fraschilla getting Bulls are player a solid really 
4,hoping Bulls you you -re going he -re the Chicago example -s right to be a .290 hitter bat the 
4,play searching wilt No it -s been Rose Derrick practices the If Bulls were sort some come to Rose Center the news good week the Berto team the last Summer League 
4,shown shot His has improvement continued good ability his outside is as seen as attack to Bulls have injured since rim the he first knee his 2012 left 
5,believed Anthony is choosing to be Bulls Chicago Knicks Lakers 
6,re-sign Barring change a Anthony will Knicks the barring Bulls Chicago last-minute heart able being convince to engage Jackson president the to sign-and-trade a Knicks 
6,offer Bulls Chicago can dol only get could 75 million potentially max the sign-and-trade a 
6,believed He also joining that he would be contender a have where championship Chicago Bulls core a Rose Derrick strong Noah Joakim Gibson Taj 
6,impressed Anthony was presentation Bulls felt bond a players the strong Thibodeau head coach Tom 
7,wants Anthony Carmelo Kelly R. write much so Bulls the that he -ll Melo song a Videos theme 
7,considered squad One Bulls Chicago is one Melo the such offense-deficient top potential destinations 
7,have Bulls the reigning Player Defensive Year the MVP a coach an center ready-to-go reportedly former league guard point excellent head pushing who is reportedly Chicago land to Anthony 
7,Pied prolific The performed Piper R&B Jam WGCI-FM said and Summer weekend this asked was it must be intensely problematic past chances Bulls interview a Carmelo landing backstage 
7,likes Apparently man the Trapped Closet the idea the coming hometown the beg willing Moreover willing And need Now Anthony he -d be write to he -d even be give to we just him break to song Carmelo us taste just us off preview a his own personalized theme a tune the little remix the 
8,visit Rockets the to allowed once Houston Mavericks Dallas Bulls Chicago teams are meet to to sources league agents free July 1 
8,appear are While Rockets the Mavericks challengers to there still chances opportunities other be Knicks the biggest far thus develop to 
9,run fans Bulls keep dreams free-agent Bulls a starts ends Rose a check Blog Jon healthy Derrick Greenberg matter ESPN Chicago AP Photo-Alex Brandon No end where Anthony Carmelo up James LeBron Love Kevin 
9,means That you fans 
9,James Cross list your fans 
9,Can reel the in him 
9,So does where leave that Bulls 
9,outcome The likely most Bulls summer this 
9,think Seriously I whiff Bulls names the big but still Boozer amnesty Carlos 
9,challenging key The anyone Rose is Bulls a healthy 
9,has talk Any mention to had that keep how Rose has only crack one run its Bulls coming short postseason the Miami four-year Finals the Thibodeau Tom 
9,season-ender league-changer Although it -s not a get if it would be a acquire to they do n-t them pair Anthony Love to remain whatever would core Bulls 
9,have all Bulls do n-t level that do have they continuity man an old-but-effective Duncan Tim generation his post the best 
9,guess are Even I -d draft the stash player a if there trades no foreign 
9,added Bulls Smith injured center season late rely they Greg this past ca n-t Noah playing position the himself again 
10,take cut pay Melo will win to Blog Chicago believes Boeheim Syracuse Bulls CHICAGO ESPN take pupil his coach Jim Chicago Anthony Carmelo would money less sign to prized contender a summer this 
10,opted Anthony officially out year the Knicks the considering is teams several final contract his New York Monday Bulls Chicago figures as he out wants where he play to next 
10,offer Bulls rest the suitors Anthony can All-Star the deal only contract dol maximum a four-year 96 million 
10,have clear To Bulls would Boozer amnesty gut then kind that Carlos rest the space roster their 
10,hoping Bulls everyone else sweepstakes the are take that Anthony Anthony will less little a build to foundation a him championship 
11,keep Yes signals the stronger getting front-runner that Bulls will be a sweepstakes the Carmelo 
11,expected Bulls are come to hard Anthony hits once he market the July 1 
11,offer Bulls can package a picks draft Boozer Carlos expires contract whose player a season the young cheap Butler Jimmy 2014-15 Snell Tony 
11,give Bulls provided healthy Rose Derrick him opportunity a is better chase to title a season next would than Knicks the 
12,confident Rockets The have been time some say sources move that they can not only players both pitch necessary deals create that flexibility the rival also requisite sales Bulls 
12,star Mavs Yet acknowledged Nowitzki Dirk has have that bound who Bulls Rockets odds better York New labeling chances Dallas also is agency free July 1 Anthony prying realistic really not 
12,dismissed speculation the said interview an could not be factor a him Rose Derrick rising desire Bulls the Anthony uprooting family his online aired that Noah Joakim Thibodeau hard-driving team city another Monday coach Tom 
13,alter focus Bulls decision LeBron ca n-t player James LeBron wise Bulls the Blog Chicago is the best basketball planet the would be get to Chicago Bulls CHICAGO ESPN him again make pitch their Chicago did just best recruiting like they ago summers four 
13,Enlarge + -LSB- have Bulls McIsaac-Getty pursue to lose they -RSB- James LeBron ImagesThe ca n-t focus Anthony landing Carmelo 
13,Anthony it -s figures who mutual interest the attainable to appears be more Bulls 
13,are Bulls place a better were than they summer ago years four rise the one coaches the center an Thibodeau Tom best league the development the elevation the All-NBA Player NBA the Gibson Taj Noah Defensive Year the 
13,question It -s a hovers that pitch every recruiting make Bulls will summer this James players other NBA the 
13,is dynamic The responded that respectful while interesting history Bulls he he never overtures Noah coming play to has always been way the played Chicago courtship James City the has Thibodeau Windy 
13,had Bulls have games some Heat the bounced have intense years the been playoffs the Miami two seasons those past four 
13,player He is the targeted organization the player he has months is the gives who likely Bulls chance the topple to best James land wherever he may 
13,bet thing While team he might he is a much safer James comes when it -s no sure lands that even James else somewhere it playing Bulls Anthony in Chicago point this 
13,had James chance the play to turned it Bulls down 
15,abound Rumors focusing that Anthony is teams three Heat the Rockets Houston Bulls Miami 
16,expects Anthony draw to interest teams several aspirations championship mentioned Bulls Chicago having been suitors possible Rockets Houston Mavericks Dallas 
