0,LEARN MORE Search Home Sections Search Advertisement Suspension Rockets Dwight Howard Avoids Foul a suspended PRESS THE Howard Houston will not be Game 5 decided after ASSOCIATED Rockets center Dwight finals the N.B.A. the uphold to Western Conference Warriors Golden foul flagrant-1 his State 
1,Photo Martinez Ronald play Curry Getty will Wednesday fall a greeted shows Even Images Stephen hard Howard Dwight they were things two hole deep Houston resolve game confidence smile a comment a filed 1 HOUSTON _ echoed that brass Warriors staff media sporadically area the night Monday bar article-gallery-6288156 gallery_thumbs_close 1 still Tuesday Toyota Center pregame dining 0 gallery_overlay_close 0 bar article-gallery-6288156 bar article-gallery-6288156 bar bar bar article-gallery-6288156 
1,was Houston down 3-0 finals the time the Western Conference Warriors 
1,have And Rockets the still win to force to Game Wednesday series the back Houston Game a Friday 5 Arena Oracle place a 6 lost where Warriors have times three games 48 season this 
1,point expected Curry guard is play to Stephen Game Wednesday nights two back the 5 fall a neck his shoulder shocking that horrific was enough leave to face him down hardwood the minutes several 
1,moved beating their Rockets the 4-0 to all-time 8-2 McHale head sound Warriors Monday games elimination games such coach Kevin postseason this 
1,all season The was clinching advantage home-court regular something did Warriors ended weeks nearly before it two 
1,play continue If Warriors will two games the Arena Oracle finals the games seven final three hosted which built reputation a West has crowds sellout games 130 one venues league the consecutive raucous most 
1,fight It _s a confident that too Warriors are plenty winning 
1,said memo A return Warriors Golden will proving assurance team the staff their leaked that found way its Oakland Tuesday State public relations was Monday late room the sweep their Houston locker 4-0 series Rockets the Houston Finals the Western Conference 
1,7-1 Warriors are Houston season this 
1,said _s There motivation have to not come to go to back Houston Finals the time the NBA first years 40 
1,E-mail Twitter rsimmons@sfchronicle.com TV_Radio @Rusty_SFChron Game 5 ESPN_680 lead Warriors finals series best-of-seven 3-1 
2,scored Houston _ Rockets alive AP Harden Houston career-high a lead to Warriors 27 James playoff points 45 Rockets the victory a State Golden stave to May 2015 star league lands MVP start-to-finish 128-115 Monday off elimination playoffs the Curry head his NBA spill a nasty 
2,were They up 22 quarter the landed when missed minutes 12 second star Curry MVP league head his spill a returning Stephen nasty 
2,try Warriors will at again Wednesday home Game 5 
3,announced president NBA stand that upgraded will foul-1 Howard Dwight operations basketball flagrant will called as not be flagrant-2 a victory Monday Thorn Rod Game 4 Warriors Golden State 
3,came Howard _s minutes eight over just remaining quarter the holding Rockets the attempted Rockets forward flagrant third Game 4 lead an Warriors Smith Josh post to 11-point up Bogut Warriors counterpart Draymond Green Howard Golden State center Andrew battling who clashed again have been tooth nail series this block the opposite 
3,allowed Instead he was remain to finished which Game 4 he points 14 rebounds 12 two steals in blocks two holding Warriors defending when minutes 34 shooting 1-for-7 he was rim the 
3,head noted Kerr coach shifting the Steve evidently sands punishment league matters such asked when play the practice team his Tuesday 
5,Posted Game 5 for Writer Antonio Click 04:37:11 05_26_2015 Warriors Gonzalez AP Basketball photo enlarge to Updated PM 05:32:11 05_26_2015 PDT PDT PM 
5,received Howard contact a flagrant 1 foul early in quarter the him connecting back the made after third throwing elbow his hand his center the head Bogut left 
5,comes decision The with leading Warriors received after series the Horford Atlanta Smith Cleveland recently penalties stricter contact shoulders the 3-1 Al J.R. 
5,declined say to thought he was contact the thought whether clearly shoulders the he upgraded Howard _s should be flagrant 
