1,won Pelissier_Reuters Credit American the rare title his April clay the Jean-Paul calls who first Houston clay surface his favorite 
1,began Sock made it he immediately playing some tennis the back tour March best career his 
1,said playing I was him him family my 
1,ensured won After Isner John Keys Madison Falconi Irina presence than more contingent the had Sock a token round the just United States second 
3,eliminated Dimitrov Grigor Bulgarian the game the was similarly Jack the 7-6 9 6-2 6-3 stylish drawn that American has comparisons Federer Roger _s 
3,ensured won After Isner John Keys Madison Falconi Irina presence than more contingent the had Sock a token round the just U.S. second 
