0,Join Conversation Nation the keep losses The mounting find To Bouchard Eugenie out more Facebook commenting please read Guidelines the good who having is PARIS TWEET AP FAQs loses Bouchard Canada EDT 3:09 Conversation was so year last trouble much so LINKEDIN COMMENTEMAILMORE round Slam p.m. May 26 Photo Press The nowadays 1st AP 1st 2015 Associated time 
1,PARIS Credit Caroline Blumberg_European Pressphoto Agency Advertisement could advanced While two lights the not Tuesday favorites most round the issue brightest young summer last Open the first French 
2,Breaking News AFP bar girl corporate accusations donna being May 27 PARIS AM sports dream fondness a a pouting prima 2015 09.19 IST Bieber Justin 
4,falls PARIS French 18h Early Bouchard The Mladenovic says Bouchard Eugenie Open Round Coverage French Open Primetime ago Canadian Press feeling she has n_t been herself lately 
1,came He record a 4-5 year this attributes which he rust the layoff his showing moments the biggest 
3,replicated Dimitrov seeded 10th has looked he not run the listless times slipped as hype-justifying made he match the away semifinals the year last Wimbledon 
3,came Making comeback his Cilic record a year this attributes which primarily clay surface his 4-5 he rust the favored least layoff his showing moments the important most 
4,compete duo The will week this 
5,Posted Paris IST 09:07 AM May 27 run Bouchard Eugenie 2015 miserable form 
5,arrived seed The lost having was there six sixth dubbed thing the matches seven improvement no lost as year last next big tennis women Lenglen Court she 6-4 6-4 Mladenovic Frenchwoman Suzanne Kristina 
