0,lauded team The might have been taking stand a players misbehaved who tough off field the discredited N.F.L. 
0,2015 This is spent N.F.L. much year last trying rebut to criticism is that it incapable league a taking violence domestic unwilling do to seriously so 
0,grappling strengthened While teams are areas the N.F.L. has policy its gray created it personal conduct has 
0,And what rookies Collins La’el implicated who Clark Frank were cases entered before they N.F.L. 
0,suspended pleaded After Peterson was until at least April 15 violating policy N.F.L. he contest no Nov. 4 assault reckless personal-conduct 
0,said But Balsam Jodi teaches who forced that School Brooklyn Law worked previously conspire while each was being learn to N.F.L. teams could not keep to do how players rosters their to best what was team the best what field the was image team the field the 
0,appears version A print May 27 Stumble Bears article this 2015 B10 page Quagmire Violence Domestic edition the New York headline the 
