1,led arrest the that Speaking reporters time the McDonald NFL first speculation draft-day defensive end Ray suspicion endangerment child trade Sports domestic viole Brad Barr_USA TODAY 
1,learning McCown Ken are system a coordinator a showed it TODAY Sports 4hPat McManamon Josh Manziel Johnny new new receivers new day the first OTAs Browns 
1,has Fowler Charles Roethlisberger Ben chance a TODAY Sports 13hJeremy Coming off play to career a season statistical level the with cast his contract his supporting new 
5,led arrest the that Speaking reporters time the McDonald NFL first speculation draft-day defensive end Ray suspicion endangerment child trade Sports domestic viole Brad Barr_USA TODAY 
5,learning McCown Ken are system a coordinator a showed it TODAY Sports 6hPat McManamon Josh Manziel Johnny new new receivers new day the first OTAs Browns 
5,has Fowler Charles Roethlisberger Ben chance a TODAY Sports 15hJeremy Coming off play to career a season statistical level the with cast his contract his supporting new 
