0,Photo Lincoln Star Streff Journal 5 
0,arrested rocked Photo AP were Switzerland extradition face States the suspicion charges federal Developing story held officials FIFA was scandal a officials six United corruption allegations corruption behest FIFA U.S. dramatic Wednesday body soccer world governing 
4,dominated Photo Curtis James Compton series this 
7,Anything but finals cavalier AP Associated Cleveland DEJAK _ Press PHOTO BY TONY celebrate Smith Cleveland 5 James LeBron night Tuesday quarter the J.R. fourth victory a 118-88 Atlanta Conference the NBA Western 
7,stored materials Neither thereof may be computer a for use personal these portion any noncommercial 
7,held AP will not be liable delays any inaccuracies errors omissions thereof damages any therefrom in transmission the arising any foregoing the delivery all part any 
8,all Schwane Photo_Ron do If you are guys all matter it it _s team making play the can that page the 15 does n_t doing what covering teammate your playing teammate your next teammate your same you _re individually succeed then you will 
