0,try Warriors finish to off Rockets join finals try Warriors The send which will wrap to Golden State would them Game 1 June 4 up series their Wednesday Finals the Rockets the Cavaliers the Houston Cleveland 
1,have Cavs The do n_t opponent a have yet finals as State Golden Houston still settle to things out West 
1,heartbreak There has been years the denied since swept Cavs lost as Browns the were games three Elway Denver were Antonio San Indians the two Series World AFC championship John 2007 
1,give break The will also Cavs chance a recharge to mentally challenge their yet toughest 
1,CAST CHARACTERS rely Cavs do n_t James do to everything 
1,gotten Dellavedova Cavs have contributions major players several role 
1,become Cavs have selfless 
1,shot Atlanta percent 23.4 just range 3-point 5 32 Game lowering 4 percentage opponents Cavs arc the shooting percent 27.8 
1,HOT CLEVELAND host Cavs will Games 3 4 Game necessary if Arena Quicken one buildings league the 6 Loans noisiest 
2,seem surface the Cavs pose to threat no comes whoever Conference the Western going alert spoiler it _s Warriors to be the 
2,got Cavs East the disappointing overwhelmingly 
2,supposed But then Cavs were n_t survive to supposed were team injury the n_t get to Kevin Love team the freeflowing the Hawks precise Bulls tougher more experienced more 
3,ya How that fans 
3,Irving It was Kyrie returning absence a Cavs finest their two-game 
3,team Cavs are the first reach to Finals the season this 
3,has Cavs fans their that feel to good just say to 
3,Think rumors all allegations the thrown way Cavs 
3,Think all think that then feel good how this must Cavs 
3,mean And things went right I dominated Cavs simply 
3,came seemed Just Cavs together when it fall like everything would apart 
3,win So can Cavs team championship a 
3,opposite Warriors The are the Cavs eyes the public the basketball-loving 
3,LeBron chances Cavs guarantee I can not anything 
3,have say I they _ll shot a will defend if rebound done like great Cavs they _ve lately 
3,superior Warriors The are offensively team any faced Cavs have playoffs the 
3,seen But neither has defense a Cavs 
3,matter comes When talk Twitter reaction fan do not it team this overreaction and 
3,are Cavs here proof being here is enough belong that they 
4,beaten Cavs had just completing Hawks the 118-88 Game 4 sweep the Atlanta finals the Eastern Conference 
4,urged decided When he acknowledged times several patience admitted though James return to season the tested that he person he Cavs patience his was time any _s not a patient career his 
4,19-20 Cavs were looked hardly team a even East the championship-caliber 
4,gave support his acquired Cavs the non-wavering Blatt earlier days nine had just Smith J.R. Shumpert Iman Knicks the Mozgov Timofey Nuggets the New York Denver 
4,improved Game game Cavs 
5,earned sweeping Hawks the Cavs trip their Finals the face where top-seeded second they will either State Golden Houston starting June 4 
5,wins Cavs are have can if four doing it James will title a they put that would him class a himself 
5,said have We James presented after everything takes it Cavs were trophy the win to conference 
5,added Smith J.R. had points 18 Thompson Tristan points 16 rebounds 11 Cavs 
5,got Cavs rounds the last Love forward two Kevin suffered who injury a season-ending shoulder 
5,go It did n_t exactly job planned Blatt first-year coach David left who family his Israel take to Cavs 
7,earned sweeping Hawks the Cavs trip their finals the face where top-seeded second they will State Golden Houston starting June 4 
7,victories Cavs are have can if four doing it James will title a they put that would him class a himself 
7,said have We James presented after everything takes it Cavs were trophy the win to conference 
7,added Smith J.R. had points 18 joined were Thompson Tristan points 16 rebounds 11 Cavs handed who members family celebrate to were caps new T-shirts floor the victory the 
7,carried James Cavs appearance their ago years eight swept when first finals they were Antonio San 
7,assumed it underdog Cleveland was get Cavs the was a heavy then would again back 
7,got Cavs rounds the past Love forward two Kevin sustained who injury a season-ending shoulder 
7,go It did n_t exactly planned as Blatt David coach the first-year left who family his Israel take to job Cavs 
7,lost Cavs Varejao center 19-20 they Anderson injury a December were trading Iman season-ending Achilles Shumpert Smith Mozgov Timofey helped of all transform Cleveland whom 
7,scored opened as 15 half the Cavs the lead a first 17-point going halftime 
7,mended two The relationship their broken summer last paving way the re-sign to try deliver to James title the stint his could he first n_t 
8,_s That Cavs Cavs the became team a the learned that has qualities championship 
8,Finals stay true map their 3m big fans Cleveland breaks Daugherty ESPN Finals road down means what Brad trip a city the Finals the Cleveland NBA 
8,asked McMenamin Dave Cavs Covered ESPN.com Lakers the writer NBA NBA the CLEVELAND 2005-09 end the James LeBron was kind the considering setting the 2009-14 ESPNLosAngeles.com NBA NBA.com couple room the season the question receive that mass scrum for a days postgame locker regular would usually response a perfunctory at best 
8,win map It sweep Hawks the was the road have Cavs Atlanta finals the would true to Eastern Conference stay to get in order to were where they Tuesday wins just championship that 118-88 a four aforementioned rousing 
8,bottom hurt If Cavs make trades their might not out January Varejao Anderson does n_t get Christmas two roster-overhauling 
8,_s became how That Cavs the are Cavs the team a makes what lives that breathes champion a qualities those sacrifice-first said that James 
8,said crazy It Irving referring video Cavs _s video the start the pregame _s that come We season the there up all places different 
9,swept But Cavs also Hawks the pulled because Atlanta they together team a 
9,easy went much So it _s forget to right Cavs reason they were the much so went wrong Hawks the 
9,suffocated But game nearly every Cavs Hawks the shooting 42-percent playoffs the team every 
9,better That _s actually percent the 41 much allowed Cavs have normally 
9,are reasons Those more easy why it _s believe to have Cavs stop plans no to championship an Eastern Conference 
9,spent remember And Cavs seasons the worse four this purgatory pro basketball 
9,is Truth compiled Cavs record NBA the worst seasons the past four 
9,are Cavs Love Kevin Achilles surgery surgery shoulder Varejao Anderson 
9,advantage That is a great possess to the it _s not all possess 
9,are Both things those done why Cavs may not be just yet 
