0,defended Harden Houston 13 is Iguodala Golden 9 half the Center Toyota Rockets guard James State Warriors guard Andre second game four Finals the Western Conference Playoffs the 
1,lie Finals The ahead 
2,writer NBA 
4,reflect beating Hawks the Join Conversation Nation the maturity his Zillgitt Jeff Sports USA Arena Quicken Atlanta Game 4 Finals the find To TODAY EDT 2:28 May 27 Cavaliers Cleveland Loans Eastern Conference Playoffs the out more Facebook commenting led read please a.m. 2015 Jr. forward James LeBron James Bryce NBA Finals patience Guidelines the leadership LeBron James 23 sons his Maximus FAQs LeBron cast young Conversation 
4,had He points 23 assists rebounds nine averaged series the assists rebounds 11 to Bureau Elias seven Game 4 he assists points 30.3 lopsided nine series a Sports rebounds 11 9.3 becoming player the at least first history average points 30 
4,joins He also list another play He non-Celtic he exclusive will Finals his is the first do to do first fifth consecutive joining list short it to it teams two Celtics former did who Boston it 1960s the 
4,trip This is experienced city the Cleveland first Finals the 2007 led when has not championship a 1964 James there them stint his sports a first Cavaliers the major pro 
4,hard It _s difficult fact the know been if so win just it is very very won that you do n_t is difficult how you _ve never situation this to game an we _ve series three far so it playoff 
4,guard Irving Cleveland 2 celebrates Smith J.R. Playoffs the Cavaliers guard Kyrie 5 James forward 23 beating Hawks the Arena Quicken LeBron game four Atlanta Loans Finals the Eastern Conference 
5,are Cavaliers The Finals the 
5,get Curry Warriors-Rockets Warriors the Golden close chance another Stephen State to out Rockets the franchise the night Wednesday _s Finals first home advance years 40 
5,avoided Howard Rockets The suspened being Game 5 Dwight upgrade when NBA did not flagrant his flagrant a 1 foul Bogut Andrew 2 
7,celebrate quarter the Smith Cleveland 5 James LeBron night Tuesday fourth victory a J.R. 118-88 Atlanta Conference the NBA Western 
7,are Cavaliers The Finals the 
8,reserved Cavaliers the replicate Hawks The returned Irving Kyrie spot an rout a win to could not Play3 their 5h :08 missing games two NBA Finals Hawks the title the regular-season success scored James LeBron Atlanta Eastern Conference points 23 
8,Finals Cavs stay true map their 3m big fans Cleveland breaks Daugherty ESPN Finals road down means what Brad trip a city the Finals the Cleveland 
8,asked McMenamin Dave Cavs ESPN.com Covered ESPN.com writer NBA the CLEVELAND 2005-09 end the James LeBron was kind the considering setting the Lakers the ESPNLosAngeles.com NBA NBA.com couple room the season the question receive that mass scrum 2009-14 for a days postgame locker regular would usually response a perfunctory at best 
8,said know I James assists turning page the do n_t have chapters many how _s there rebounds 11 nine series a to Bureau the order short becoming player the Atlanta we book the far season this five at least Elias Sports history the points average first as playoffs the 30 at least 
8,morphed preaching While team his actual has almost month October group a James has been definition the beginning the month perception the back scrappy underdogs that same team camp training squad league the will be eyes the face should newest super Vegas Las they Warriors the Finals the Golden State 
8,playoffs 2015 Follow Keep action the track series every have hurt If NBA playoff Thompson maybe does n_t coming his process the Love does n_t get round the out party rounds the revamping defense their first playoffs the latter up-and-down 
8,foresee And Blatt could n_t end that make relatable him some pressures the would up humanizing actually more team his outside face he him _d season his NBA rookie 
9,advancing Finals the NBA 
9,is Truth compiled Cavs the record NBA worst seasons the past four 
