1,defender Shumpert Iman grabbed Thompson Tristan made Smith J.R. had Mozgov Timofey is team the best perimeter has rebounds 10 seven starts his 3-pointers eight Game 4 rebounds 10 points 14 more nine Game 1 four 
3,picks shipped He Smith J.R. brought in Shumpert Mozgov Timofey out Waiters draft some 
4,acquired Cavs the gave Cavs Griffin general had just Smith J.R. Shumpert Iman Knicks the Mozgov Timofey Nuggets the support his manager David New York Denver non-wavering Blatt earlier days nine 
4,found Irving Kyrie Love Kevin Thompson Tristan Dellavedova Matthew Jones James Mozgov Smith all ways contribute to 
4,playing Smith are defense perimeter scoring 
7,19-20 they lost Cavs The were trading Iman Varejao center injury a December Shumpert Smith Mozgov Timofey Anderson season-ending Achilles helped of all transform Cleveland whom 
8,chants becoming occurrence a Q The James choosing shot the ejection Smith J.R. suspension Chicago redemption Atlanta adjustments Blatt David Thompson Tristan nightly do to corner jump Boston defensive _s coming out damage some once twice party display Shumpert protection Mozgov Timofey triples Jones James right late-game not two-way rim on down line the 
8,foresee And Smith could n_t thing that given being would actually be a good up on by Jackson Phil 
9,goes Same Irving Iman Mozgov Timofey Smith J.R. points 18 Dellavedova and played who rebounds 10 even minutes 17 sick being important 
