5,coached He son his 's who Jr. Tony Phillies Philadelphia 
10,take Kruk pick a third-round would longer quite get to would not blossom truly leagues the joined after Padres the bit a show the big he Phillies middle the phase the season the secondary draft the 1989 1981 
10,spent men The parts seasons four together roster Padres the won Gwynn two big-league already had titles batting three was way his another year the traded Kruk was Phillies Ready Randy James Chris 
10,beat average His reporter sat .411 games 20 agreed when Gwynn talk to Phillies 28-year-old 
10,were days Two interview the Phillies Stadium Dodger acquitted when officers four were case the Los Angeles police Rodney King 
10,became city The beat zone a correspondent reporter became war Phillies 28-year-old Courier-Post the Los Angeles Riot 
12,remember Sandberg Phillies Bowa Gwynn Tony JUN MSN p 2014 Sports legendary Updated 16 8:43 ATLANTA ET room Phillies The father the hitter game ambassador bar FOX locker full was death the Philadelphia outfielder Phillies Jr. Tony hearts heavy Monday learned after Hall Gwynn Famer Gwynn club the Tony 
12,Hit release While Club 3,141 exact to spoke Sandberg skipper team the did n't statement a reporters be game Monday Ryne Bowa bench formal Gwynn the mainstay a franchise his member a Braves the coach Larry older 20-year Padres the only MLB 3,000 the San Diego 
14,extend all clubs our I condolences my wife Tony Alicia deepest Jr. their Anisha their franchise the fans his admirers his son Tony Phillies daughter Padres Diego San many baseball 
