0,GRIMM NICK converted Nettleton woman Islam married when Tara she sweetheart her beginning life a one who childhood man the himself would become arguably notorious the world the father who most terrorists recognisable would children their five 
1,have News User Network Social * chance every Login children FIVE Login Social reintegrated being Sydney trying return to society Australian Syria 
2,horrified world the year last posting account his photograph a clutching head the Twitter Syria son his severed 7-year-old 
2,reported newspapers Fairfax Wednesday convert that Media family the trying wife Australian Sharrouf _s Nettleton Tara was help to return children her Muslim her five 
2,brought Nettelton later boys their Syria flying tickets return three young daughters two hide to Malaysia teenage officials Airport destination their intended 
2,told love I father the reporters home his still daughter my hope comes she home safely 
2,was Sharrouf among men nine plotting attacks terrorist cities Australia Muslim accused 2007 materials stockpiling largest bomb-making 
4,said face family The Abbott response report a newspaper the Sharrouf Khaled would consequences the fighter suspected Morning Herald seeking that same Australian Islamic State wife Sharrouf was repatriation children their 
