1,Taking Players Across Chapter the Globe Bruce Campbell Joins Next Saga the Fan-Favourite Exo Zombies 
1,maps This is only not the four new multiplayer continuation the saga the popular Exo 
1,said fans We takes able to this Schofield Glen Co-Founder Studio head Games Sledgehammer _re huge Campbell Bruce level a be add to new him roster the great already performers Zombies 
1,continues saga The episode the all-new Carrier popular Exo 
2,includes Supremacy also episode a Carrier new Exo trapped which heroes the are carrier an four Atlas aircraft 
3,maps This is only not the four new multiplayer continuation the saga the popular Exo 
3,said fans We takes able to this Schofield Glen Co-Founder Studio head Games Sledgehammer _re huge Campbell Bruce level a be add to new him roster the great already performers Zombies 
3,continues saga The also episode the Carrier Exo all-new 
4,includes addition Another chapter another saga the DLC the Exo called Carrier 
