1,experience Houses the confines the snowy Moscow players will landscape a famed Parliament London Kremlin diverse mayhem multiplayer return the Highrise debuted which one maps the Warfare Modern transported now first Call 2009 iconic most multiplayer Call history Duty ® 2 year the ® Duty 2054 
1,Kremlin · prepare Gamers must combat intense palace Russia navigate as presidential Kremlin the they buildings the new map worn-torn Square Red map this medium-sized three-lane 
2,Set palace Russia players this medium-sized navigate to presidential three-lane map forces buildings the worn-torn Square Red 
3,experience steps the confines the snowy Moscow players will landscape a famed Parliament London Kremlin diverse mayhem multiplayer return the Highrise debuted which one maps the Warfare Modern transported now first Call 2009 iconic most multiplayer Call history Duty 2 year the Duty 2054 
3,Kremlin prepare Gamers must combat intense palace Russia navigate as presidential Kremlin the they buildings the new map worn-torn Square Red map this medium-sized three-lane 
4,Kremlin prepare Gamers must combat intense palace Russia navigate as presidential Kremlin the they buildings the new map worn-torn Square Red map this medium-sized three-lane 
