0,allowed But hot the hitting push them Turner Guerrero Alex to Uribe chart Dodgers the base third depth 
1,allowed But hot the hitting push them Turner Guerrero Alex to Uribe chart Dodgers the base third depth 
2,included It doubles RBI Kendrick Howie Ellis A.J. double a single a RBI Kershaw two-run Ethier Andre run-scoring Turner addition first 2015 
4,marginalized â A Uribe had been ascension late emergence the baseman the fan â dol Turnerâ dol s Guerrero Alex primary third clubhouse dol favorite 
4,had figures Callaspo shadow the expendable could Guerrero have to become even more deemed when role no Olivera Cuban is ready leagues the point some greater Uribe infielder Hector major month the next or so 
5,followed Turner Justin walked Gonzalez hit with was intentionally base a plated that Kendrick lead a 2-0 
7,had Kendrick Turner singles RBI inning the big 
7,smiles HOW HARRY IMAGES GETTY Turner Justin right greets as he Rollins Jimmy returns as he dugout the scoring run the first game the inning the fourth 
7,IMAGES GETTY HOW HARRY scores Dodgers The Turner a single give to Howie Kendrick Justin team his lead a inning the 2-0 Braves the fourth Atlanta 
7,watches Turner Justin left HOW HARRY center point base second doubled after IMAGES GETTY Guerrero Alex Ethier Andre them in during inning team the night Gonzalez Dodgers The Tuesday six-run fourth Adrian 
8,Dodgers 5_26_15 runs inning six-run singles three inning the elected open With Dodgers The plate six inning the 4th Dodgers ATL@LAD: 4th MATTERED THAT MOMENTS the Braves the walk to base first fourth the put together 4th backfires Strategy Braves intentionally get Gonzalez rally a piling up to Turner big runs six using three doubles 
8,RBI lines single RBI an single 5_26_15 right single to right scoring increase Kendrick Howie fourth the ATL@LAD: Turner ropes Justin to lead Dodgers the Teheran 2-0 Turner RBI an resumes struggles allowed facing minimum the Teheran produce Dodgers the innings the to baserunners seven out first three straight one 
9,become Uribe meanwhile has marginalized plans Dodgers the emergence the play the Guerrero Alex continued strong Turner 
