1,appears establishing support wide getting to be bank a closer joining possible league the include to China-led Asian investment teeth the year later major currencies reserve yuan the unit Fund the opposition U.S. this deal a account International Monetary 
3,currency Subscribe trumps Now is now region the leading doing business dollar Kong Hong Yuan Yuan yen ET Updated May 27 China trumping yen the currency to Push Bears Fruit 12:09 a.m. yuan The 2015 dollar the pushes as Japanese become region top doing business Hong Kong Beijing aggressively currency its channels international China trade 
5,spur This could appreciation further renminbi the represent that could depressant another complicating efforts prevent to economy the slowdown an year this Chinese sharp unduly 
5,highlighted conflict A was seminar a renminbi the possible ambitions China on other the need the keep to SDR the organized week last international monetary hand the economy the keel an Institute the group central Monetary the Forum Financial one even International Monetary University Renmin bank research Official Institutions 
5,was consensus The was that from point a general seminar the renminbi the well probably way the membership SDR technical view 
4,May 27 Fund The Xinhuanet International Monetary says Tuesday undervalued yuan the note the is longer no Chinese previous undervalued modestly 
4,undervalued says Source english.CNTV.cn yuan the Chinese is longer no note the English.news.cn 11:06:57 2015-05-27 Xinhuanet Fund The Tuesday previous undervalued modestly May 27 International Monetary 
