0,carrying conflict year last out executions summary Strip the Palestinians Gaza 
0,said report The last the four were that released group the Palestinians 23 at least shot killed human rights detailing events Hamas rules which arrested while tortured fighting the dozens more were 
0,revealed report The also used that continued even Hamas areas abandoned as parts other function to hospital a detain to facility the centre a City question torture captives medical sic -LSB- -RSB- 
0,fear actions These Strip the spine-chilling designed some amount which crimes war were revenge exact spread 
0,seized Hamas violently forces loyal Abbas 2007 leaving Palestinians divided bitterly Gaza Hamas parts governing ruling Abbas Bank the West 
0,accused March International Amnesty Hamas crimes war saying breach that launching rockets unguided was a law international areas civilian areas civilian mortars Israel 
0,told reaction latest the Bardawil Salah official a Press the report Amnesty Hamas Associated took incidents the International place framework the investigating Hamas mentioned report the law the was them 
2,commemorate anniversary the to 27th group the City Gaza 
2,accused International Amnesty group the militant saying some amount the May Wednesday abducting torturing crimes war actions 27 2015 killing Palestinians war the summer the Strip 2014 
2,holds AP Photo_Khalil FILE weapon a rally a Hamra File Press The photo this Dec. 14 gunman a group militant commemorate to Associated file 2014 masked Palestinian Hamas the anniversary the 27th group the City 
2,accused group the International Amnesty saying some amount the militant abducting torturing May Wednesday crimes war actions killing Palestinians war the 27 2015 summer the Gaza Strip 2014 
2,hold gunmen AP Hamra Photo_Khalil weapons rally a Palestinian group the File Press The masked FILE commemorate to Hamas militant Associated In this Dec. 14 2014 photo file anniversary the 27th group the City 
2,accused International Amnesty group the militant saying some amount the May Wednesday abducting torturing crimes war actions 27 2015 killing Palestinians war the summer the Strip 2014 
2,torture detailed Hamra AP killings and summary forces Hamas conflict the File Press The International Amnesty abuses the report a Photo_Khalil Palestinians 2014 Associated entitled Strangling Necks Abduction 
2,shot to group the London-based Palestinians some were killed were dozens more human rights 23 arrested tortured Hamas rules which 
2,highlighted report Wednesday took incident a place Aug. 22 particularly brutal said which it 
2,seized Hamas violently forces loyal Abbas 2007 leaving Palestinians divided bitterly governing Gaza Hamas parts Bank the ruling Abbas West 
2,fear actions These Strip the spine-chilling designed some amount which crimes war were revenge exact spread 
2,said report Amnesty also abducted that Hamas people tortured in clinic an outpatient was that longer no use grounds the hospital City Shifa main 
2,report This was not Amnesty first war the 2014 
2,accused March group the Hamas crimes war saying breach that launching rockets unguided was a law international areas civilian areas civilian mortars Israel 
2,said official a Bardawil Salah took incidents the Hamas Gaza place framework the investigating Hamas mentioned report the law the was them 
3,strike targets Strip the Israeli Batsheva planes fire rocket Gaza Sobelman a warning group the Hamas militant 
3,said was There Lerner claim no part the holds Israel immediate responsibility organization any emanating Hamas Palestinian responsible attacks all Strip the 
4,killed group the Palestinians war the killed Palestinians Gaza Strip The militant tortured Hamas Israel war the year the Israel Gaza Strip last 
4,reported Hamas controls which dozens arrested tortured group the Palestinians executed 23 at least human rights 
4,arrested takeover Hamas being 2009 years two convicted collaborating Israel violent strip the Gaza 
4,contributed Alouf Special report this correspondent Rushdi Abu City 
5,killed war 2014 Palestinians AP 4:26 Gaza win advance 6:05 Hawks Atlanta complete to AM Cleveland Cavaliers Finals NBA sweep AP 118-88 
5,struck bar Amos IDF 2015 bar targets four Strip the dawn Wednesday fired after Harel May 27 1:58 AM aircraft southern rocket a was Strip the Tuesday evening Israel southern 
5,issued Forces The statement a short stating targeted it Israel Defense had hit targets militant fire the infrastructure Strip the response rocket southern 
5,sounded Sirens fired projectile one At least was exploded area an open city the port Ashdod north kilometers 20 some Strip the Gaza 
5,provides Haaretz.com coverage extensive in-depth Israel World the East the defense diplomacy Middle Jewish conflict the process the politics Israeli affairs Jerusalem relations international Iran Iraq Syria Lebanon Authority the Bank the Strip the world the life Jewish Arab-Israeli peace Palestinian West Israeli business Israel Diaspora the 
6,carry rally a ago minutes 58 militants View wing the mock-rockets carried force The said eyewitnesses Palestinian hours after attack a camp the AFP photo Palestinian brigade the armed Hamas out strikes four targets militant Strip the Wednesday early Israeli air cross-border rocket state the Nuseirat refugee Strip the Ezzedine al-Qassam Gaza Jewish Central Gaza December 12 Territories Palestinian 2014 City AFP Photo_Said Khatib Gaza 
6,said targeted planes The witnesses the camps training belonging Jihad the Rafah Yunis Khan Islamic City 
6,said army The struck it infrastructures four Israeli terror response attack the Strip the rocket southern 
6,assumed Hamas Islamic rules which de has not responsibility attack the movement facto 
6,third rocket Tuesday was the fired ceasefire the ending conflict the summer 2014 50-day killed which Palestinians 2,200 side the most soldiers them most civilians them 73 Israeli 
6,Territories Strip Palestinian Israel southern review We _ll make changes needed 
