0,carrying conflict year last out executions summary Strip the Palestinians Gaza 
0,fear actions These Strip Gaza spine-chilling designed some amount which crimes war were revenge exact spread 
2,accused International Amnesty group the militant saying some amount the May Wednesday abducting torturing crimes war actions 27 2015 killing Palestinians war the summer the Gaza 2014 
2,accused group the International Amnesty saying some amount the militant abducting torturing May Wednesday crimes war actions killing Palestinians war the 27 2015 summer the Gaza Strip 2014 
2,accused International Amnesty group the militant saying some amount the May Wednesday abducting torturing crimes war actions 27 2015 killing Palestinians war the summer the Gaza 2014 
2,fear actions These Strip Gaza spine-chilling designed some amount which crimes war were revenge exact spread 
3,strike targets Strip the Israeli Batsheva planes fire rocket Gaza Sobelman a warning group the Hamas militant 
3,said was There Lerner claim no part the holds Israel immediate responsibility organization any emanating Hamas Palestinian responsible attacks all Strip Gaza 
4,killed group the Palestinians war the killed Palestinians Gaza Strip The militant tortured Hamas Israel war the year the Israel Gaza Strip last 
5,airstrikes Strip southern Gaza response 
5,struck bar Amos IDF 2015 bar targets four Strip southern dawn Wednesday fired after Harel May 27 1:58 AM aircraft Gaza rocket a was Strip the Tuesday evening Israel southern 
5,issued Forces The statement a short stating targeted it Israel Defense had hit targets militant fire the infrastructure Strip southern response rocket Gaza 
5,sounded Sirens fired projectile one At least was exploded area an Gaza open city the port Ashdod north kilometers 20 some Strip Gaza 
5,provides Haaretz.com coverage extensive in-depth Israel World the East the defense diplomacy Middle Jewish conflict the process the politics Israeli affairs Jerusalem relations international Iran Iraq Syria Lebanon Authority the Bank the Strip Gaza world the life Jewish Arab-Israeli peace Palestinian West Israeli business Israel Diaspora the 
6,carry rally a ago minutes 58 militants View wing the mock-rockets carried force The said eyewitnesses Palestinian hours after attack a camp the AFP photo Palestinian brigade the armed Hamas out strikes four targets militant Strip the Wednesday early Israeli air cross-border rocket state the Nuseirat refugee Strip the Ezzedine al-Qassam Gaza Jewish Central Gaza December 12 Territories Palestinian 2014 City AFP Photo_Said Khatib Gaza 
6,said army The struck it infrastructures four Israeli terror response attack the Strip southern rocket Gaza 
6,Territories Gaza Palestinian Israel southern review We _ll make changes needed 
