0,revealed report The also used that continued even Hamas areas abandoned as parts other function to hospital a detain to facility the centre a City question torture captives medical sic -LSB- -RSB- 
2,commemorate anniversary the to 27th group the City Gaza 
2,holds AP Photo_Khalil FILE weapon a rally a Hamra File Press The photo this Dec. 14 gunman a group militant commemorate to Associated file 2014 masked Palestinian Hamas the anniversary the 27th group the City 
2,hold gunmen AP Hamra Photo_Khalil weapons rally a Palestinian group the File Press The masked FILE commemorate to Hamas militant Associated In this Dec. 14 2014 photo file anniversary the 27th group the City 
2,said report Amnesty also abducted that Hamas people tortured in clinic an outpatient was that longer no use grounds the hospital City Shifa main 
4,contributed Alouf Special report this correspondent Rushdi Abu City 
6,carry rally a ago minutes 58 militants View wing the mock-rockets carried force The said eyewitnesses Palestinian hours after attack a camp the AFP photo Palestinian brigade the armed Hamas out strikes four targets militant Strip the Wednesday early Israeli air cross-border rocket state the Nuseirat refugee Strip the Ezzedine al-Qassam Gaza Jewish Central Gaza December 12 Territories Palestinian 2014 City AFP Photo_Said Khatib Gaza 
6,said targeted planes The witnesses the camps training belonging Jihad the Rafah Yunis Khan Islamic City 
