5,carries firing rocket say sources 12:02 Hello profile user killed Palestinians IDF AM out airstrikes Strip southern Haaretz bracing Hamas AM 11:31 PM Gaza Amnesty tortured Logout bar Hamas war 2014 AP 4:26 Gaza response counterstrike possible Haaretz PM 10:21 Gaza win advance 6:05 Israeli kill PM 9:33 Hawks Atlanta complete to AM Cleveland Cavaliers Finals NBA 43 at least state Nigeria Reuters strikes Capitol 7:47 8:12 Haram PM sweep AP 118-88 Borno targets four attack pre-dawn PM U.S. building evacuated investigating police Boko Strip southern reason alarm audible Reuters kills PM 5:01 strikes PM 4:29 Gaza Texas 7:23 members 140 than more base Raqqa military Syrian targets Gaza firing rocket Force Israel IDF 3:37 PM resident charged conspiracy ISIS raid air Reuters Israel Air PM provide to support material Reuters ISIS 5:30 Yosef PM Yehuda suspected crimes multiple Mayor David Haaretz sex 
5,Sign up get to stories top agree directly inbox your i Terms site this TO TALKBACK THIS like use Please REPLY use Name Comment Subject _d recieve to I Register a thank comment Your emails offers appeals get To here adding comment a valid email address you submitted talkback Your agree here use info commercial Follow latest the get Name articles comment Your has been successfully adding comment a i Terms site this @Haaretzom Like us Facebook Haaretz directly comments your Name Comment Subject news feed 
5,appear selected If it will soon as publication possible 
5,bar Seidler Shirly Cohen Gili Harel Amos Khoury Jack Haaretz.com PM Israel East the edition the analysis Middle online Newspaper Haaretz Israel 
5,provides coverage extensive in-depth Israel World the defense diplomacy East the Jewish conflict the process the politics Israeli affairs Jerusalem relations international Iran Iraq Syria Lebanon Authority the Bank the Strip the world the life Jewish Middle Arab-Israeli peace Palestinian West Gaza Israeli business Israel Diaspora the 
5,© Ltd. Daily Newspaper 
