1,GBP instance you can type 550 INR Pounds Rupees 
1,get know If you can also results typing dollars 100 Rupees you do n_t code the US currency 
2,sided More More points Times 11.55 IST AM has Google to filing a bar India Times India HI Times The FRANCISCO RELATED court Reuters May 27 The WASHINGTON_SAN administration The 2015 Obama 
2,Follow Tech TOI updated like Commission us Facebook >> go the Twitter >> Times App News android Stay Java TOI_tech > http:__timesofindia.indiatimes.com_followceleb.cms?alias=Oracle,Google,Federal Trade @toi_tech > 
2,enter Please details your account User Name Across Trending Times Find Topics offensive this comment 
3,covers Ribeiro John technology outsourcing general breaking news 
