9,did nuptials the massacre the show the it again Joffery King threes that fantasy Tyrell Margaery was season Wedding Red 
9,poisoned Joffery wedding the is 
9,turns face Joffery clouded purple eyes his become blood 
9,raping tomb Joffery sister his 
9,did massacre the show the fantasy it again nuptials the threes that Joffery Tyrell Margaery was season Wedding Red 
9,poisoned wedding the is 
9,turns face clouded purple eyes his become blood 
9,by However episode two shocks Jaime all raping sister his us tomb 
