6,losing Rules renovation again out reality series House 
6,beaten Rules Network soundly Seven the House had which audience an million 1.572 
6,had episode the note a audience an second season the brighter Nine increased new Husbands House 
6,move Hubsands House However will nights Sunday weekend this follow immediately Voice The progresses which now live to shows 
6,Rules million 1.572 Seven 2 
6,Husbands 10 Nine 
7,branded dragon the three-headed Targaryen House 
6,recorded Meanwhile Australia The Voice has ratings its season the losing again lowest Monday night out Rules renovation reality series 
6,second Monday night Voice The was beaten soundly Seven the Rules Network had which audience an million 1.572 
6,had note a episode the second audience an brighter Nine season the increased new Husbands 
6,move However Hubsands will nights Sunday weekend this follow immediately Voice The progresses which now live to shows 
6,Rules million 1.572 Seven 2 
6,Husbands 10 935,000 Nine 
7,Longclaw That 's gotten what drink glassware branded dragon the buy me others three-headed Targaryen to replicas sword Jon 
