3,thanked Duncan Spur former Hall Robinson Famer sat who crowd the wearing T-shirt a championship 
3,said give I Duncan lot a credit 
5,thanked Duncan Spur former Hall Robinson Famer sat who crowd the wearing T-shirt a championship 
6,was teammate Duncan Robinson hand celebrate to former 
6,PHOTO J. Phillip/AP Photo Spurs San Antonio San Antonio celebrates forward Leonard Kawhi third right Game 5 June 15 finals the Heat the 2014 NBA basketball Miami 
6,PHOTO J. Phillip/AP Photo Heat Miami Antonio San pauses forward James LeBron plays Spurs the June 15 San Antonio half the 2014 second Game 5 finals the NBA basketball 
10,fell Credit AP / confetti the black silver embraced rafters the Phillip J. other each championships Robinson David AT&T Center Duncan Tim Popovich Gregg members Spurs past Elliott Sean Johnson Avery 
11,was Robinson there start the mentored when he so graciously sensation this Wake to stoic gone who Forest middle the had Islands the Texas Virgin 
