1,insisted But Jones U.S. midfielder lesson example the was a valuable take that Spurs the shut whose Americans the could encouragement from mentality collective down Heat the LeBron Miami games five 
1,bode good If it will definitely well them they can do as job a stifling Ronaldo did as Spurs the James 
4,delivered Spurs The end a decisive reign Heat the world the routing James teammates his two-year Miami basketball win to Sunday Antonio San Finals the one four NBA games to 
6,had James superstar points 17 first-quarter help to LeBron get Miami off start a fast game Sunday 
6,PHOTO David J. Phillip/AP Photo Heat Miami Antonio San pauses forward James plays Spurs the June 15 San Antonio half the 2014 second Game 5 finals the NBA basketball 
7,going James LeBron is not anywhere ANTONIO The kept side one outclassed mouths their Washington Post SAN champions the hugging court the seconds the team agape administered much how new waning TKO a they James LeBron beatdown a five-game 's 
7,discusses crew The has many how championships more Post Sports Live NBA win to James considered to be one players the greatest basketball time all 
8,serve It would run as culmination the imagined that title a outside few could have season just loss a surprisingly dominant room the last devastating James Heat the locker Miami 
9,celebrating guard Spurs The was morning this win after back-up point Monday 's whitewash a James Heat the final 4-1 playoff 
10,sits James LeBron PM 7:21 Heat AL bench the half the IANNAZZONE al.iannazzone@newsday.com Miami forward second Game 5 Finals the NBA 
10,reached Miami Finals four NBA years the took since four James Bosh Chris talents their Beach South play to Wade Dwyane 
10,is Miami there uncertainty some opt because could contracts their 
10,is But thing the important most 's what Miami mind 
10,place Antonio San might be the only go he happening that could improve that 's not would chances winning 
10,said James trying guys You are find to answers 
10,seems peace life his basketball 2-3 being Finals the NBA 
10,helps won Having surely enough two two them wo n't be 
10,said want You win to nature that all them 's just not the game the 
