0,expected paths the Blood The had been zigzagging Filles La Guardian Planche des Belles kill such an abrupt 
0,was It Filles Planche des blasted that Belles ago years two Sky Team peloton the apart Froome Chris winning stage the Wiggins Bradley slipping yellow 
0,has Filles Planche name a lyrical des Belle derived legend a story an grizzly apocryphal killed which girls local themselves jumping lake a fearing torture Army the Swedish war years the thirty 
1,regained Nibali leader the Astana also lead the Gallopin France team overall race Tony taken who had jersey leader the him day a trek the city the finish a yellow earlier 161.5-kilometer 100-mile eastern Mulhouse super-steep uphill Filles Planche des Belles 
1,holds Contador Alberto knee his crashing Stage 10 France the 2014 Tour de Mulhouse Filles Planche France des Belles 
1,featured section The up Filles a punishing gradient 20 last ascent the percent shook which final expected as up pack the gave indication a Paris July 27 clearer contenders victory overall race the three-week Champs-Elysees the 
3,broke But instead he shinbone his crash a trying gamely abandoned around descent a continue to halfway stage Monday Mulhouse Filles Planche fast gruelling 10th des Belles 
4,put won As Nibali seconds 20 Porte climb the finish the he stage the steep final station the ski Filles Planche des Belles region the Vosges 
6,planning Contador Someone relishing who he 's fireworks is legs permitting will be run the Filles Planche 161.5 km Mulhouse des Belles 
7,surprises There could be a few crashed nothing expected affect to section a summit the remounted bike his rode 10km than more Contador the downhill stage the Filles Planche abandoning race the overall 161.5 km Mulhouse des Belles 
10,http:--www.smh.com.au-action-externalEmbeddedPlayer?id=d-3bxkc PT1M1S 349 620 July 15 Filles Planche forget Porte Richie 2014 des Belles can now flying radar the win to France the Tour de 
10,Photo The AFP expected Tasmanian 29-year-old is now lead to charge the Nibali was whose reclaim jersey the victory an Mulhouse summit the yellow emphatic stage the Filles Planche 161.5 km des Belles 
10,Powerhouse Nibali Astana team rider Vincenzo cycles Italy win to line the stage the finish 161.5-km tenth Mulhouse Filles Planche Des Belles 
11,ski began When pundits many race resort Stage 10 Nibali and expected try Contador himself to erase to deficit his Filles Italian attacking ride the 2-minute des Belles finish the Planche La 
11,regained leader The lead the Gallopin France Mulhouse eastern finish the Astana team Tony trek the steep Filles Planche 161.5 km des Belles 
13,believes trek stage the Although rider the was Monday Filles La hardest Astana Planche des Belles won which he reclaim to jersey the yellow 
15,reclaimed Filles La Independent.ie Published 17:32 bar 14-07-2014 jersey the victory a Planche des Belles crosses Nibali Italy yellow tremendous win line the were There Vincenzo to stage the today finish fireworks Bastille Monday abandoned as tenth France the Day stage 10 Contador Alberto crash a Tour de France the Nibali Vincenzo Tour de 
15,reminder finish The was a Britons Froome the Filles Planche absent Wiggins Sir des Belles Bradley 
3,changed changes Contador retirement The has dynamics the to Porte Australian absence dynamics Porte Times The Contador Alberto race the Richie FILLES India France the LA PLANCHE DES BELLES Tour de Monday 
4,moves July 15 Porte second Tour Press Australian France AFP July firmly Porte Richie 2014 FILLES LA Associated Published GMT 05:50 July 15 05:50 GMT 14 is contention champion to turned after PLANCHE DES BELLES Updated 2014 bar become Australia second Tour de France race the was on head its again yet 
5,crashes STATION Other Contador Alberto bar Tour France abandoned crash a Sports bar The Seattle Times LA PLANCHE DES BELLES FILLES SKI de France Contador Spanish France the Monday severe descent a cyclist Alberto team the Tour de tears steep Tinkoff-Saxo 
