12,victor wins If he will be first Italian Pantani 1998 Nibali Tour the 
12,died overdose a ago decade a allegations doping cocaine 
12,said Nibali give he would mother jersey a succeeded if yellow he following up son her 's win 
13,has Pantani tragic Nibali mind eyes as has Nibali Vincenzo he France title Tour Reuters already set a has he Reuters Tue Julien IST BESANCON bar decent jerseys leader Tour one put one pm 9:05 Pretot BESANCON France Jul 15 yellow de France aside mother Pantani Marco 2014 
13,rider prevail Should Nibali would become the first Italian win to he roads the race the Pantani late winner the French 1998 died who overdose a ago years 10 cocaine 
13,told proud happened what Nibali reporters park a day the leads which I would be very succeed to him hotel car first rest Tour the he advantage a Porte Australian 2:23 Richie 
13,said offered mother Nibali had one me win so jerseys his if I Tour this yellow bring I will one jerseys my her yellow 
17,makes Pantani Besanon vow Nibali visit Nibali Vincenzo bar Sport24 will tomb the pay wins homage cycling the Pantani Marco great if he France the Italian Tour de 
17,rider was the last Italian triumph event the greatest cycling world the back 1998 
17,said know We Nibali genius the all history honour me troubled tainted died who it would be an successor to 2004 poisoning cocaine be his 
17,favourite was a huge fan 1990s the aggressive his attacking style 
