1,featured section The up Filles Belles a punishing gradient 20 last ascent the percent shook which final expected as up pack the gave indication a July 27 clearer contenders victory overall race the three-week Champs-Elysees the 
9,pushes However aspiring keep to Nibali seat a footnote when jersey leader the from now much hotter one the occupied he he was a Froome Contador yellow overall entering race the 
9,fields There have been other open relatively Tour years recent went time the race the imbroglio early this last favorites two same it was a doping booted that Ullrich Jan such heavy them start the en route Basso Ivan in 2006 roads slippery 
13,knows Italian The treacherous that road the connoisseur who is is a great history sport his talk I can you Bartali Gino Hinault Bernard says he Coppi Fausto Bobet Louison 
15,won None riders the have event the took Nibali remaining step a bid his significant succeed to Froome July 27 
15,won Froome summit the climb the 2012 took as girls the beautiful Wiggins jersey the yellow held he winner when he became the first British race the 
18,seen We 've throws that Tour this surprises over everywhere so it 's not 
14,Tour PARIS far TODAYonline bar crashed stages just favourites the two have France the wasting Nibali Vincenzo 10 pre-race Tour de is time no showing man he 's now the beat to 
