0,said Bernanke making was progress policy its shore to three-arrow up growth adding necessary that policy Tokyo was aggressive monetary 
0,encouraged I _m seeing what I _m 
1,policy Japan growth making progress * 
1,said Bernanke making was progress policy its shore to three-arrow up growth adding necessary that policy Tokyo was aggressive monetary 
1,encouraged I _m seeing what I _m 
4,said adopted that Bernanke economies adopted that Europe Japan have floating rates exchange have rates fixed exchange 
