9,strokes Still lead his is four only Johnson Dustin birdied who 17 18 shoot to round week the 65 a sat while low players six adrift a Molinari Francisco further two shots Moore Ryan Fowler Rickie Garcia Sergio mates South Schwartzel Charl Oosthuizen Louis 
9,Scott score The had been Adam 's 68 tied Coetzee score the only afternoon crack to leaving boy the Furyk Jim after holes 36 was George 's 69 lone top-10 list the Thursday Africa par five-under 28-year-old birthday Warren Marc came that group the late-early 
15,suffered 44-year-old The nightmare a seven hole the driving shot tee his African opening face the spectator a left who was covered blood 
9,strokes Still lead his is four only Johnson Dustin birdied who 17 18 shoot to round week the 65 a sat while low players six adrift a Molinari Francisco further two shots Moore Ryan Fowler Rickie Garcia Sergio mates South Schwartzel Charl Oosthuizen Louis 
9,Scott score The had been Adam 's 68 tied Coetzee score the only afternoon crack to leaving boy the Furyk Jim after holes 36 was George 's 69 lone top-10 list the Thursday Africa par five-under 28-year-old birthday Warren Marc came that group the late-early 
15,suffered 44-year-old The nightmare a seven hole the driving shot tee his African opening face the spectator a left who was covered blood 
