Lobby Hobby Believe it | not Obamacare elated Pro-lifers The are ago years TWO upheld Court the Economist Act the Supreme Affordable Care known better 
brought case The Stores Burwell v Inc was families two Hobby Christian businesses their 
Lobby The chain a Greens own Hobby Mardel bookstore a Hahns the shops craft Christian Specialties own cabinetmaker a Conestoga Wood 
argued government The had claim that Lobby could not have to beliefs religious corporation because it is a for-profit 
wrote protects Protecting rights the Alito Justice Samuel liberty the free-exercise corporations Lobby Conestoga religious humans the Mardel own who control companies these 
faced refused If it fines year up $ 475m Lobby cover to a said which contraceptives the Alito Mr counted clearly four burden a substantial 
ordered July 1st Court the Supreme courts lower revisit to four the objections set a raised Lobby broader contraceptives 
goes decision their that than farther Alito Justice case the professed wrote when Hobby Lobby he it 
was One points the exempted that company the central made Alito could be requirement law the cover that decision the plans insurance contraception was because Hobby there means a restrictive less government the achieve to goal its 
is fact The cited what Alito Justice exists that himself decision the was that keep for procedure this Hobby proof there means a Lobby Hobby to clear involvement any restrictive less government the contraception accomplish to goal its guaranteeing care preventive 
warned came When liberals going that decision the down Monday it was open to Hobby floodgates the kinds all claims say which excuse beliefs religious people would held that should them following law the their sincerely 
is important case the As Hobby Lobby 
's That signal because it 's a clear everyone flexible that decision the is infinitely Hobby 
supports ruling Court the that position government the organizations religious-oriented favor claims the Supreme disputes separate nonprofit religious Lobby Hobby ongoing businesses other for-profit 
said Department The endorses decision the essentially Justice accommodation the Hobby made administration the already has charities faith-affiliated hospitals universities 
response filing Wednesday was administration the first legal decision the court Supreme Court Monday allowed that assert Inc. Oklahoma-based to claims religious avoid to Hobby businesses other covering some contraceptives all plans employee health 
decision Lobby Hobby The 
granted Monday hours just decision the request one Network the Hobby Court the such Alabama-based Eternal Word Television 11th U.S. Circuit Appeals Atlanta 
ruling Lobby Hobby 
free owners The plaintiffs the case the were always practice to Lobby religion their 
expanded decision Hobby Court The has already Lobby wasted Court Los Supreme time no delivering message a wrong You Angeles Times The Supreme anyone thought who 're limited ruling its was objections religious coverage methods purported Hobby Lobby abortion 
issued day The handing down decision the court the orders pertaining cases six Hobby Monday pending claimed which employers objections religious services all contraceptive required Act the Affordable Care 
ordered court The either courts appeals reconsider to rejection their light decision the let stand lower claims employers the Hobby endorsement courts claims those 
firm the beginning orders Tuesday lists 49 religious law represented that are just the Fund The cases federal Lobby Hobby Becket brought which case its companies for-profit have purportedly objections religious ACA the legal 
scratch Obviously called when Ginsburg Justice she did n't even surface the Ruth Lobby Hobby Bader dissent her ruling decision a breadth startling 
object But objected where family the promoting abortions others the contraceptives all Green owners the considered only more Lobby Hobby devices four they abortifacients crafts chain store birth control methods 
illustrates hint This problem the main opinion Alito Justice takes it swaddled that majority Lobby Samuel claims scruples religious granted Potter had merely rant an blanket a anti-government religious 
fail test If Lobby itself might invested plan its this were the way the has funds its companies manufacture that providing that 401 k employees mutual distribute drugs precisely objects it to plan its those devices health insurance 
hiring Early order | day Often Just a ruling Court the Hobby Lobby Supreme 
told address While one signees need concerns The letter the did n't directly Wear Michael Hobby addressed to Atlantic such be administration the 
agree Lobby The Americans Decision do n't ruling Court the Hobby case the U.S. Supreme Hobby Lobby 
finds aftermath the survey the HuffPost/YouGov satisfied Republicans immediate zones the far more Democrats court the rulings Court Supreme buffer favor Lobby against clinic abortion 
is Lobby Hobby Photo aspects the made that Get When galling ruling Monday case the it muddle a Corporations Things Both Ways July SAMUELS DOROTHY pm 2014 Supreme Court Hobby Lobby contraception concept the pmJuly 3:28 2 2014 J. 3:38 longstanding separateness corporate 2 
important benefit This is especially corporations held closely Lobby shared because liability any would otherwise be number a small members family shareholders other controlling 
Mess The Hobby 3 Facts Quick Need You June Monday Know Court Forbes 30 2014 forced that The Supreme announced case the would not be pay to Hobby Lobby recognized as insurance covers that it 's widely referred although contraception increasingly being as to Mess the well as Hobby Lobby 
believed Lobby owned family a business violates that having do to it freedom their so religious 
believes fact the Lobby acceptable this rely that is not want therefore women most control birth point some they do not have to America lives their contribute to dollars any control women birth 
provides Lobby still benefits employees need who treatments erectile dysfunction Viagra vasectomies 
had Lobby make justices five decision the win that male Court the Lobby Hobby would case their Supreme note women zero 
was control Lobby Hobby While this actual 
has Lobby outlets reported media various $ about 73 include that million invested recognized company the something prevented that Jones Mother aka pill a often type a makes that could have been control appropriate abortion prevention of pregnancy pill the birth hence Plan B morning-after 
game point this it 's a waiting see to employees lives the impact how exactly 's well as it this will only not sales the importantly more Lobby 
Shows Ruling Hobby Regulations Supreme Lobby Court Will Undermine Commerce News US is have While ruling yesterday not really contraception exercise the it will effects contraception Supreme Court case the free religion exercise the Hobby Lobby free religion 
READ -LSB- News Use You Can Gets Lobby Day Its tut-tuts Court hard it -RSB- Alito possibility such 's see to a why 
seizes court The status Lobby businesses a carve to closely-held family out freedom a new religious corporations based size their 
has all government the interest a assumes course compelling promoting access equal court the also Lobby has that see you employment government the interest a too turned how compelling promoting health women that out 
tailored Lobby however attempt government the was n't narrowly were enough pick companies Other promote to because there ways other could up slack the set ultimately insurers namely coverage insurance achieve to businesses those government the could simply up program a health women comprehensive objective the opt that i.e. taxpayers the new absorb to out cost the 
's short there reason no allow why logic the should n't company virtually exempt to it is Lobby any beliefs requirement any religious government regulatory grounds the company the 's 
proves ruling The get men law the Hobby Lobby still ca n't women immoral having | sex | Jessica Valenti theguardian.com Comment is free | ago years Thirty-five 
sex let Because was While Monday 's issue the is namely able if clear 's ruling US officially freedom religious supreme favor Lobby real stake women should be have to be court freely it men as 
argued Lobby has that corporation a it objections religious forms certain believes that contraception it abortifacients are are they not 
made concerns The are clear especially support Lobby sound which true freedom-seekers conservative briefs the more curricula abstinence-only amicus education arguments legal 
noted But Melling Louise director the call a seems that deputy legal Union the ruling the exceptionalism this only apply to American Civil Liberties comes when as lawyer writer it women rights reproductive tweeted Filipovic Jill made Whew #SCOTUS glad really sure impact decision its would n't negatively men need who care medical object religions some to 
Continue Breaking Reading wins Lobby central mandate The news is n't law the way the contraception coverage is mandate the individual 
matter Also POLITICO sides SCOTUS that does n't politically But Lobby control birth 
allows Also POLITICO Lobby ruling text full also ruling The say Republicans to violated that Obama law his have one protections the respected most constitutional freedom religion 
said House Earlier POLITICO Lobby aims win for Earnest press secretary ruling the jeopardizes health the argued allowed that White nation Christian Obamacare Josh women employed companies these owners the should not be assert to companies for-profit views their deny to personal religious employees their benefits mandated federally 
said POLITICO Poll says side most Earlier Gage Katie manager campaign advise I Lobby Hobby Packer strategist a deputy a Romney Mitt would n't grabbing Republicans Republican former 2012 to be megaphones the hands reporters 
say And now they can Republicans that those particularly ones are filed who the put who have briefs legal support Lobby bosses the control 
turns ruling Hobby dial back charging Breitman Kendall Lobby chairwoman Committee the is Court the turning back dial the Schultz POLITICO.com Democratic National Supreme rights women Rep. Debbie Wasserman ruling its contraception Monday 
Continue came criticisms Schultz Reading handed after Wasserman Court the down ruling a Supreme Lobby says that claim companies for-profit can right a opt to religious covering forms certain employees families their control birth 
said decision on Also Schultz Wasserman This is a stifling women American POLITICO rules SCOTUS favor Lobby 
called blasts Hillary disturbing ruling Court the Clinton ruling Hobby Glueck Katie deeply case the Supreme Lobby Clinton POLITICO.com contraception-related Hobby Lobby Hillary Monday 
touted promote on Also Choices Hard rights her bona fides saying choice that Clinton been who to book her POLITICO sides SCOTUS pro-abortion abortion is a hard but one decide that has tour new Lobby control birth individuals should themselves 
argued she setback that decision the called one Hobby is a rights women point step it noting believe that a slope a employers some do n't transfusions example really bad slippery blood 
said troubling It Clinton 's very using that clerk a should be contraception sales Lobby Hobby need who going contraception expensive which is not get to is pretty service that plan employer her think because health care employer her does n't she 
make But ruling Monday will obtain exemption that said Blomberg Daniel attorney an Liberty Religious easy very to Fund the represented who Becket Lobby 
one fallout The could be challenges the ruling the first Burwell new Hobby HHS Secretary Sylvia Mathews started who job her ago month a than less 
owned addressed ruling The family a smaller woodworking company companies for-profit Lobby Hobby Lobby Specialties Conestoga Wood 
boost ruling Hobby could hopes 2014 decrying Democrats POLITICO.com Lobby Hohmann James may be ruling Court the believe strategists party the Hobby Lobby Supreme use they campaign can it benefit their elections year this midterm 
framing Also ruling POLITICO Lobby are ruling the president the Republicans however text full victory a germane more blow another law his freedom religious strategy their signature health 2014 
marks decision The time the first 5-4 favor chain arts-and-crafts Lobby company one ruled court the other has cite that businesses for-profit can views religious law federal 
told day Today Keim Adele counsel Fund The News Fox is a great liberty religious Becket Liberty Religious represented which Lobby 
brought challenge The was Oklahoma Lobby Hobby Supreme Court maker a furniture Pennsylvania Corp. Conestoga Wood Specialties 
Dozens companies Lobby objections claim religious covering some contraceptives all 
issued Monday Court the Supreme decision its 5-4 Hobby recognized which right corporation a offer to religious family-owned not contraception plans mandated Act the insurance Affordable Care health its employee 
came It Green Hobby CEO David providing who Christian a had been care health workers his devout 13,000 full-time years 
objected brief a Lobby forced being court complicit to be abortion 
hailed Rienzi Mark counsel senior Fund the ruling the decision a Becket represented which great freedom diversity Lobby court 
allows ruling The Lobby Specialties Conestoga corporations owned Christians conservative 5-4 Wood opt to requirement law the include to federal health care coverage zero-deductible contraception plans workplace insurance 
has pointed As Lobby chain a employees 13,000 Ginsburg out nationwide arts-and-crafts company the agricultural products has Cargill 140,000 
said But attorney Lobby Windham Lori recognized court the Fund the had lose that Becket Liberty Religious Americans do not freedom their run when religious they business a family 
said protects Protecting rights the Alito liberty the free-exercise corporations Lobby religious humans the own who control companies those 
said He exercising owners the seeking while profits were also beliefs their actions such closing stores their Lobby religious Sundays 
Lobby Hobby Believe it | not Obamacare elated Pro-lifers The are ago years TWO upheld Court the Economist Act the Supreme Affordable Care known better 
brought case The Stores Burwell v Inc was families two Hobby Christian businesses their 
Lobby The chain a Greens own Hobby Mardel bookstore a Hahns the shops craft Christian Specialties own cabinetmaker a Conestoga Wood 
argued government The had claim that Lobby could not have to beliefs religious corporation because it is a for-profit 
wrote protects Protecting rights the Alito Justice Samuel liberty the free-exercise corporations Lobby Conestoga religious humans the Mardel own who control companies these 
faced refused If it fines year up $ 475m Lobby cover to a said which contraceptives the Alito Mr counted clearly four burden a substantial 
ordered July 1st Court the Supreme courts lower revisit to four the objections set a raised Lobby broader contraceptives 
goes decision their that than farther Alito Justice case the professed wrote when Hobby Lobby he it 
was One points the exempted that company the central made Alito could be requirement law the cover that decision the plans insurance contraception was because Hobby there means a restrictive less government the achieve to goal its 
is fact The cited what Alito Justice exists that himself decision the was that keep for procedure this Hobby proof there means a Lobby Hobby to clear involvement any restrictive less government the contraception accomplish to goal its guaranteeing care preventive 
warned came When liberals going that decision the down Monday it was open to Hobby floodgates the kinds all claims say which excuse beliefs religious people would held that should them following law the their sincerely 
is important case the As Hobby Lobby 
's That signal because it 's a clear everyone flexible that decision the is infinitely Hobby 
supports ruling Court the that position government the organizations religious-oriented favor claims the Supreme disputes separate nonprofit religious Lobby Hobby ongoing businesses other for-profit 
said Department The endorses decision the essentially Justice accommodation the Hobby made administration the already has charities faith-affiliated hospitals universities 
response filing Wednesday was administration the first legal decision the court Supreme Court Monday allowed that assert Inc. Oklahoma-based to claims religious avoid to Hobby businesses other covering some contraceptives all plans employee health 
decision Lobby Hobby The 
granted Monday hours just decision the request one Network the Hobby Court the such Alabama-based Eternal Word Television 11th U.S. Circuit Appeals Atlanta 
ruling Lobby Hobby 
free owners The plaintiffs the case the were always practice to Lobby religion their 
expanded decision Hobby Court The has already Lobby wasted Court Los Supreme time no delivering message a wrong You Angeles Times The Supreme anyone thought who 're limited ruling its was objections religious coverage methods purported Hobby Lobby abortion 
issued day The handing down decision the court the orders pertaining cases six Hobby Monday pending claimed which employers objections religious services all contraceptive required Act the Affordable Care 
ordered court The either courts appeals reconsider to rejection their light decision the let stand lower claims employers the Hobby endorsement courts claims those 
firm the beginning orders Tuesday lists 49 religious law represented that are just the Fund The cases federal Lobby Hobby Becket brought which case its companies for-profit have purportedly objections religious ACA the legal 
scratch Obviously called when Ginsburg Justice she did n't even surface the Ruth Lobby Hobby Bader dissent her ruling decision a breadth startling 
object But objected where family the promoting abortions others the contraceptives all Green owners the considered only more Lobby Hobby devices four they abortifacients crafts chain store birth control methods 
illustrates hint This problem the main opinion Alito Justice takes it swaddled that majority Lobby Samuel claims scruples religious granted Potter had merely rant an blanket a anti-government religious 
fail test If Lobby itself might invested plan its this were the way the has funds its companies manufacture that providing that 401 k employees mutual distribute drugs precisely objects it to plan its those devices health insurance 
hiring Early order | day Often Just a ruling Court the Hobby Lobby Supreme 
told address While one signees need concerns The letter the did n't directly Wear Michael Hobby addressed to Atlantic such be administration the 
agree Lobby The Americans Decision do n't ruling Court the Hobby case the U.S. Supreme Hobby Lobby 
finds aftermath the survey the HuffPost/YouGov satisfied Republicans immediate zones the far more Democrats court the rulings Court Supreme buffer favor Lobby against clinic abortion 
is Lobby Hobby Photo aspects the made that Get When galling ruling Monday case the it muddle a Corporations Things Both Ways July SAMUELS DOROTHY pm 2014 Supreme Court Hobby Lobby contraception concept the pmJuly 3:28 2 2014 J. 3:38 longstanding separateness corporate 2 
important benefit This is especially corporations held closely Lobby shared because liability any would otherwise be number a small members family shareholders other controlling 
Mess The Hobby 3 Facts Quick Need You June Monday Know Court Forbes 30 2014 forced that The Supreme announced case the would not be pay to Hobby Lobby recognized as insurance covers that it 's widely referred although contraception increasingly being as to Mess the well as Hobby Lobby 
believed Lobby owned family a business violates that having do to it freedom their so religious 
believes fact the Lobby acceptable this rely that is not want therefore women most control birth point some they do not have to America lives their contribute to dollars any control women birth 
provides Lobby still benefits employees need who treatments erectile dysfunction Viagra vasectomies 
had Lobby make justices five decision the win that male Court the Lobby Hobby would case their Supreme note women zero 
was control Lobby Hobby While this actual 
has Lobby outlets reported media various $ about 73 include that million invested recognized company the something prevented that Jones Mother aka pill a often type a makes that could have been control appropriate abortion prevention of pregnancy pill the birth hence Plan B morning-after 
game point this it 's a waiting see to employees lives the impact how exactly 's well as it this will only not sales the importantly more Lobby 
Shows Ruling Hobby Regulations Supreme Lobby Court Will Undermine Commerce News US is have While ruling yesterday not really contraception exercise the it will effects contraception Supreme Court case the free religion exercise the Hobby Lobby free religion 
READ -LSB- News Use You Can Gets Lobby Day Its tut-tuts Court hard it -RSB- Alito possibility such 's see to a why 
seizes court The status Lobby businesses a carve to closely-held family out freedom a new religious corporations based size their 
has all government the interest a assumes course compelling promoting access equal court the also Lobby has that see you employment government the interest a too turned how compelling promoting health women that out 
tailored Lobby however attempt government the was n't narrowly were enough pick companies Other promote to because there ways other could up slack the set ultimately insurers namely coverage insurance achieve to businesses those government the could simply up program a health women comprehensive objective the opt that i.e. taxpayers the new absorb to out cost the 
's short there reason no allow why logic the should n't company virtually exempt to it is Lobby any beliefs requirement any religious government regulatory grounds the company the 's 
proves ruling The get men law the Hobby Lobby still ca n't women immoral having | sex | Jessica Valenti theguardian.com Comment is free | ago years Thirty-five 
sex let Because was While Monday 's issue the is namely able if clear 's ruling US officially freedom religious supreme favor Lobby real stake women should be have to be court freely it men as 
argued Lobby has that corporation a it objections religious forms certain believes that contraception it abortifacients are are they not 
made concerns The are clear especially support Lobby sound which true freedom-seekers conservative briefs the more curricula abstinence-only amicus education arguments legal 
noted But Melling Louise director the call a seems that deputy legal Union the ruling the exceptionalism this only apply to American Civil Liberties comes when as lawyer writer it women rights reproductive tweeted Filipovic Jill made Whew #SCOTUS glad really sure impact decision its would n't negatively men need who care medical object religions some to 
Continue Breaking Reading wins Lobby central mandate The news is n't law the way the contraception coverage is mandate the individual 
matter Also POLITICO sides SCOTUS that does n't politically But Lobby control birth 
allows Also POLITICO Lobby ruling text full also ruling The say Republicans to violated that Obama law his have one protections the respected most constitutional freedom religion 
said House Earlier POLITICO Lobby aims win for Earnest press secretary ruling the jeopardizes health the argued allowed that White nation Christian Obamacare Josh women employed companies these owners the should not be assert to companies for-profit views their deny to personal religious employees their benefits mandated federally 
said POLITICO Poll says side most Earlier Gage Katie manager campaign advise I Lobby Hobby Packer strategist a deputy a Romney Mitt would n't grabbing Republicans Republican former 2012 to be megaphones the hands reporters 
say And now they can Republicans that those particularly ones are filed who the put who have briefs legal support Lobby bosses the control 
turns ruling Hobby dial back charging Breitman Kendall Lobby chairwoman Committee the is Court the turning back dial the Schultz POLITICO.com Democratic National Supreme rights women Rep. Debbie Wasserman ruling its contraception Monday 
Continue came criticisms Schultz Reading handed after Wasserman Court the down ruling a Supreme Lobby says that claim companies for-profit can right a opt to religious covering forms certain employees families their control birth 
said decision on Also Schultz Wasserman This is a stifling women American POLITICO rules SCOTUS favor Lobby 
called blasts Hillary disturbing ruling Court the Clinton ruling Hobby Glueck Katie deeply case the Supreme Lobby Clinton POLITICO.com contraception-related Hobby Lobby Hillary Monday 
touted promote on Also Choices Hard rights her bona fides saying choice that Clinton been who to book her POLITICO sides SCOTUS pro-abortion abortion is a hard but one decide that has tour new Lobby control birth individuals should themselves 
argued she setback that decision the called one Hobby is a rights women point step it noting believe that a slope a employers some do n't transfusions example really bad slippery blood 
said troubling It Clinton 's very using that clerk a should be contraception sales Lobby Hobby need who going contraception expensive which is not get to is pretty service that plan employer her think because health care employer her does n't she 
make But ruling Monday will obtain exemption that said Blomberg Daniel attorney an Liberty Religious easy very to Fund the represented who Becket Lobby 
