11,said pollster Democratic reinforce It Greenberg Anna 'll perceptions overall hostile women right the 
11,said Lake Democratic has issue the pollster Celinda potential the drive to turnout women unmarried young 
12,charging chairwoman Committee the Breitman Kendall is Court the turning back dial the Democratic National Schultz POLITICO.com Supreme rights women Rep. Debbie Wasserman ruling its contraception Monday 
13,skewered secretary The decision the appearance an hours ruled after former state front-runner possible Ideas the Festival Colorado Court the have that Democratic Aspen Supreme employers for-profit do n't provide to coverage contraception mandated Obamacare have if they objections religious 
13,signed pitch a He also off fundraising Davis Wendy candidate the Democratic gubernatorial Texas made who name a herself filibuster a year last derailed which national Legislature the she temporarily measure a state restrictive abortion 
15,said director the Continue disappointment decision Monday Reading put it Canter Matt Democratic Senatorial Campaign Committee deputy executive is a Democrats does spotlight a big welcome support Republicans -LSB- initiatives -RSB- measures other personhood go that would further much decision today outlaw to forms common control birth 
15,said strategist a women Also POLITICO W.H. slams ruling SCOTUS Senate Democratic voters The are Republican-leaning moderate areas suburban states those decide that will election the 
15,went Udall Democratic month Earlier air the Sen. Mark this ads two one suggesting take that second the challenger his Gardner Cory would away contraception talking up Republican right woman a choose to more generally 
15,muted committees The were threats Obama President speech a Democratic political spent that latest action imperial tried that morning the arguing winner that divert to decision Court the was a political attention failure the Supreme latest Obamacare 
15,oust Hagan Democratic to Sen. Kay 
16,blasted leaders Democratic decision court the Monday Reid Senate time It Majority Leader Harry tweeting 's stop that men five deciding happens what Court the women Supreme 
