0,Believe Obamacare it | not elated Pro-lifers The are ago years TWO upheld Court the Economist Act the Supreme Affordable Care known better 
0,allowed mandate Obamacare Court The exception an offer that firms size a insurance their certain staff includes that contraception free 
0,requires Obamacare offer firms to workers their contraceptives all approved Administration the Food Drug 
0,includes subject being That mandate Obamacare employer 
0,enforce mandate the to offer that Obamacare employers insurance health mandate a delayed that has already been 
0,challenge mandate Obamacare future companies might cover to derived transfusions immunisations pigs done though blood medicines none has yet so 
3,refuse corporations any offer to other Obamacare service grounds religious 
9,consisted decision court the why actually majority a ruling lacked that Obamacare presented while justices government the authority regulate to being victory a federal markets insurance clause the president the commerce 
11,ignites Obamacare SCOTUS 
11,handed opponents Obamacare seemed Just Court the victory their when law the be to finish a background the Supreme biggest legal yet health care place a big season the better enrollment embarrassments the early fading 
11,is Obamacare Anytime news the 
11,win Obamacare for 
13,mandated Obamacare 
14,fight rebuke the to head birth court the Supreme Court requirement Obamacare control contraception coverage Monday even as round a second fights legal 
14,ignites Obamacare decision SCOTUS fight contraception 
15,hope setback the strategists the boost ruling the legal Obamacare will efforts Democrats keep to Senate the persuading women some defect states races competitive galvanizing women younger Republican-leaning vote who typically do n't midterms 
15,dent anything it 's another crack armor 
15,is Obamacare If discussion the 
15,narrow It is relatively deals part just victory it one small law the is opponents important most legal yet efforts their health unravel to law the 
15,ignites fight Obamacare Also POLITICO SCOTUS contraception Gardner praised court the went he needs Administration The protecting liberty religious also on argue to now move to Food Drug Amendment the quickly make to First available contraceptives oral adults prescription a 
15,divert failure the to attention latest Obamacare 
17,go Obamacare woman a could doctor a get control birth had She often pay to make co-payment a for contraception 
17,exempt Hence control birth is co-payments mandatory plans most employer-sponsored health 
17,opt Obamacare beliefs religious to 
17,exempts Obamacare also employers small mandate the contraception 
