12,Schultz Debbie Wasserman turns ruling Hobby dial back charging Breitman Kendall Lobby chairwoman Committee the is Court the turning back dial the Schultz POLITICO.com Democratic National Supreme rights women Rep. Debbie Wasserman ruling its contraception Monday 
12,came criticisms Schultz Reading handed after Wasserman Court the down ruling a Supreme Lobby Burwell Hobby says that claim companies for-profit can right a opt to religious covering forms certain employees families their control birth 
12,claims Schultz Wasserman cast Although far-reaching that decision the has been narrow applies as implications the could be it only companies held closely contraception 
12,said Schultz Wasserman decision on Also This is a stifling women American POLITICO rules SCOTUS favor Lobby Hobby 
12,expressed Schultz Wasserman also concerns implications later pointing out impacted saying day the law the use that is dramatically decision this day women life function women treat control birth to illnesses endometriosis cramping serious menstrual 
12,said Schultz Wasserman affect ruling the will chances Republicans gaining votes women 
12,said Schultz Wasserman clear It 's very women American want yet again Republicans that do to everything can they have to reach hand the make decisions health body woman a long government and now hand the her care long business 
