1,changed Damerla Dipika act the can be regulation treat to said approves if them products stop-smoking terms sold where Canada them aids cessation displayed they can be 
5,changed Damerla Dipika act the can be regulation treat to says gives if them products stop-smoking terms sold where Canada stamp its aids cessation displayed they can be approval them 
5,respond Canada must report the July 8 
6,Canada Toronto _ ON see Radio Talk will cigarettes electronic May AM640 pm 11:25 treated manner the 26 2015 law A same cigarettes traditional new Ontario 
6,changed However gives should Canada law the could be it stamp approval option a stop smoking 
7,puts Canada It really Ontario forefront the especially say I counts many so would America North 
7,_re We jurisdictions the first ban to America North cigarettes menthol jurisdiction definitely have to the first Canada now counts calorie restaurants Ontario chain 
