2,beginning approach The could be the another reshaping industry the bold prompting spate a media new mega-mergers giants entertainment 
3,says eyeing Disney Wible could be Communications Discovery expansion its America 
4,is That just 
8,holds N.B.A. the Warner Time home TBS the also rights sports Baseball Major property a basketball college networks TNT League Championship the P.G.A. P.G.A. 
8,amassed years the Fox has footprint a buying rights sizable sports football baseball Nascar 2018 the Cup men 2022 World 
8,profited Internationally businesses his have long roster a channels international sports-rich America 
