0,presided years the Bewkes has Warner Time company a last six genteel media known assets its sterling 
1,rejected Warner Time owner assets many has proposal Fox highly-prized initial cash-and-stock dol 85 share 
2,includes Game HBO Thrones stable whose channel 
2,HBO Game Clarke Thrones News Fox FX TNT channel the studios movie colossus Warner Fox Time Emilia Together TBS premium subscription Fox Twentieth would become a array an Fox Century Brothers Warner outlets other networks television high-profile channels 
2,about is start to filming season five Ireland Northern Game the hit fantasy series Thrones 
2,programme Game Thrones has become the watched most history the outdoing even Sopranos The popularity 
2,spoke She meeting a Loewe executives Angeles Los month last Jay Graham-Borba Janet 
3,speak Kitteridge the unleash offer Murdoch Cholodenko Director onstage Olive HBO 2014 could wave mergers media left Lisa McDormand Executive Jenkins actor Anderson Writer/Executive TCA Summer July 10 producer/actress Frances Richard producer Jane Thursday 2014 XMIT Beverly Hills CAPS127 Photo Shotwell/Invision/AP Richard ORG Calif. Photo Shotwell/Invision/AP Richard done divorce Murdoch Rupert Shotwell Richard apparently have little chasten to age acrimonious recent scandal hacking ego his business 
3,understands Netflix this chose emulate to producing content original 
3,is appetite Murdoch has it contracts extensive heart the bucket Warner Time NBA the NCAA bid his rich programming sports MLB unsolicited 
7,got Fox finally answer its July 8 came reply a back Bewkes Murdoch saying had Warner Time two-sentence owner the interest no proposal the 
7,CHANGING grab Murdoch LANDSCAPE reflects recognition the media diversified companies producers films shows TV bold competitor a growing need that owners channels cable they bulk combine up News Fox as distributors their providers the also TNT main largest US pay-TV 
7,questioned Bewkes COMPANY also run who LEADERSHIP started who would company the 2015 to person one unit company the 1979 CEO became Warner Time 2008 
8,create deal Such would behemoth a a likely which industries the bringing together Murdoch Mr. is continue to television film network the channel Warner Time Bros. Warner pursue to Fox Broadcasting premium cable studios the Fox 20th movie Century 
9,bring shows HBO 's would Game Thrones 
9,create bid The Fox Century would company world the bring Game 21st biggest media Thrones Movie The into fold Murdoch Lego 
9,confirmed Warner Offer owner the week this received that Confirmation Time it offer a Fox dd more than US75 billion dd billion 80 
10,bring entity The would HBO roof the studios Fox combined same movie channels sports 
11,include holdings Warner Time HBO channel maker Blood True Batman Hangover The Game Thrones CNN news owner Potter Harry broadcaster Bros Warner 
12,include holdings company The channel the cable New York movie studios Bros produced which movies the Harry Potter 
13,control Together behemoths the two would portfolio a media huge assets Bros Warner producers Potter the 21st X-Men Fox Century channels Warner Time Harry movies Batman Avatar lucrative cable 
14,network focus Another is player a the big play Murdoch leading space the burgeoning online content streaming rival Netflix fast-growing 
14,built has itself brand a worldwide back the series hit Game Thrones Sopranos The Sex City the 
14,reported Bloomberg has source a saying values company the Fox 
14,believed It 's sees Fox having get potential the to foothold a space the most company the digital mobile eating that is up profits traditional network advertising 
14,scored week last nominations 99 Emmy came 19 which Game Thrones alone 
16,colossus Together Fox 21st Century would be a array an Warner Time networks such channels Fox News Fox television channel the studios movie outlets other FX TNT TBS premium subscription Fox 20th prominent Century Bros. Warner 
16,WARNER TIME TV networks Network Cartoon Bros. Warner CNN TBS Studios TNT 
