4,penalising Obama US was businesses cracking down countries regimes lighter President Barack so-called profit shifting technique a tax corporations major is that also sights the G20 the 
4,proposed Obama Mr year earlier this restrictions tightening multinationals shift that domiciles their abroad budget his tax 2015 
6,shared investors have never love Rupert newspapers contributed which ink little red line the bottom empire his old 
7,CHANGING grab Murdoch LANDSCAPE reflects recognition the media diversified companies producers films shows TV bold competitor a growing need that owners channels cable they bulk combine up News Fox as distributors their providers the also TNT HBO main largest pay-TV 
7,mounted Fox bid its acquiring as seeks Corp. Comcast AT&T is DirecTV provider the complete to largest satellite-TV deal a joining No. the Cable Time 1 services No. 2 Warner cable TV 
9,confirmed Warner Offer owner the HBO week this received that Confirmation Time it offer a Fox dd more than billion dd billion 80 
9,sparked acquisition The rally a stocks media potential representing dd billion US90 bet as value shareholder investors presage it may more consolidation 
9,announced ago years A Google spend it few would dd million support to programming video YouTube 
9,said Producers Exclusive Doshi CRT takeover A company a make Gate billion .4 dd could sense Lions Amazon either Google 
9,consider Amazon could buying maker a large as video-game maybe even company a Arts Electronic valued which is dd billion .6 drive to to Doshi people more gaming system its Fire TV 
9,said step Ubisoft value a Williams Edward BMO may be a logical more first content video-game pursue should market of about dd billion Amazon it path that 
10,undeterred digs Fox Fox Century will remain pursuit its in Business Time Warner media Warner bar Business News bar Murdoch Finance conglomerate Time rejected bid its News bar bar Herald Sun Rupert 21st was mammoth dol billion US80 dol A85bn unsolicited company the 
10,standing Murdoch Mr is firm recall as observers experienced that mogul the offer rejection surprise his Jones Dow succeeded eventually media dol 2007 
10,claimed News Bloomberg has willing Murdoch Mr is go to price the dol batted that Warner Time away 
10,surged Shares Warner Time 17 cent dol .13 yesterday declined while Fox 6.2 cent dol US33 
10,transform were If dominated register its is deal the would industry the creating behemoth a Murdoch Mr succeed to investors institutional share media company dol revenue revenue world the gain to media the control Warner Time largest 
10,announced Comcast recently deal a buy to dol Cable Time company an Warner Time Warner separate entirely 
10,proposed later Months AT&T buy to DirecTV bn dol .5 
10,announced half the overall reached s M&A first calendar 2014 bn dol .5 period double year last to data Thomson involving companies Australian the same Reuters 
11,offer cash An Murdoch 's 21st spurned Fox Century believe experts some initial dol billion shares was afford he dol A86 could this up billion .6 dol more than US94 billion dol A101 billion .7 
11,valued offer The reportedly it dol share said DiClemente Nomura initial Warner Time 21st afford Fox Century analyst Anthony could borrow to money more fund to deal a dol more see still than US100 add transaction the profits year 
13,come merger A would tries as exert Murdoch Comcast firm US push to worrying power the firms cable will soon market the largest cable takeover a media Cable Time player the Warner second largest has that groups consumer 
13,annoyed structure That has investors some two-tiered extent the powerful System Employees the CALPERS largest the control Murdoch Retirement California Public fund public pension 
14,one Comics DC is just stable a brands established umbrella the Time Warner eyeing which Murdoch is off part offer an 21st Fox Century dol billion takeover 
14,built He has empire his buying up rights the sport televised world the League the US AFL the English Premier NFL baseball NRL Australia 
14,offers Advertisement market the crowded Warner Time System subsiduary Murdoch chance a sports Turner Broadcasting real give to Sports Fox up leg a ESPN its rival 
