0,contenders side men the it was all nonbroadcast McConaughey Matthew winner year last Daniels Jeff Spacey Kevin nomination one Harrelson Woody Detective True HBO 's House Cards more Hamm Jon Cranston Bryan Newsroom Men Mad for Breaking Bad won who surprisingly has never award this 
1,Nominated Actor Outstanding Daniels a Drama McAvoy Will Lead Series Jeff series the news drama Newsroom 
1,Photo AP Newsroom is deconstruction Sorkin Aaron The brutal media the modern television 
2,vie McConaughey True both will best honours drama Harrelson Detective Cranston four-time Breaking Bad Hamm Jon Spacey Kevin Daniels Jeff actor co-star winner Bryan Men Mad House Cards Newsroom won who Emmy the year last 
3,vie McConaughey Harrelson both will best honours drama Cranston four-time Hamm Jon Spacey Kevin Daniels Jeff actor winner Men Mad House Cards Newsroom 
5,Photo Supplied cut Okay Homeland so probably do n't it pushing Emmy Newsroom baby you ca n't seriously be Dead Donovan Ray aside Abbey Downton The Walking 
