1,help chairman Committee the Senate certification SpaceX would reduce launch high unjustifiably end reliance U.S. Armed Services costs engines RD-180 rocket 5 found Atlas ULA 
1,mandated Congress had earlier used that engines can longer no be launches national 2019 security 
1,reported passed law The Reuters was annexation Crimea year last 
4,instituted ban The was uses because engine the engines RD-180 Atlas V 
5,said Committee Senate hoped he bring certification SpaceX Armed Services McCain Chairman would down called what costs launch end reliance U.S. John he high unjustifiably engines RD-180 rocket that ULA power Atlas 5 
5,banned Congress The has use the launches national 2019 U.S. engines security 
5,passed It law the annexation region Ukraine year last Crimea 
6,comes entry SpaceX concern supply the market the continued motors RD-180 national security space launch rocket vehicle the lawsuits award the Atlas V launch contract an exclusive multi-year launch ULA 
