0,Wise Mike years Four Decision James Post The over here Washington are There we are all again people lined up house James LeBron Akron moment this presumably some fans the very approved who same jilted jersey his Cavaliers burned being ago years four effigy 
0,said percent is he 99 returning Cleveland 
0,pattern trepidation His is a LeBron shown circle his only have instances prior inner 
0,has But then everyone guy a now right telling them Akron Miami want what they hear to build to case their heading where is 
0,leaves tea The pointing are Cleveland is because thought the get if Riley Heat could n't commitment a re-sign to president Pat Heat the going after meeting him is never close to Vegas Las Riles deal the Wednesday 
0,letting people LeBron are everyone know 
0,going pull If he is morph to scorned the Riley does n't out miracle some Gilbert Cavaliers around one thought who ended up owner Dan time this provided he left getting give team the altar the anyway to opportunity every environment the needed he realize to dreams his professional 
0,stop point some employers should taking realize this personally just dealing they are broker a more player a power making who is constantly play a option his best possible going forward 
0,be It also may said why is close to be moving on 
0,is course waits longer the more the league the hold decision Bosh down way all Timberwolves the had who entire free agent maneuverings Houston the Minnesota have inquiries multiple Love Kevin want who does n't be to there 
0,gamble sense strict this is a huge basketball 
0,play He would coach an rely manager a unproven rookie hired newly bolster to green very general Blatt David Cleveland sell which is a better much free-agent locale still not a no-brainer York Miami L.A. New 
0,looks goes longer The worse the it player a LeBron-a-thon owes who tells anything no other call a before he nation the team town phone leaving he is home his current 
1,apocalypse website James is the HTML 
1,insisted couple the Sheridan NBA reporter has things two sign James last days Chris will Cavaliers the make he Cleveland will announcement that website his lebronjames.com 
1,begins of Thursday afternoon experience the animation a James Internet brief settles that image the still see you top the article this 
1,rises animation that skyline a cartoon slowly heavens the followed it 's series a photos four talking swoop that LeBron cap an LeBron gear workout LeBron grinning toothily phone the in from margin the Akron baseball holding trophy a golfing right championship award a Finals MVP 
1,unclear browsing Unless it 's entirely supposed how you 're lebronjames.com monitor a you 're move to kid that tall that screen this get learning anything LeBron is just a Ohio Akron 's as James fact the 
1,is There hierarchy no chronology text no allows that distinguish you to photo a photo another LeBron 
1,Click hexagon the leave skyline this will Game Heat illustrated photo a and not you alone hell the cartoon Bounce Back | Win 2 shirtless boxing 
1,Scroll all get that garbage you 'll story a short game notes that played that mentality a break sticks stones may bones my hurt words will never me 
1,are There bunch a reasons want why James might website a serve to promote to clearinghouse a foundation his shill to sell to details authorized sponsors his gear some biographical 
1,includes section The items playoffs the titles two Athlete The NBA 2014 awards four MVP 
1,find happen If though you 'll out host that you click to Curtis is a television Detroit working who icon a left the 's do to unreadable small bottom screen the renovation a Akron West home 
1,think Nobody will less consists because are there website his series a plenty places other hexagons inscrutable read to James LeBron buy to merchandise his 
1,imagine managed Though I 'd paid that I have n't track to amount a apocalypse this down invoices any good cash HTML 
1,Sparks More tell Join site want you takes it does n't you anything know to page a do to lot one than more it 
1,post Correction * July 10 This misstated originally 2014 holding that James is trophies two championship 
2,Leaving Vegas Las LeBron flying reportedly back Miami Sports Dwyane Wade | FOX JUL MSN 12:53 2014 Updated 11 left James a camp his Vegas Las sights his ET LeBron Nike-sponsored basketball 
3,giving James LeBron is Amick the Sports USA offseason this NBA world anxiety issues Sam Zillgitt Jeff agent James LeBron TODAY EDT 12:38 July 11 is the valued most free a.m. 2014 
3,agent Photo Howard days Eleven is still a free Smith Sports USA in James TODAY 
3,TWITTER Following follows 8-BALL MAGIC pick Will LeBron Cavs 
3,overloaded reported When website James was so traffic crashed that Ohio Fox stationed that it minutes 30 about Sports officers police home James outside Akron Ohio told were expect to announcement a 3:30 p.m. ET 
4,stop LeBron Brazil-bound Miami boarded James LeBron flight a Vegas Las Thursday night spending Academy most week the Miami to sources situation the Skills his LeBron James 
4,covers Windhorst Mike Mike affects how choice James ESPN NBA Insider Brian impending Rockets the team whether Anthony James Carmelo could up future Wade Miami Dwyane 
5,rename LeBron park Amusement to coaster returns if he EDT Cleveland July 10 AP 8:15 a.m. 2014 
5,promising Photo Donnan Bob is rename to SANDUSKY USA Ohio park Ohio one coasters its returns if TODAY Sports has James NBA Cedar Point amusement roller James King he home play to offer one superstar Cavaliers the more consider to Cleveland deciding play where to season next 
6,extended contract the Cavaliers Businessweek Irving point The Cleveland guard Kyrie room freed salary cap signing a possible four-time Most Player Valuable James Ohio native LeBron 
7,heads James LeBron back Miami plane Wade Dwyane turning because NJ.com report tide the may be | want outside Those might head to waiting house LeBron back home James 
7,told expected Wade Dwyane sources league Yahoo be to flight a back Miami James tonight 
7,worth D-Wade is here now camp Academy thats Skills whatever 
8,stop LeBron Brazil-bound Miami boarded James LeBron flight a Vegas Las Thursday night spending Academy most week the Miami to sources situation the Skills his LeBron James 
8,covers Windhorst Mike Mike affects how choice James ESPN NBA Insider Brian impending Rockets the team whether Anthony James Carmelo could up future Wade Miami Dwyane 
9,decides LeBron As 
9,is ball The now hands James 
