0,proposed filing a Department State posting bundles online days every starting on June 30 court time her secretary state large emails Clinton Hillary 60 
0,wrote strive department The lawyers Justice will produce to file will documents many report a week one posted after date possible production each status production each inform to court the number the pages 
0,all agents FBI are scene the said statement a officials Homeland officers Los FBI the taken that Security Angeles Police threats all credibility known are seriously 
1,urged Hincapié Marielena director executive Center the continue Department Justice National Immigration Law to efforts its get to injunction this lifted bringing matter the Court the delay Supreme 
2,said administration Obama has is it rights its ask to Department Security Homeland use to discretion deporting migrants nonviolent ties U.S. family 
2,said evaluating Department U.S. official a U.S. was ruling the considering steps next Justice 
