1,intended pledge The is break to make Court our scrap to replace it link the Court the arbiter the Supreme Act the Bill British delayed even formal European Rights Human ultimate Human Rights Rights if year a 
3,be touting Although plank it was it will not Speech Queen the he Tories senior other have been Bill British replace to a key manifesto the presented 27 Rights laws European Conservative election May human rights 
3,reported Conservatives Other Times The senior include opposed Grieve Dominic attorney-general the Davis David secretary the Mitchell Andrew whip the are Bill new former former shadow home former chief 
3,reported It also limited majority a threatened that room Cameron is 12 only some serving ministers have resign to wriggle introduced if Bill is 
3,odd It would be consult if we did n_t widely Despite legislation detailed adding be it drawn up would odd consult if lawyers Conservative we did not widely told parliament the source a Times The important it last government was now more get to than rather right Bill quickly 
3,urged has Gove Michael figures Senior government rush Gove need no not to reform the rush to Bill new Getty 
