0,set referendum a Elizabeth Queen will out plans government the faces as wants changes what European Union membership Wednesday British Cameron prime pressure explain to he before then EU the minister David held when it will be 
0,Wed Photograph First Jason May 27 2015 Alden_Bloomberg published 07:48 set Elizabeth Queen will out plans government the referendum a faces as wants changes what British Union membership Wednesday Cameron prime pressure explain to he before then EU the minister David held when it will be 
0,reform measures other expected feature was a laws human reported newspapers several rights designed weaken to hours speech the delayed that influence the bill the had now been Court the Rights Human 
0,introduced gesture a law the will be parliament later day just meant underscore to on Thursday embarks as a seriousness Cameron Mr he tour a try to charm counterparts reluctant sometimes backing reform EU 
1,rode exited end the scrapped Act the I welcomed motorbike a Britain Cameron David may have EU the Photo Images RICHARD parliament this Human Rights silent Labour yet newly Union the countries the POHLE_AFP_Getty summer ago years Ten is utterly eight this 
1,soured on decade A dream the has fast so for some stands that at least Britain road the exit marked EU 
1,one referendum an relationship our will be issues the In_Out enshrined week this defining Parliament this century this _s Speech Queen 
1,intended pledge The is break to make Court our scrap to replace it link the Court the arbiter the Supreme Act the Bill a delayed even formal Rights Human ultimate Human Rights British Rights if year a 
1,view independent Though Tories many it mechanism a court the is EU the meddling justice British Strasbourg 
1,possible It is gone that end the Britain will not only be EU the renounced will Parliament this also have Convention the Rights Human code a designed bind to universal decency nations shattered War the together Second World 
1,believed Long election the convinced she had Reeves Labour ministers meant that Rachel tail the had that long pay low coupled benefits generous relatively Britain grounds restrict to Britain unemployment both benefits in-work incomers 
1,vital Eurosceptics Tory it is Labour make to likely reject to case a deal any leaders EU bold short capitulation total 
1,Labour Nor is force the fiercely was it once 
1,boiled dumped Europhiles its demobbed Blair Tony arguments the have down pitch a have to abroad case the Alexander Douglas ardent most favour tepid pro-business plus argument an vote a Miliband David 16 17-year-olds referendum 
1,won argue Unless battle then the will never be opposition the can convincingly contingent that peace our stability power wellbeing are staying EU the instilling citizens British pride a European 
1,laid obligation This is down not law British Rights Human turn Convention the 
1,protected treaty That has inhabitants the pioneered Churchill million 770 nations the stretch whose 47 member Council the frontiers Reykjavik Vladivostock 
1,threaten That turn would place Britain given tenet that adherence convention the is a basic membership EU human rights 
1,risks Britain cut being off only not also 
2,begun Europe plans UK the Cameron David has already offensive a expected for charm referendum an are included to in_out Union the be address the II Queen European Elizabeth parliament the British 
2,referendum measures the announced to be will be the proposed In_Out membership speech the 
2,referendum Primary those will be the promised in_out 
2,begun Cameron Prime has already offensive a battles as Minister David charm he reform EU the allow that would support him to staying the union the UK 
3,scrapping laws European BBC at least year the human rights appears Cameron Prime first government his reversed to Minister David have position his scrapping laws European human rights 
3,be touting Although plank it was it will not Speech Queen the he Tories senior other have been Bill a replace to a key manifesto the presented 27 British Rights laws human Conservative election May rights 
3,Secretary Justice Chancellor and Lord is Gove Michael scrapping Act the limiting force the charge 1998 Human Rights courts British Convention the Rights Human 
3,supported Leveson Sir convention the telling audience an Brian headed who Festival the brought that Inquiry the media the Hay it had been in part recovery Europe War the Leveson British Second World 
3,said consider I he do not crushed myself jackboot the 
4,said happy that outlined Cameron British the are not quo the plans his people status Europe negotiation 
4,reported include discussion The newspaper the German Tuesday will create plans business to rate a Handelsblatt basic tax corporation 
4,has Britain rate a low corporation tax % 20 with France Germany range rates whose opposes fiercely % 30-37 coordinate moves any to rates tax level a 
