7,lasted Teheran 4-2 innings 4 1_3 just knocked around runs eight three walks strikeout a hits 10 intentional one 
7,coasted Teheran innings the trouble little nailed Dodgers the first three him runs six inning an break to fourth the open contest the high season a them 
7,ignited Kendrick Second outburst Dodgers the fourth the lining score RBI an baseman Howie single gap the to Rollins shortstop left-center Jimmy lead a 1-0 
7,singled walk an Turner third down line the Kendrick plate advantage a intentional Gonzalez baseman Justin right-field 2-0 
7,followed Right fielder Ethier Andre double a make to two-run it 4-0 
7,doubled Ellis Catcher Ethier home run another drove before A.J. Kershaw Ellis hit a base cushion a 6-0 
7,delivered Gonzalez shot a add to two-run run his fifth the misery Braves the 10th home season this 
7,NOTES refused Mattingly Dodgers Gonzalez Braves address to manager Don skipper Fredi reports numerous trade a pending multi-player Uribe Los Callaspo Atlanta Angeles 3B Juan INF Alberto 
7,spiked Callaspo scratch who reportedly deal the was a late Tuesday game the second row a 
7,said business It know guys these Mattingly is a it 
7,said Meanwhile Gonzalez spoke he Callaspo earlier day the 
7,said good fine Albert Gonzalez he _s 
7,good I _m him 
7,start Wood Braves will Greinke Dodgers Wednesday LHP Alex 2-2 ERA 3.83 RHP Zack 5-1 ERA 1.48 finale the series 
7,quotes Trending NYSE Reuters AMEX delayed minutes 20 at least 
7,delayed Nasdaq minutes 15 at least 
