0,baseman Join Conversation Nation the was a slick-fielding third burned who thing The find To ago years two them run a game the only positive got Braves the out more Facebook commenting please read Guidelines the late-inning home final Series the thrashing night Tuesday Dodgers the Atlanta ANGELES TWEET AP FAQs lose Braves EDT 2:47 Conversation NL Division 8-0 Los Angeles LINKEDIN COMMENTEMAILMORE LOS 8-0 AP Kershaw a.m. May 27 Photo Press The Dodgers 2015 Associated 
1,Posted May Tuesday 26 2015 11:54 ANGELES PM AP Kershaw Clayton LOS combined relievers two five-hitter a 
2,baseman J. bar The JOE RESNICK thing only was a slick-fielding third burned who Mark Photo Terrill Associated Press LOS positive got Braves the ago years two them run a game the AP thrashing night Tuesday Dodgers the Atlanta late-inning home final Series the 8-0 Los Angeles NL Division 
3,saying By Bourbon Steve everyone _s there MLB.com _ something wrong Kershaw Clayton bar COMMENTS 0 ANGELES LOS 
6,tie game the to reversed Once one in bottom the By Bowman Mark Callaspo Alberto decision his agreeing traded to 3rd the MLB.com _ be Dodgers the bar bar @mlbbowman COMMENTS 0 ANGELES LOS 
7,Braves ANGELES 0 Dodgers 8 homered Gonzalez First topped RBIs 1,000 fanned Kershaw ace LOS sparking Dodgers the fans 40,667 baseman Adrian career 10 Clayton rout an Los Angeles Stadium Dodger 8-0 Braves the Tuesday night Atlanta 
0,baseman Join Conversation Nation the was a slick-fielding third burned who thing The find To ago years two them run a game the only positive got Braves the out more Facebook commenting please read Guidelines the late-inning home final Series the thrashing night Tuesday Dodgers the Atlanta ANGELES CONNECT AP FAQs lose Braves EDT 2:47 Conversation NL Division 8-0 Los TWEET LINKEDIN COMMENTEMAILMORE LOS 8-0 AP Kershaw a.m. May 27 Photo Press The Dodgers 2015 Associated 
0,nixed Callaspo played who originally deal the Angels the 2010-13 Los 
1,beat Dodgers the 8-0 Braves the night Los Angeles Tuesday Atlanta 
2,starting inning the pitcher throws Teheran Julio Angeles Los second game a plate the baseball Dodgers the May Tuesday Los Angeles 26 2015 
2,baseman J. bar The JOE RESNICK thing only was a slick-fielding third burned who Mark Photo Terrill Associated Press LOS ANGELES positive got Braves the ago years two them run a game the AP thrashing night Tuesday Dodgers the Atlanta late-inning home final Series the 8-0 Los NL Division 
2,nixed Callaspo played who originally deal the Angels the 2010-13 Los 
2,wait Dodgers Los discuss while umpires the starting Kershaw pitcher call a inning the Ellis catcher Clayton right fourth game Dodgers the A.J. baseball Braves the May Tuesday Angeles Los Atlanta 26 2015 
2,acknowledges Gonzalez Dodgers bar fans hitting run a Adrian Mark J. Terrill AP Photo Los inning the Angeles Los two-run home fifth game a baseball Braves the May Tuesday Atlanta 26 2015 
2,throws starting J. bar Kershaw Clayton batter an inning the pitcher Mark Dodgers Terrill Atlanta Braves second game a May Tuesday AP Photo Los baseball Angeles Los 26 2015 
4,pulled Callaspo hittingÂ who was game night Tuesday Angeles is .206 .293 _ .252 games 38 _ season this 
5,beat Dodgers the combined Kershaw capped inning a Braves the 8-0 Los Angeles relievers two notched Gonzalez Adrian RBI an six-run fourth Atlanta five-hitter a 1,000 his single RBI th homer a two-run 
6,completed coveted Braves The he Angeles seasons the have pitchers power Withrow posted who 2013 _14 totaled strikeouts 71 ERA 2.73 a innings the 56 
7,sparking Dodgers the rout an Los Angeles 8-0 Braves the Atlanta 
7,NOTES refused Mattingly Dodgers Gonzalez Braves address to manager Don skipper Fredi reports numerous trade a pending multi-player Uribe Los Callaspo Atlanta 3B Juan INF Alberto 
