3,subject story This was not approval the Baseball Major clubs its 
6,receive provides If Braves the will Withrow right-handed Uribe veteran exchange Callaspo Stults Eric Thomas Ian Jaime Juan Baseball Major approval reviewing trade the reliever Chris third baseman Juan morning Wednesday 
6,confirmed But source a Major components the proposed 
6,recognize Braves Many him man the fans hit who run home the off Carpenter former decisive Atlanta reliever David Series the 2013 National Division 
6,produced reliever The has ERA a left-handed signed who 3.94 appearances 21 was league an Major independent 2012 
6,subject story This was not approval the Baseball Major clubs its 
7,retired winner The MVP National hitters the reigning Cy Young first 12 faced he led before Markakis right off fifth the single a fielder Nick 
