3,saying By Bourbon Steve everyone _s there MLB.com _ something wrong Kershaw Clayton bar COMMENTS 0 ANGELES LOS 
3,reporter Bourbon Steve is an associate 
4,hits Callaspo Alberto Images Getty actually homer approvalÂ trade The MORE photos Classic is subject toÂ Manfred commissioner A-Rod thinks Harper Â Rob pops he bar out 
5,told to Callaspo Braves the willing that he was accept to trade the awaiting which is approval the Manfred Commissioner Rob 
5,read CHOOSE SPORTS FOX you agreed have Policy the Terms Use TEAM YOUR S clicking SUBSCRIBE EDITION DAILY Fox Sports Privacy * TEAM 
6,tie game the to reversed Once one in bottom the By Bowman Mark Callaspo Alberto decision his agreeing traded to 3rd the MLB.com _ be Dodgers the bar bar @mlbbowman COMMENTS 0 ANGELES LOS 
6,reporter Bowman Mark is a 
