3,wrote Bangs examiner opinion an dated Thursday made Monday public Michael clear that it was employee coach the was longer no a Penn State retirement his former assistant football 1999 
3,wrote Sandusky?s Jerry that $ 4,900-a-month reinstated pension Penn be retired because years 12 than more State he State Penn back 1999 conviction his applicable law The is which Bangs is simply not SERS members commit who Pennsylvania forfeiture really attempting what crimes begun after SERS is do to they have receiving pensions their case this 
3,said Hile Pamela spokeswoman a SERS go recommendation will board the fall mid-to-late agency determination a final 
3,reinstated accepts If pension Sandusky Penn would be Oct. 9 board the recommendation State 2012 lost when he wife his benefit the Dottie $ 4,900-a-month state 
3,said employee that provided even he was not a school though State Penn Sandusky office an retirement his telephone 
7,reported said Bangs examiner AP the clear it Michael was employee Sandusky was longer no a Penn State retirement his 1999 
7,said apply it did not people commit who crimes begun after they have receiving pensions their 
