0,found But report the 339-page played politics no Office General the role a stalling investigation the evidence Attorney 32-month coach the pervert 
0,said show facts The Kane Attorney General lack an charging stopping Kathleen inexcusable urgency predator a serial sexual 
0,ordered Bower/AP Bradley report the exposes that C Jr. Special Kane state delays inexcusable case the Deputy Attorney General H. Geoffery Moulton right Attorney General Kathleen left Sandusky 
1,move After expiring retained documents jurisdiction the Pennsylvania Historical Commission Museum 
3,ruled arbiter Pennsylvania employee Sandusky Jerry was not Penn State retirement his was It 1999 not 2004 expanded that law a was include to state offenses sexual cause Sandusky pension forfeiture 
3,Scroll down video Flush cash ruled arbitrator A has wrote that Sandusky?s Jerry $ 4,900-a-month reinstated pension Penn be retired because years 12 than more State he State Penn back 1999 conviction his applicable law The is which Bangs is simply not SERS members commit who Pennsylvania forfeiture really attempting what crimes begun after SERS is do to they have receiving pensions their case this 
3,said Sandusky Guilty walks wife his Sandusky Dottie Courthouse June 22 lawyer Sandusky Benjamin Chuck Monday pleased he Former Penn State assistant football coach Jerry County the 2012 Bellefonte was ruling the Centre accepted which argument Benjamin incorrect that report a was claimed when Freeh former it received Sandusky FBI director Louis payments 71 State Penn post-retirement 
3,testified Sandusky January issue the link video prison a pension state Pennsylvania 
3,released development a general attorney review a found evidence no separate Monday anticipated highly prosecution the Corbett Pennsylvania time his interference political Sandusky Governor Tom general attorney 
3,speaks Jr. Special conference a news Kane state left listens released as picked June 23 subpoenaed authorities Deputy Attorney General H. Geoffery Moulton Attorney General Kathleen results the are probe a investigation the investigation The up steam that figures key State Penn Paterno Schultz vice Jerry Sandusky child molestation Monday Curley athletic president Gary director Tim 
7,followed probe The suggestions made she ordered Kane Attorney campaign her ago years two delayed that General Kathleen Corbett Gov. might have deliberately investigation the coach the program state the Tom general when disgraced assistant legendary football he was attorney 
8,clears governor Pennsylvania report Sandusky slow Corbett CSMonitor.com suspicion video + R did not purposely down investigation an molester convicted Pennsylvania Gov. Tom child showed Sandusky Jerry reasons political report a released Monday 
8,governor Corbett became January 2011 running is currently term a second 
9,reading Share the main story Pa. This Corbett Gov. Page HARRISBURG Tom Pennsylvania 
10,finds delays inexplicable Review Penn. Daniel handling Pennsylvania Kelley HARRISBURG Sandusky Reuters case | 
10,found Jun Mon delays prosecuting coach the 23 2014 pm 8:12 review A Sandusky Jerry Corbett Governor time his former Penn State football but evidence no Penn. EDT Reuters anticipated highly case the released Monday Tom general attorney interference political HARRISBURG child sex abuse 
10,said prosecutors Several review the reeked politics 
11,said found report A Kane Attorney General Monday delayed investigation the reviewing investigation the Kathleen was missteps crucial bringing molester a Sandusky former delays inexplicable justice serial child Penn State assistant football coach Jerry 
