0,reported Inc Digital Adds details Tharakan Anya revenue better-than-expected video recorder maker TiVo shares comments CEO Reuters George May 26 quarterly profit helped subscriptions higher 
0,are boxes TiVo demand high users cable allow as set-top they also access services online video Inc Hulu YouTube Inc Google 
1,thank Call followers 4,044 Inc. Transcripts SA TiVo TIVO you standing by Call Earnings welcome Quarter TiVo TiVo _s Transcript May 26 Inc. Chopra Executives NASDAQ TIVO CFO Development SVP 2016 First TIVO Rogers CEO About bar 10:35 2015 Naveen Crockett Topeka Eagan FBR Ladies Telsey gentlemen Corporate Strategy Analysts Miller David Tom Results Q1 Earnings PM ET Capital Markets Barton Capital Markets Tom Operator 2016 
1,Call EARNINGS Single May 26 2015 page view released Inc. FEEDBACK Results its Earnings their SURVEY TiVo FQ4 2013 
1,Do feel you positive more Inc. results ready these positive less 
4,Posted Calif. SAN AP attracted subscribers another technology recording JOSE Inc. TiVo video its 285,000 quarter its digital fiscal first helping propel company the performance a exceeded that projections analysts 
