0,sells company The products its partners cable TV Media UK the ONO Spain AB Com Hem Sweden 
1,strengthened We relationships our extension partnership the current bundling efforts operator Media ONO 
1,extended April we deal our Media part agreement the committed Media Virgin new has development the TiVo solutions next-generation 
1,was growth International down sequentially saw as subscription we lower function additions Media was a one competitors Virgin offering promotion a versus quarter the temporary bundle included that prior believe which service free we broadband 
1,increased seen We subs the seen that have substantially _ve it Liberty said as we have roll out Virgin you happened since that has 
1,entered We _ve deal a improved deal the new has economics us overall 
