0,announced Play1 :20 review elected NBA the league the Tuesday suspend not to Howard Rockets center Dwight Game 5 finals the Western Conference 
1,confirms NBA call Flagrant 1 Rockets bar Howard Dwight CBSSports.com ET 7:28 Butt Jason confirmed NBA The pm has 1 that finals Howard Rockets was a Flagrant _s foul Bogut Andrew center Dwight Game 4 Conference the Western 
1,means This subject will not be discipline any suspended will further not be 
1,fouled Bogut appeared what elbow to be an shoulders the 
1,averaging is points 16.2 rebounds 13.9 playoffs the 
1,bar Rockets not expecting punishment further fouled Howard CBSSports.com Bogut Howard foul Wise Brandon hard Game 4 shoulders the given was 1 a Flagrant 
1,averaging is points 16.2 rebounds 13.9 game playoffs the recorded has double-doubles three consecutive 
3,announced Windhorst Play1 league the Tuesday :20 3hBrian elected review NBA the suspend not to Howard Rockets center Dwight Game 5 finals the Western Conference 
5,announced Windhorst Play1 league the Tuesday :20 3hBrian elected review NBA the suspend not to Howard Rockets center Dwight Game 5 finals the Western Conference 
