0,Play carmaker has starting Sonatas 2015 arriving cars those have Cars coming dealers updated Sonata the download summer later become the first ship to have that ways three already installed it now can be dealer the now right 2015 own you you can install upgrade the yourself this software Google nav factory currently new smartphone connection 
0,comes Google Now own its dash the supported connection no prompted you Hyundai Auto is yet wireless _ll be install to use How higher cable a app the time the you Connect it free Android Auto first phone your running version Android 5.0 
0,is button a There also calling technologies find which go to you will important want if want listen to back nav Hyundai media you navigation outside coverage wireless broadcast to data radio CD a 
0,_s Here need what you _ll upgrade to significant Why Sonata your it _s candid Hyundai 2015 update Sonata 2015 has been refreshingly inability industry the download patience MyHyundai.com posted until 4GB navigation download to do to auto A little download the is summer later drive larger update the better mobile industry the this USB running Smartphone mobile Android 5.0 or later firmware A USB-to-Micro-USB cable Free Android Auto 
0,do arrives When it will more even CarPlay the showrooms soon lifting the similar Apple heavy needed raise to awareness consumer technologies these 
1,Get automaker happenings family Viewfinder photos World-Herald news the Hyundai is the first launch to signing up video Hall The latest parenting system the Money momaha news Local Android Auto weekly newsletter government 
1,first offer to system Android Auto carmaker Hyundai is the first offer to system Google Android Auto 
1,available Auto Android will soon be models other 
2,automaker is the first offer to system Google Android Auto 
2,allows 2015 The connect users Android to Sonata devices their applications the voice touchscreen smartphone car access Maps Google steering controls wheel 
2,said offer Auto Android also will apps many TextMe more many popular third-party audio Skype that have owners phones their Spotify TuneIn NPR Stitcher iHeartRadio 
2,get Owners existing Sonata 2015 can update software the Navigation free charge dealers starting today Android Auto 
2,announced Google Last working that it January was companies car integrate to system the dashboards their 
2,said believes play that aligns Auto Android principles Hyundai Zuchowski Dave president CEO statement a feature the will also role an safety said statement a is while core interior design safety intuitiveness America Hyundai important automaker the locked screen smartphone The so tempted drivers Auto Android use simplicity Motor becomes are not look to interact phones their down directly 
3,Wed debuts Auto Android 27 Android May Sonata 2015 6:12 AM Share Auto Sonata the 2015 Hyundai 
3,Credit AFP-Relaxnews come Sonatas All will technology Google standard new those sold US the system a smartphone-mirroring board at first anyway navigation 
4,_s Well it finally here announced as car that 2015 the Sonata will be the first production come to equipped Auto Android 
4,plans fact introduce to Auto Android see we cars a up will go them lot many line their global idea this 
4,founded Group The was Ju-yung Chung firm a 1947 headed who construction conglomerate the 2001 death his 
4,subsidiary Limited Motor is a owned wholly Motor the More founded Group The India Hyundai was Ju-yung Chung firm a Hyundai 1947 headed who construction conglomerate the 2001 death his 
4,subsidiary Limited Motor is a owned wholly Company the established was India Hyundai Motor May 1996 
4,announced car that 2015 the Sonata will be the first production come to equipped Auto Android 
5,bar Mike Stevens May 27 car Sonata new 2015 has become the first new offer to connectivity system Google limited although Android Auto availability is currently market the US 
5,downloaded Available models have that Auto Android is update as installed then navigation satellite software a website the port vehicle the USB 
5,SUV model first will be the new Tucson launch which Australia offered to will system Apple models all be system a CarPlay next-generation connectivity 
5,said Speaking TMR Thomas Australia Bill hit that today CarPlay will models other debuts after Australian it Tucson the 
5,has for Auto Android arm Australian yet confirm to coming it timing exact _s 
5,said Thomas Mr carries that out research regular desire market the technologies new describing CarPlay infotainment important quite hand-in-hand launch Tucson the year later this 
6,said Co. Add-Ons automaker Korea South Wednesday release it adding kick service the Hyundai Motor top will car world the will officially off States the month later first links that United this app Inc. U.S. Android Auto Google 
6,said applied platform The Motor will be first sedan the expanded will 2015 Sonata later be models other 
6,said Hyundai reduce integration The will distractions drivers 
