7,said came I Thompson Wigan ago years eight got never him days four 
7,mind Never had that Woods chance no slipping was winning further irrelevance hole every following round him something course the was ambition a personal Thompson 
7,alone Thompson was not reverence his 
7,said came I Thompson Wigan ago years eight got never him days four 
7,mind Never had that Woods chance no slipping was winning further irrelevance hole every following round him something course the was ambition a personal Thompson 
7,alone Thompson was not reverence his 
