0,LEARN MORE Search Home Sections Search Advertisement MAY 26 2015 Coach Photo Attles Warriors the Game 4 Bullets the Washington 1975 
0,Jr. Credit Walter Iooss _ defeated Illustrated Sports had State Golden Monday preparing Attles Advertisement Getty Game 4 finals the was back room his trip the back California Images Shortly Rockets the Western Conference hotel Houston 
0,said have You interview a telephone play to guarantee being home game the does n_t anything 
0,guarding Attles Coverage 16 Caldwell Hawks the Photo Warriors the Joe 1968 St. Louis San Francisco 
0,drafted was 1960 were when Warriors the Philadelphia 
0,coach Attles Associated was the head Warriors the Press completed when May 25 they sweep a win to ago years 40 stunning four-game Bullets the title franchise the Area the powerhouse Washington only years its Bay 50 than more 
0,put went They better lot a Attles 48-34 had squad a playoffs the record a record had that 1975 60-22 star one Barry Rick core a rookies two solid veterans standout Smith Phil Wilkes Jamaal 
0,Attles expected Nobody recalled much us felt lucky that we were just reach to even finals the 
0,said wait They could n_t get to looked then won we floor the day one we up had championship the 
0,developed coach Warriors the system an unusual season 
0,Attles Photo 1968 guard when he was a point Warriors the San Francisco 
0,brought Attles Associated Smith Mullins Jeff Johnson George bench the Press Dickey Derrek Dudley Charles 
0,said thought Everybody using players many so basis a going I thought then regular was wisdom conventional ended until everybody thing it we up winning was the do to 
0,Attles Advertisement But guy the Warrior the coach the was fire-breathing tough life 
0,played star A ball his high Newark ball his selected then backcourt stands who school college A&T North was Warriors the was when feet 6 only Carolina round the franchise the still Philadelphia fifth draft the 1960 
0,intend Initially did not try to figuring have he out Warriors the did n_t much chance a fifth-rounder a 
0,kept But friend a Attles give to Warriors the shot a 
0,Attles Photo ceremony a commemorating championship Warriors the March 1975 
0,spent coach team the has years 55 franchise the season that 
0,finishing Eisenhower Credit was out term his House the Jeff Chiu_Associated Press Dwight D. second White made when first Warriors the 
0,president Kennedy John was 1962 moved when F. Warriors the Francisco San Attles 
0,president Nixon Richard was named when president Ford Gerald running Reagan Ronald M. was player-coach Warriors the 1969 was won when was country the Warriors the title the stepped when N.B.A. Attles down coach season the 1982-83 
0,occupant Warrior But became the current 1600 Avenue Pennsylvania remained a scout manager a ambassador a one followed Bush a general team followed Reagan another Clinton Bill Obama Barack 
0,Attles 
0,made year A coached after Warriors the they it back finals the lost title the Western Conference 
0,find And season the 1977-78 1982-83 could not way a steer to team an depleted increasingly Warriors playoffs the 
0,decided season that had that he had enough telling Mieuli the leaving that colorful owner Franklin he was 
0,Attles losing We recalled were players of reasons financial 
0,is for part the best get that experience this he may part to be championship another bring life his circle full whole basketball 
