0,Jr. Credit Walter Iooss _ defeated Illustrated Sports had State Game 4 Monday preparing Attles Al Advertisement Getty finals the was back room his trip the back California Images Shortly Rockets the Western Conference hotel Houston 
0,recalled wanted I Wilkes really stay to State 
1,dribbles State Curry Warriors 30 Terry Rockets Houston 31 May 25 Stephen Jason quarter the 2015 first Game 4 finals the NBA Western Conference Center the Toyota Texas Houston Monday 
2,Join foul Conversation Nation the 1 find To out more Facebook commenting please read Guidelines the suspended Howard Houston decided after Calif. OAKLAND AP suspended Howard Rockets EDT 8:25 Conversation FAQs will not be Game 5 Rockets center Dwight NBA the uphold to wo n_t be Game 5 p.m. May 26 Photo Press The finals the flagrant his AP Warriors 2015 Associated Western Conference Warriors the Golden 
3,flips State Curry Warriors 30 down upside finals Center the Texas Monday May 25 Stephen quarter the Toyota Houston 2015 second Game 4 Conference the NBA Western 
3,rolled Curry NBA the _s shoulder the 5:52 left quarter the Most Player Valuable Ariza Houston second defeat State Trevor 128-115 
4,shoots center Golden _ Harden AP half the State Warriors Bogut Andrew Houston Rockets guard James second Game 4 
4,shoots Harden Houston center Golden Warriors half the Rockets guard James Bogut Andrew second Game 4 finals the Western Conference Monday 
4,shaking Martinez Ronald Paul Chris is slowly head his aware all that Rockets the are never quite it think when AP _ has State too Houston you are they lead a coming Houston 3-1 finals West is off victory a big says Curry Stephen play he will fall a Somewhere hard Game 4 
4,early It _s too say to want where exactly yanked Houston have Rockets the they them carpet the out from under Clippers the month this becoming team the Warriors the playoff come to ninth NBA Golden back deficit a win series a 3-1 
4,decided They apparently deficit that was n_t a tough enough lost so they games their waking up first three State Monday victory a 128-115 finals the Western Conference 
4,Wednesday Game 5 is State 
4,have They still win to games the next three be two which would State shift already series the a Clippers were which two three the Houston final 
4,Clippers Plus distinction an important State is not the 
4,thought Here _s a unsettling slightly State played Houston actually well pretty 1 2 road the Games 
4,happen quarter A probably wo n_t again Rockets the idea it 45-point first would n_t be the worst prevent to State hot getting early 
4,got We _ve get to make hopefully ahead State make chase them you can run the us punch counterpunch last 
4,_s It did what Memphis winning Game 2 State 97-90 semifinals the West 
4,loss It was State first Arena Oracle months three 
4,tried Morey Houston create to inspiration some hammered not General Manager Daryl own his posting video a long after Rockets the were at home 3 Game account his State 115-80 Twitter 
