0,Jr. Credit Walter Iooss _ defeated Illustrated Sports had State Golden Monday preparing Attles Al Advertisement Getty Game 4 finals the was back room his trip the back California Images Shortly Rockets Houston Western Conference hotel 
0,returned Curry eventually game the start presumably will Game 5 night try when Calif. Oakland Wednesday Warriors the will again close to out Rockets advance finals the N.B.A. time the first years 40 
1,dribbles State Golden 30 Terry Rockets 31 May 25 Curry Warriors Jason quarter the 2015 Stephen first Game 4 finals the NBA Western Conference Center the Toyota Texas Houston Monday 
2,Check suspended Let know friends network your out story this Sent CancelSend wo n_t be Game 5 reading what social USATODAY.com http:__usat.ly_1HJzfbd Warriors you are Post Howard Rockets 
2,Join foul Conversation Nation the 1 find To out more Facebook commenting please read Guidelines the suspended Howard Houston decided after Calif. OAKLAND AP suspended Howard EDT 8:25 Conversation FAQs will not be Game 5 Rockets center Dwight NBA the uphold to wo n_t be Game 5 p.m. May 26 Photo Press The finals the flagrant his AP Warriors 2015 Associated Western Conference Warriors the Golden State 
2,argued announced Before McHale coach Kevin retaliating that league the ruling the Howard was contact the upgraded flagrant the made Bogut foul should not be 
3,said Curry speak who game the felt that did not reporters Tuesday he fine missing seven shots his three his grew as returning 11 first lead Rockets back 15 
4,shoots Harden AP _ center Golden half the Houston Rockets guard James State Warriors Bogut Andrew second Game 4 
4,shoots Harden Houston center Golden State half the guard James Warriors Bogut Andrew second Game 4 finals the Western Conference Monday 
4,shaking Martinez Ronald Paul Chris is slowly head his aware all that Rockets Houston are never quite it think when AP _ has State Golden too you are they lead a coming Houston 3-1 finals West is off victory a big says Curry Stephen play he will fall a Somewhere hard Game 4 
4,early It _s too say to want where exactly yanked Houston have Rockets they them carpet the out from under Clippers the month this becoming team the Warriors the playoff come to ninth NBA Golden State back deficit a win series a 3-1 
4,great But Rockets have been good when things are n_t makes that them dangerous little a 
4,shrug Rockets 
4,lost Rockets points a combined defeat a five 99-98 Game 2 get when Harden James could n_t off shot a fumbling ball the last-second double-team a Curry Stephen Thompson Klay 
4,happen quarter A probably wo n_t again Rockets idea it 45-point first would n_t be the worst prevent to State Golden hot getting early 
4,tried Morey Houston create to inspiration some hammered not General Manager Daryl own his posting video a long after Rockets were at home 3 Game account his State Golden Twitter 115-80 
4,want They end to series the much as Wednesday want as Rockets extend to it Game 6 Houston 
5,Posted bar Share Ultimate May 26 cleared Feigen Jonathan Rockets this 2015 Howard Dial was play to Jenny Creech Rockets center Dwight Game 5 ruled after finals the NBA the upgraded that Western Conference foul his would not be flagrant 3 Game 
5,foul coach argued McHale Kevin should have even been a flagrant had convinced that he was not foul the 
5,Bogut Hey Andrew watch out face your Tags https:__t.co_fVCARvxfz7 http:__t.co_OXfL4mOYzG Search Sign Subscribe now up 
