1,voted He was player competition the led hosts the best title the goals four one final the 
3,voted He was player competition the led hosts the best title the goals four one final the 
4,beat match another game a dismal Australia 3-0 Baixada the importance no Arena da Curitiba 
4,marked clash The end the era an the sacking players Villa Xavi 
8,finished match an Spain Champions win engagements their inconsequential day the Australia consolation a 3-0 
10,had season His highs lows punctuated was first injuries two blessing although this may have been a reduced as it expectations excessive meant arrive that he did not Cup the World exhausted 
12,ended But he win tournament the final the goals five Stadium the two 3-0 the Maracana 
