10,shooting Ukraine down plane a Malaysia Airlines 
10,shot aircraft The was down Ukraine killing people 298 all board 
10,said 's There Youngsung Kim head the Employees Korea South Service Pension risk geopolitical investment overseas Government Seoul 
10,crashed Co. Crisis en route Lumpur Kuala Amsterdam battleground the threatening escalate to The Boeing 777 main war Ukraine tensions crisis Europe end the civil worst geopolitical War the Cold 
12,slapped sanctions further as Russia was Ukraine 
12,imposed administration The sanctions banks Russian pressure to Obama Union the companies energy firms defense country the European attempt the stop to latest meddling 
12,slapped Obama Economic sanctions more companies Russian salvo U.S. the Ukraine Squeeze President Barack latest confrontation the international actions Russia 
13,imposed administration The acting concert Union the sanctions banks Russian yesterday bid a Obama European companies energy firms defense punish to country the 
