0,called bsmp2_via A off wedding their just days slated before A A Meyer Instagram they were tie to Sgt. Dakota Palin Bristol knot the Saturday Kentucky 
0,became bsmp2 couple The engaged March launching plans whirlwind married to get month this 
0,said bsmp2 post a blog mother the working that 24-year-old single she son her are rebuild to pictured here young lives their circumstances different much Meyer 
0,posted bsmp2 Palin Bristol March shows off ring her engagement photo an Instagram 
1,spent Palin Bristol however day the friends Alaska shared photos weekend her Conversations Get Politics Options posted photo A emailed stories top Palin Bristol @bsmp2 May 23 PDT 5:16 me day each posts blog 2015 pm of More 
3,Posted Palin Instagram Bristol 
