0,stated know I she mentioning while greater plan God are Alaska son her is anything else beginning rebuild to anticipated than 6-year-old engaged father whose lives our circumstances different much we she was twice to Johnston Levi 
1,continued She know I greater plan God are Alaska is anything else beginning rebuild to anticipated than lives our circumstances different much we 
2,shared weekend the Bristol photographs herself back home Alaska son her young 
2,concluded know I she post her greater plan God are Alaska is anything else beginning rebuild to anticipated than lives our circumstances different much we 
3,posted Instead she picture a Tripp son blog her shares whom wrote when she Johnston deadbeat she note the admitting going that dad Levi she was not Meyer to become Mrs. 
3,explained know I she greater plan God are Alaska is anything else beginning rebuild to anticipated than lives our circumstances different much we 
4,added Palin 24 know I greater plan God is are Alaska anything else beginning rebuild to anticipated than lives our circumstances different much we 
