2,falls Everyone NY champions it Daily News 's the true fans and right that their get up back 
2,told person The News Daily decided he shot who drive to hour the Saldana the Antonio San watch to video Robert 33 Tex. Carrizo game the restaurant a Springs friends 
2,told Contreras News lost he balance his car the fell sustaining ankle a broken 
5,celebrate championship fifth Spurs | ANTONIO GulfNews.com celebrated Spurs The SAN title their history franchise climbing barges floated that San Antonio fifth down walk the river followed rally a triumphant arena the Alamodome 
6,are Champs Duncan Tim Again Spurs the back NBA the Are NBA News ABC Spurs the San Antonio year One defeat a heartbreaking 
9,winning Spurs San 10:31 leads Mills AM Antonio Ballantyne Adrian Spurs glory NBA Patty Network News Championship 1:28 proved Mills Patty Corp Australia June 17 instrumental clinching Championship the netting points 17 2014 NBA Antonio San performance a dominant 
