0,led Parker Spurs the year this minutes 29.4 game 
3,received Duncan Ginobili Manu standing ovations introduced being Parker crowd the 
4,Spurs connection The bellowed Parker guard crowd the French barge the riding he was veteran his fellow league the Diaw Boris French basketball 
5,received Duncan Ginobili Manu standing ovations introduced being Parker crowd the 
6,PHOTO Gutierrez/AP Photo falls Confetti Game 5 finals the Spurs the Heat the June 15 NBA basketball San Antonio Miami Antonio San 2014 
7,rebound players Our ca n't shoot pass players Tim role Manu role 
8,ANTONIO Smith/european Larry SAN trophy The W. agency pressphoto Larry O'Brien rested legs Duncan Tim wrapped as he arms his Parker Ginobili Manu duo the been that has him four championships his five Spurs the San Antonio 
9,feeling do To it was an amazing it Duncan obviously Parker Tim Ginobili Manu people three teammates genuine great 
11,so Even more Parker 
