0,driving Yet push China win to is makers policy ease to status an arcane restrictions capital currency bestowed Fund the International Monetary 
0,followed But streets press the issue the is being saying Jiansheng taxi important fate yuan the popular is driver Wang definitely future China own his 
0,said means Internationalization renminbi the he using name yuan the use that alternative tourists foreign could it way a convenient more 
0,dropped March Zhou plan a speak to policy monetary lobby so forum a he could panelist fellow IMF Managing Lagarde Director Christine admission 
0,said be failure A information Jie technology may want because China enter to worker Miu 29 U.S. the does n_t see to basket the power the SDR rising China 
0,taking University the Min student Daniel is view the Central Finance Economics long 
2,source value The has been a tension years â partners major yuan the known also Chinaâ dol s â dol led States the trade renminbi the dol accusing United 
2,critical IMF The nevertheless was 
3,said reference a Fund the highlights position still-too-strong has how reduce need the external China still surplus a appreciation yuan to savings excess achieve balance sustained reforms other part which large trade external policy are indeed agenda authorities the 
4,said says Daily Photo_China Fund the International Tuesday maintaining time a agency Multilateral undervalued currency undervalued currency The Monetary undervalued that long lending is not is longer no Chinese known yuan the currency China was modestly renminbi 
2,BEIJING said â Chinaâ dol s Fund the Tuesday currency yuan is dol dol no International Monetary alleged which undervaluedâ longer Washington has long manipulated was 
3,undervalued currency 06:30 Breaking Trade Unfair is longer no appreciation its quicken government the IST BEIJING China _s yuan May 27 recent substantial should get reforms 2015 to having a floating rate exchange 
