1,rush Schools Favorite Rushing rise costs field_court take camps satellite Fans Iron field the celebrate Alabama the comments Meetings SEC Football center Bowl game Auburn No. 1 No. 4 Day 1 stage Auburn 2013 Iron Bowl NCAA football Nov. Sunday 1 2013 Stadium Jordan-Hare Ala. Auburn 
1,fell Auburn upset return a short TD attempt Alabama final-second field goal 
1,Discussions Opinion Related Active Read Most About Us Stories Sports Us © rights 2015 Media Group All reserved 
1,reproduced material The may not be distributed transmitted cached used otherwise submit otherwise site this upload except site this apply with you permission the content all prior written Rules Media Group Community 
2,Posted Auburn May Tuesday 26 2015 pm 9:25 
3,barred rule Such would have Taylor defensive transferring dismissed months six a lineman Jonathan after he was Georgia charge a domestic violence 
3,is Taylor longer no program the incident another domestic violence 
3,said Saban coach make restricting transfers will Nick system SEC the disciplined if a farm leagues all player a is another the other 
5,said _m I Saban coach Nick not it 
5,arrested transfer a Taylor was time a violence domestic time this second Tuscaloosa 
5,kicked time that Taylor had been off too 
5,had player a use it could help to beat Georgia Oct. 3 year this Athens keeping if you _re track 
5,had player a have Georgia help that did n_t could win it SEC the 
7,argued Saban coach puts rule the SEC the Nick disadvantage a 
8,said need going If Saban coach Nick we then get to we _re compete to going everybody going everybody rules our alignment all so championship the _s play to _s compete to we _re field a system the that level playing playoff 
8,include camps The stops Florida Texas one-day country the California 
