0,called Slive commissioner change the net a Mike safety 
0,said picks Most time the up kind those sideline the things 
1,said Wrapping up Slive commissioner Mike plans the on increasing substantially day the Hilton the Tuesday evening SEC fines the first meetings league the Sandestin Beach Florida Destin celebrations the spring post-game 
1,explained attempt It _s an change to behavior 
1,want did not go to says finalized figures those detail numbers the will soon be released conclude before steeper placed that meetings week the Friday were table the Tuesday 
1,said picks Most time the up kinds those sideline the things 
1,prepared hopes While league the is also change to SEC the adopt NCAA the legislation its banned if will rule its camps satellite conference-wide tours the are not nationally recruiting refer as them 
1,said are We not favor it proposed 
3,sound Slive SEC did n_t supportive like commissioner Mike he was idea the 
3,said noted He had Goodell NFL has issues making decisions discipline commissioner Roger designed bodies The are deal to judicial institutions behavior student-athlete 
4,said changed I coach the South mind my Carolina bit a listening Slive little 
5,tapped Retiring Slive commissioner brakes the conference his instituting kind any Mike policy personal conduct 
6,said give That Slive SEC commissioner will us check another Mike event the see that field the team the does n_t really someone had that may have injury a head 
6,says gives this us net a safety pick in sidelines case do n_t up player a injured 
7,come Slive SEC did n_t down keep whether one only Commissioner Mike conference the should change rule the that it _s a longstanding 
7,said Slive Network planned Network the show to bounty events 1,000 SEC network its year its television online first began which Aug. 14 
7,said date aired network the has events 1,400 
7,said _re We off start an auspicious 
7,said Beginning fall this have SEC the will observer an box the games football intent the independent medical press help to monitor teams injuries concussion-type missed that might otherwise be 
