0,taking Conference The is steps identify to Southeastern better concussions 
1,going price Hunt_vhunt@al.com Vasha is up The of rushing field the court and Conference Southeastern the 
1,waited leagues Power each have votes count that Five SEC the double Conference Coast Pac-12 Big Ten 12 Big 
2,wants Conference The create to Southeastern field a landscape the level playing college football 
3,considering Fla. DESTIN close is decisions discipline made to bar Conference The be commissioner the Southeastern league school each individual 
7,picked Golson State Florida highlighted issue an about coaches many have rule league the Southeastern graduate transfer 
8,wants Fla. Conference The LONG MARK field a Southeastern Last Modified level playing May Tuesday 26 2015 DESTIN 11:37 p.m. 
8,have SEC The rules league-wide coaching guest part want because Conference Coast they do n_t coaches their treading turf other each 
