3,barred rule Such would have Taylor lineman transferring Alabama a Jonathan dismissed months six after he was Georgia charge a domestic violence 
3,is longer no incident another domestic program the violence Alabama 
5,accompanied mention Any must be mention the proposal the 
5,arrested transfer a was time a violence domestic time this Alabama second Tuscaloosa 
5,kicked time that had been off Alabama too 
5,criticized Saban was widely taking 
5,need sense a what did coach the getting football powerful most program that powerful most 
