1,going Williams is title her Garros had American the third major problems few dispatching Hlavackova ranked who world the made has is 166th never it round the first Paris 
2,said feel I Williams had like work sometimes I practices some things do n_t always out way the good coming Garros like you would 
3,cracked player women The herself up flubbed after No. 1 tennis she lob a match her Garros Tuesday easy-looking deceptively first-round Hlavackova Andrea 
5,withdrew number The Rome injury the mattered it world one little Tuesday Hlavackova the crushed Republic Czech 6-3 6-2 Garros 
6,defeat Williams the it was her second opening years three 15th-seeded Garros 
7,withdrew 1Â The Rome injury the mattered it world No. Tuesday little crushed as she Hlavackova Republic Czech 6-3 6-2 Garros 
