2,holds network her OWN she helped stake a cable produce acclaimed the programs successful critically Selma syndicated Phil through Films her Harpo 
4,list Forbes women 10 powerful most Obama Michelle 1 Merkel Angela old years 60 Politician 2 Clinton Hillary years 67 Politician 3 Gates Melinda years 50 Yellen Janet years 68 Economist 5 Barra Mary years 53 CEO Motors General Lagarde Christine years 59 Philanthropist 7 Rousseff Dilma years 67 Politician 8 Sandberg Sheryl years 45 COO Facebook 9 Wojcicki Susan years 46 CEO YouTube 10 old years 51 Lady First old old old old 6 old old old old 
5,Text subscribers BREAKING INQ Philippines 4467 Globe Smart Sun 
5,subscribe To newspaper the Daily call 896-6000 2 +63 email request your Inquirer Philippines the Manila Metro here subscription Cebu Metro 
5,Contact Daily the desk Inquirer day 
5,write Or Advocate Readers The Roces c_o Daily Streets Mascardo City Makati Manila Metro Philippines nos fax Inquirer Chino Yague Avenue corner 
