1,supports NYTimes.com longer no Internet Explorer 8 earlier 
3,rule Times Los ballots If justices Supreme eventually favor appeal the say drawn districts voting Angeles Court should be on number the voters eligible 
3,Should accepts Times Angeles voting drawn districts Court U.S. case bring that be using data Supreme could changes big way the population total counting eligible citizens only drawn districts voting vote to are 
5,explains clarified court The Times New York has never officially refers whether phrase the having districts voting eligible number the vote to same people number the same people 
5,pic.twitter.com_RYNLrgQDeQ O_Connor Flannery to appear USPS new Forever stamp http:__t.co_Epx4OOgzGY debut stamp The will June 5 raised that packages 3-ounce feathers feature reports the nod a O_Connor peacocks farm family her Georgia peacock Los Angeles fact the 
6,rule Times Los ballots If justices Supreme eventually favor appeal the say drawn districts voting Angeles Court should be on number the voters eligible 
6,Should accepts Times Angeles voting drawn districts Court U.S. case bring that be using data Supreme could changes big way the population total counting eligible citizens only drawn districts voting vote to are 
